news_id,title,content,full_story_link,meneos,clicks,karma,positive_votes,anonymous_votes,negative_votes,category,comments,published_date,user,source,source_link,scraped_date
4034114,Trump lleva al dólar y a la economía de EEUU a una 'tormenta perfecta' de recesión e inflación en apenas mes y medio,"Los diputados y senadores llevan semanas escuchando a ciudadanos furiosos por los precios, y los aranceles a sus principales socios comerciales no van a hacer sino empeorar la situación.",https://meneame.net/story/trump-lleva-dolar-economia-eeuu-tormenta-perfecta-recesion-mes,87,806,429,47,40,0,actualidad,40,2025-03-04 13:40:04,Icelandpeople,eleconomista.es,https://www.eleconomista.es/economia/noticias/13248653/03/25/trump-lleva-al-dolar-y-a-la-economia-de-eeuu-a-una-tormenta-perfecta-de-recesion-e-inflacion-en-apenas-mes-y-medio.html,2025-03-04 14:12:38
4033841,"Los lobos y su ""pequeño"" milagro ecológico",Qué ocurre en un parque nacional cuando reintroduces ejemplares de lobos.,https://meneame.net/story/lobos-pequeno-milagro-ecologico,99,1522,428,62,37,0,cultura,25,2025-03-04 13:15:02,RaulUrdaci,x.com,https://x.com/Alexalvz12/status/1896275671858479364,2025-03-04 14:12:38
4034033,Las comunidades de vecinos cambian para siempre a partir del 3 de abril: nuevos poderes para regular los pisos turísticos,"Las comunidades de vecinos en España están a punto de ganar gran influencia sobre las viviendas turísticas en sus edificios. A partir del 3 de abril de 2025, entra en vigor una reforma de la Ley de Propiedad Horizontal (LPH) que permitirá a los residentes tomar decisiones clave sobre los pisos de alquiler vacacional en sus inmuebles. Esta modificación busca equilibrar los intereses de propietarios, inquilinos y turistas, en un intento por regular una actividad que ha generado tensiones en muchos barrios.",https://meneame.net/story/comunidades-vecinos-cambian-siempre-partir-3-abril-nuevos-pisos,122,867,433,65,57,0,actualidad,27,2025-03-04 12:50:03,mandelbr0t,infobae.com,https://www.infobae.com/espana/2025/03/02/las-comunidades-de-vecinos-cambian-para-siempre-a-partir-del-3-de-abril-nuevos-poderes-para-regular-los-pisos-turisticos/,2025-03-04 14:12:38
4034099,Contra Trump: países nórdicos lanzan un boicot a los productos estadounidenses,"Las críticas a las políticas de Donald Trump van en aumento y, en varios países, los movimientos llaman a boicotear los productos estadounidenses. Es el caso, en particular, de Suecia, donde esta práctica está muy arraigada entre la opinión pública.",https://meneame.net/story/contra-trump-paises-nordicos-lanzan-boicot-productos,191,810,501,90,101,0,actualidad,48,2025-03-04 12:50:02,Ratoncolorao,rfi.fr,https://www.rfi.fr/es/europa/20250304-en-respuesta-a-trump-países-nórdicos-lanzan-un-boicot-a-los-productos-estadounidenses,2025-03-04 14:12:38
4033976,Trump ordena que grandes masas de bosque sean cortadas para conseguir madera [ENG],La orden del presidente de Estado Unidos para expandir la tala de árboles a 11 millones de hectáreas ignora las leyes para proteger especies amenazadas.,https://meneame.net/story/trump-ordena-grandes-masas-bosque-sean-cortadas-conseguir-madera,214,469,399,94,120,1,actualidad,47,2025-03-04 12:25:02,Mediorco,theguardian.com,https://www.theguardian.com/us-news/2025/mar/03/trump-national-forest-executive-order,2025-03-04 14:12:38
4033996,"Murcia, entre el meme y el escarnio: “Solo salimos en la tele cuando ocurre un hecho macabro o cuando pasa algo estúpido”","La imagen de Murcia en el imaginario popular español se ha forjado a partir de una tradición de sátira y exageración que trasciende la geografía real de la Región. Con el tiempo, la murcianidad se ha convertido en un lienzo en el que se proyectan tanto el ingenio como el absurdo, transformando sus peculiaridades en símbolos de lo exótico y lo inesperado. Así, entre memes virales y chascarrillos en tertulias, Murcia se erige como un referente que permite a la gente explorar—y reírse— de las diferencias regionales.",https://meneame.net/story/murcia-entre-meme-escarnio-solo-salimos-tele-cuando-ocurre-hecho,91,1300,473,48,43,0,ocio,102,2025-03-04 11:45:02,karakol,eldiario.es,https://www.eldiario.es/murcia/murcia-meme-escarnio-salimos-tele-ocurre-hecho-macabro-pasa-estupido_1_12050660.html,2025-03-04 14:12:38
4033720,"Una auditoría acorrala a Susana Pérez Quislant (PP) y revela el ""dineral"" que se gastó en Pozuelo en plena pandemia","La auditoría de la Cámara de Cuentas sobre la gestión económica en Pozuelo de Alarcón ha revelado graves irregularidades, situando en el centro de la polémica a Susana Pérez Quislant, exalcaldesa y actual secretaria de la mesa de la Asamblea de Madrid. Dentro del PP, muchos consideran que su elección fue un error evitable porque ""esto se sabía"", afirman fuentes internas.",https://meneame.net/story/auditoria-acorrala-susana-perez-quislant-pp-revela-dineral-gasto,232,654,410,100,132,5,politica,16,2025-03-04 11:30:02,Bhernan,elinfiltrado.es,https://www.elinfiltrado.es/articulo/politica/auditoria-acorrala-susana-perez-quislant-pp-revela-dineral-que-gasto-pozuelo-plena-pandemia/20250303102149003004.html,2025-03-04 14:12:38
4034046,Asesinaron a un turista en Canarias al atravesarlo con una viga,"los agresores lo acorralaron y le clavaron una viga de hierro en el dorso. Una vez en el suelo y agonizando, le sustrajeron su teléfono móvil, dejando clara la extrema violencia del ataque. Las investigaciones han resultado en la detención de cuatro ciudadanos marroquíes en situación irregular.",https://meneame.net/story/asesinaron-turista-canarias-atravesarlo-viga,302,2282,406,137,165,4,actualidad,250,2025-03-04 10:55:03,turuleto,laprovincia.es,https://www.laprovincia.es/sucesos/sucesos-en-canarias/2025/03/01/asesinaron-turista-canarias-atravesarlo-viga-114819362.html?session_amp=0,2025-03-04 14:12:38
4033904,Este no es el camino,"Una cumbre europea en la capital del único país que ha salido de la UE, el más claramente alineado con los intereses de EEUU, para disparar el gasto militar e instaurar el régimen de guerra y austeridad en Europa. [Hilo]",https://meneame.net/story/este-no-es-el-camino,205,1731,425,91,114,21,actualidad,159,2025-03-04 10:20:02,Thony,threadnavigator.com,https://threadnavigator.com/thread/1896599780987654481/?save_to=notion,2025-03-04 14:12:38
4033914,Las vidas perdidas en Gaza [ENG],"Aunque el alto el fuego puso fin a los combates el 19 de enero, la lista de muertos del Ministerio Sanidad de Gaza sigue creciendo: en más de 1.400 desde el comienzo de la tregua porque se están desenterrando cadáveres de entre los escombros a medida que la gente regresa a los barrios devastados. Casi una cuarta parte de los muertos eran niños menores de 12 años. Más de 1.200 familias quedaron completamente aniquiladas, incluida una familia entera de 14 personas. El número de varones palestinos de entre 15 y 65 años muertos, fue de 19.185.",https://meneame.net/story/vidas-perdidas-gaza-eng,175,409,404,73,102,1,actualidad,12,2025-03-04 09:50:02,Hombre_de_Estado,reuters.com,https://www.reuters.com/graphics/ISRAEL-PALESTINIANS/FATALITIES/byvrxlqeqve/,2025-03-04 14:12:38
4033989,China contraataca a Trump con aranceles recíprocos y sanciones a empresas estadounidenses (EN),"China ha respondido a los aranceles de importación de Estados Unidos con más aranceles, una demanda en la Organización Mundial del Comercio y restricciones a las exportaciones de determinadas empresas",https://meneame.net/story/china-contraataca-trump-aranceles-reciprocos-sanciones-empresas,324,1119,409,138,186,1,actualidad,127,2025-03-04 09:05:02,Tkachenko,scmp.com,https://www.scmp.com/economy/global-economy/article/3300948/china-hits-back-trump-reciprocal-tariffs-sanctions-us-firms,2025-03-04 14:12:38
4033958,La Audiencia Nacional pide a la Policía todos los informes sobre Podemos y sus dirigentes durante el Gobierno del PP,"El juez Pedraz ordena a la Dirección Adjunta Operativa y a la UDEF que consulte las bases de datos sobre investigaciones al partido, la fundación CEPS o los diputados elegidos en 2015 dentro de la causa por la guerra sucia contra el partido.",https://meneame.net/story/audiencia-nacional-pide-policia-todos-informes-sobre-podemos-pp,454,579,391,193,261,0,politica,39,2025-03-04 08:25:03,exmarginalexquoque,eldiario.es,https://www.eldiario.es/politica/audiencia-nacional-pide-policia-informes-dirigentes-durante-gobierno-pp_1_12099944.html,2025-03-04 14:12:38
4033883,Romance de Curro el Palmo. Joan Manuel Serrat 1989,"Aunque Curro El Palmo es un personaje inventado, Serrat se inspiró en el Nano de Jerez para llevarlo a la canción. Dijo Serrat en alguna ocasión que tuvo buenos guías por ese mundo. Uno de ellos fue el genial ""Beni de Cadiz"", gran cantaor, con el que visitó los tablaos más famosos de Madrid y conoció a primeras figuras del cante jondo. La canción en sí es una muestra de giros, expresiones e incluso gramática propios del andaluz. Por ejemplo, que el tablao de la canción sea propiedad de un tipo apodado ""El Lacio"" llama la atención: un hombre la",https://meneame.net/story/romance-curro-palmo-joan-manuel-serrat-1989,96,772,401,50,46,0,cultura,28,2025-03-04 07:35:02,zanguangaco,youtube.com,https://www.youtube.com/watch?feature=shared&v=y0WVPRuOPAY,2025-03-04 14:12:38
4033948,Condenada a seis años y medio de cárcel una enfermera que accedió al historial clínico de una mujer y de su hijo sin su consentimiento,"La denuncia contra la enfermera se originó cuando la madre del menor sospechó que su historial médico había sido consultado sin autorización, tras escuchar comentarios sobre su estado de salud y el de su hijo en el entorno escolar.",https://meneame.net/story/condenada-seis-anos-medio-carcel-enfermera-accedio-historial-sin,225,2616,391,93,132,1,actualidad,80,2025-03-04 06:50:03,Gotsel,infobae.com,https://www.infobae.com/espana/2025/03/02/condenada-a-seis-anos-y-medio-de-carcel-una-enfermera-que-accedio-al-historial-clinico-de-una-mujer-y-de-su-hijo-sin-su-consentimiento/,2025-03-04 14:12:38
4033920,Una increíble foto de la NASA capta cómo se rompe la barrera del sonido [Ing],"Una imagen recién publicada muestra cómo se rompió la barrera del sonido el 10 de febrero, cuando el primer avión supersónico civil de Estados Unidos completó su segundo vuelo a velocidades superiores a Mach 1. Los equipos de la NASA sobre el terreno utilizaron la fotografía Schlieren para captar las ondas de choque alrededor del avión de pruebas XB-1 de Boom Supersonic mientras surcaba el aire. ""Esta imagen hace visible lo invisible"", declaró Blake Scholl, fundador y Director General de Boom Supersonic, en un comunicado de prensa.",https://meneame.net/story/increible-foto-nasa-capta-como-rompe-barrera-sonido-ing,100,2856,414,46,54,0,ciencia,18,2025-03-04 06:00:02,JanSmite,edition.cnn.com,https://edition.cnn.com/2025/03/03/travel/boom-supersonic-nasa-photo-sound-barrier-broken/index.html,2025-03-04 14:12:38
4033881,Emergencia situación 0 por inundaciones en toda la provincia de Castellón; litoral norte de Alicante y en toda la provincia de Valencia,"El Centro de Coordinación de Emergencias de la @generalitat  establece:  Emergencia situación 0 por inundaciones en toda la provincia de Castellón; litoral norte de Alicante y en toda la provincia de Valencia (esta declaración no modifica  la situación de aquellos municipios declarados en Situación 1 y 2 por motivo de la DANA del  29/10/2024). Recomendaciones: Cierre de la circulación en barrancos, ramblas y alrededores   Suspensión de actividades al aire libre   Suspensión de actividades escolares y educativas",https://meneame.net/story/emergencia-situacion-inundaciones-toda-provincia-castellon-norte,164,1190,393,70,94,1,actualidad,46,2025-03-04 05:20:03,Tunguska08Chelyabinsk13,x.com,https://x.com/GVA112/status/1896611515349770641,2025-03-04 14:12:38
4033782,"Quién es Miss Asturias: Claudia Montes, la enchufada socialista que Ábalos pagaba a la vez que a Jésica","Si el caso de Jésica Rodríguez ya levantó sospechas, la aparición de Claudia Montes, Miss Asturias 2017, añade un nuevo capítulo a la historia. La Miss recibió pagos de Koldo García, asesor de Ábalos. Pero es que además, Ábalos pagaba a su presunta amante en los mismos meses en los que también se realizaron transferencias a Jésica Rodríguez.",https://meneame.net/story/quien-miss-asturias-claudia-montes-enchufada-socialista-abalos,196,3472,395,96,100,4,actualidad,70,2025-03-04 04:30:03,Livingstone85,eleconomista.es,https://www.eleconomista.es/informalia/famosos/amp/13246972/quien-es-miss-asturias-claudia-montes-la-amante-socialista-que-abalos-pagaba-a-la-vez-que-a-jesica,2025-03-04 14:12:38
4033954,El prototipo de procesador cuántico superconductor funciona 10¹⁵ veces más rápido que la supercomputadora más rápida (eng),"Este prototipo funciona a una velocidad 10¹⁵ veces superior a la del superordenador más rápido disponible en la actualidad y un millón de veces superior a los últimos resultados publicados por Google. Este logro marca un hito en la mejora del rendimiento de la computación cuántica, tras el éxito de Zuchongzhi-2. Los resultados de la investigación se han publicado como artículo de portada en Physical Review Letters . dx.doi.org/10.48550/arxiv.2412.11924 (abierto)",https://meneame.net/story/prototipo-procesador-cuantico-superconductor-funciona-10-veces,134,780,430,63,71,1,tecnología,38,2025-03-04 03:40:06,onainigo,phys.org,https://phys.org/news/2025-03-superconducting-quantum-processor-prototype-faster.html,2025-03-04 14:12:38
4033963,La Gaza que nunca antes habías visto,"La Gaza que nunca antes habías visto, filmada antes de Octubre de 2023.",https://meneame.net/story/gaza-nunca-antes-habias-visto,209,3129,418,89,120,5,cultura,34,2025-03-04 03:05:03,Supercinexin,tiktok.com,https://www.tiktok.com/@yousefalhelou/video/7305181221720444193,2025-03-04 14:12:38
4033919,La Casa Blanca trabaja en un plan para levantar las sanciones a Rusia,"La Casa Blanca trabaja en un plan que podría levantar sanciones a Rusia, en un nuevo paso en el acercamiento entre los dos Gobiernos y sus negociaciones para el fin de la guerra en Ucrania, según ha adelantado la agencia Reuters, que cita a un alto cargo estadounidense y una persona al corriente del asunto. La oficina presidencial ha pedido a los departamentos de Estado y del Tesoro que elaboren una lista de las sanciones que se podrían eliminar. Esa lista se presentaría a los representantes rusos en las próximas reuniones entre delegaciones..",https://meneame.net/story/casa-blanca-trabaja-plan-levantar-sanciones-rusia,194,289,428,89,105,2,actualidad,97,2025-03-04 02:20:03,cocolisto,elpais.com,https://elpais.com/internacional/2025-03-03/ultima-hora-de-la-guerra-de-rusia-y-ucrania-en-directo.html,2025-03-04 14:12:38
4033957,"Ontario cortará las exportaciones de electricidad de EE.UU. “con una sonrisa en la cara”, dice el primer ministro de Ontario [ENG]","""Dependen de nuestra energía, necesitan sentir el dolor"", dijo el lunes el primer ministro Doug Ford sobre el recorte de las exportaciones de electricidad de Ontario a Estados Unidos. Mientras Canadá se prepara para que el presidente estadounidense Donald Trump desate su guerra comercial contra Canadá el martes, Ontario está listo para desconectarla. Estados Unidos es un importante cliente de la electricidad canadiense; todas las redes eléctricas estadounidenses (con excepción de Texas) están interconectadas con las provincias canadienses.",https://meneame.net/story/ontario-cortara-exportaciones-electricidad-ee-uu-sonrisa-cara,300,1081,461,129,171,0,politica,57,2025-03-04 01:45:02,Bifaz,torontosun.com,https://torontosun.com/news/provincial/ontario-will-cut-off-u-s-electricity-exports-with-a-smile-on-my-face-ford-says,2025-03-04 14:12:38
4033915,Podemos pide a la jueza que investigue los movimientos de los policías que escoltaban a Mazón el día de la DANA,"La acusación popular que ejerce Podemos ha pedido a la jueza de la DANA que se identifique a los agentes de policía que escoltaron al president Carlos Mazón el pasado 29 de octubre, día de la catastrófica barrancada. La formación morada, según un escrito al que ha tenido acceso elDiario.es, también solicita un informe sobre los movimientos de los escoltas durante toda aquella jornada, en la que Mazón alargó una comida en el restaurante El Ventorro con una periodista.",https://meneame.net/story/podemos-pide-jueza-investigue-movimientos-policias-escoltaban,374,377,443,150,224,0,actualidad,36,2025-03-04 01:15:03,nitsuga.blisset,eldiario.es,https://www.eldiario.es/comunitat-valenciana/pide-jueza-investigue-movimientos-policias-escoltaban-mazon-dia-dana_1_12099553.html,2025-03-04 14:12:38
4033953,WSJ: EE.UU. suspende el flujo de armas a Ucrania (inglés),"La administración Trump ha dejado de financiar nuevas ventas de armas a Ucrania y está considerando congelar los envíos de armas de las existencias de Estados Unidos, medidas que amenazan la capacidad de Kiev para luchar en un momento crítico en su batalla contra las fuerzas rusas, dijeron funcionarios actuales y anteriores de Estados Unidos. El financiamiento se detuvo en las últimas semanas en medio de la congelación de la ayuda extranjera por parte de la administración. Pero la medida para cerrar potencialmente el oleoducto principal para...",https://meneame.net/story/wsj-ee-uu-suspende-venta-armas-ucrania-ingles,178,436,434,93,85,2,actualidad,184,2025-03-04 00:50:02,cocolisto,wsj.com,https://www.wsj.com/politics/national-security/u-s-hitting-brakes-on-flow-of-arms-to-ukraine-980a71d1,2025-03-04 14:12:38
4033876,"Feijóo asegura que Mazón no estuvo ""a la altura"", pero dice que debe encargarse de la reconstrucción","El presidente del PP señala por primera vez la gestión del president de la Generalitat, pero defiende que su postura es ""clara desde el primer instante"" y que no va a ""cambiar cada diez días"".",https://meneame.net/story/feijoo-asegura-mazon-no-estuvo-altura-pero-dice-debe-encargarse,215,292,412,82,133,1,politica,68,2025-03-04 00:15:03,Ratoncolorao,publico.es,https://www.publico.es/politica/partidos/feijoo-asegura-mazon-estuvo-altura-pero-dice-debe-encargarse-reconstruccion.html?fbclid=IwY2xjawIywaRleHRuA2FlbQIxMQABHSgf8Tz0Lih2r0u03jMFhm4Ma6Bmz7hT1x7PGZ2QaxEo3UEdGzzFXuAWHA_aem_LRnArAZVFs0RTBI2lbk0ZQ,2025-03-04 14:12:38
4033844,Más de 30 heridos en una colisión entre dos autocares en la avenida Diagonal de Barcelona,"Este lunes, dos autocares han chocado en la avenida Diagonal de Barcelona en un accidente que ha dejado a más de 30 personas heridas, dos de ellas en estado crítico, según han informado fuentes municipales en un balance provisional.",https://meneame.net/story/mas-30-heridos-colision-entre-dos-autocares-avenida-diagonal,111,1186,416,64,47,0,actualidad,29,2025-03-03 23:35:02,Presi007,elperiodico.com,https://www.elperiodico.com/es/barcelona/20250303/accidente-avenida-diagonal-barcelona-autocares-chocan-114891693,2025-03-04 14:12:38
4033872,El caso de Israel: El huracán mundial del activismo de los consumidores [ENG],"Los boicots contra Israel junto con los que se están produciendo en los Balcanes, ilustran el creciente poder del activismo de los consumidores como fuerza de cambio. Estos movimientos son algo más que protestas contra el aumento de los precios o la opresión sistémica: son expresiones de frustración colectiva y convicción moral. Ya se trate de dificultades económicas o de injusticias sociales, revelan una creencia compartida en la capacidad de la gente corriente para desafiar a las instituciones poderosas y exigir responsabilidades [trad en #1]",https://meneame.net/story/caso-israel-huracan-mundial-activismo-consumidores-eng,297,764,436,119,178,0,politica,25,2025-03-03 22:55:02,kipper,turkiyetoday.com,https://www.turkiyetoday.com/opinion/case-of-israel-global-hurricane-of-consumer-activism-122901/,2025-03-04 14:12:40
4033835,"Anoche, “No Other Land” ganó el Oscar a Mejor Documental.  Pero hasta ahora, ningún distribuidor en EEUU ha querido estrenarlo.   ¿Por qué?","La película narra el acoso de la ocupación israelí, los ataques de colonos y las demoliciones de viviendas palestinas en Masafer Yatta, en Cisjordania. Todo esto lo ha vivido, desde niño, Basel Adra, porque Masafer Yatta es el lugar en el que nació y creció, y se hizo periodista para documentar los ataques contra su comunidad.  Adra dijo anoche tras recibir el Oscar: ""Hace dos meses que soy padre, y mi esperanza es que mi hija no tenga que vivir una vida como la mía. Siempre con miedo a la violencia, las demoliciones, el desplazamiento...",https://meneame.net/story/anoche-no-other-land-gano-oscar-mejor-documental-pero-hasta-eeuu,581,741,469,223,358,2,actualidad,22,2025-03-03 22:25:03,awer,x.com,https://x.com/almuariza/status/1896557858382037111?t=9n9qieqHC6AgU6cU56pUFA&s=19,2025-03-04 14:12:40
4033918,Tasas de homicidios en países europeos vs. estados de Estados Unidos (ENG),"Este mapa compara la tasa de homicidios (asesinatos) en varios países europeos con la de los estados estadounidenses en 2020, por cada 100,000 personas. Los datos de Europa provienen de Eurostat, al cual el Reino Unido dejó de contribuir en 2019 (por eso no está incluido). Sin embargo, si el Reino Unido estuviera incluido, su tasa sería de 0.85 (es decir, menos de un asesinato por cada 100,000 personas).",https://meneame.net/story/tasas-homicidios-paises-europeos-vs-estados-americanos,252,6125,485,134,118,0,cultura,73,2025-03-03 22:10:04,Grahml,brilliantmaps.com,https://brilliantmaps.com/homicide-rates-europe-vs-us/,2025-03-04 14:12:40
4033871,Europa responde con contundencia a Estados Unidos y enviará tres millones de cargadores universales a Ucrania,Los dirigentes de  los países aliados de Ucrania reunidos este domingo en torno a Volodimir Zelenski han acordado enviar también 18.000 millones de botellas de plástico con los nuevos tapones europeos que impedirán que el suelo del país en guerra se llene de tapones de plástico que resultan difíciles de recolectar y son una seria amenaza para el futuro.,https://meneame.net/story/europa-responde-contundencia-estados-unidos-enviara-tres-ucrania,297,810,462,149,148,5,ocio,54,2025-03-03 22:05:03,Thornton,elmundotoday.com,https://www.elmundotoday.com/2025/03/europa-responde-con-contundencia-a-estados-unidos-y-enviara-tres-millones-de-cargadores-universales-a-ucrania/,2025-03-04 14:12:40
4033916,Trump confirma que aranceles del 25% a México y Canadá comienzan este martes,"El presidente de Estados Unidos, Donald Trump, confirmó este lunes que los aranceles del 25% a importaciones de México y Canadá entrarán en vigor el martes.",https://meneame.net/story/trump-confirma-aranceles-25-mexico-canada-comienzan-este-martes,251,646,463,122,129,0,actualidad,62,2025-03-03 22:05:02,Icelandpeople,cnnespanol.cnn.com,https://cnnespanol.cnn.com/2025/03/03/eeuu/trump-confirma-aranceles-mexico-canada-martes-trax,2025-03-04 14:12:40
4033900,"Un padre y su hijo fueron fusilados en 1936. Su delito: retirar un crucifijo. 90 años después, su familia ha encontrado sus restos","Tras casi 90 años de incertidumbre, los restos del maestro republicano y su hijo, asesinados en 1936, fueron identificados en una fosa común. Alfonso Matarán ha relatado en 'La Ventana' la lucha por recuperar la memoria de su familia. ""Ver el informe y leer que a mi abuelo le dieron dos disparos, pero a mi tío, de solo 19 años, seis disparos en el cráneo... es una salvajada. Es el terror que querían infundir"".",https://meneame.net/story/padre-hijo-fueron-fusilados-1936-delito-retirar-crucifijo-90-ha,427,455,496,157,270,2,actualidad,59,2025-03-03 21:45:02,onainigo,cadenaser.com,https://cadenaser.com/nacional/2025/03/03/un-padre-y-su-hijo-fueron-fusilados-en-1936-su-delito-retirar-un-crucifijo-90-anos-despues-su-familia-ha-encontrado-sus-restos-cadena-ser/,2025-03-04 14:12:40
4033863,Verano en la Yugoslavia de los ochenta: La vida cotidiana captada en fotos impresionantes (ENG),"Desde las históricas calles de Dubrovnik hasta las bulliciosas avenidas de Zagreb, las imágenes muestran una nación que, en su momento, fue una mezcla única de gobierno socialista y relativa apertura en comparación con otros Estados del bloque del Este.",https://meneame.net/story/verano-yugoslavia-ochenta-vida-cotidiana-captada-fotos-eng,136,4658,470,67,69,1,cultura,94,2025-03-03 21:35:02,ccguy,rarehistoricalphotos.com,https://rarehistoricalphotos.com/yugoslavia-old-photos-1980s/,2025-03-04 14:12:40
4033820,"El líder de 'Gürtel' reconoce las adjudicaciones a la trama en Arganda del Rey y las mordidas: ""Yo solía ser generoso""","El que fuera alcalde de Arganda del Rey Ginés López ha reconocido que cobró comisiones por valor de más de 545.000 euros, explicando cómo comenzó a colaborar con la trama. ""El señor Correa en un momento me hizo un ofrecimiento que en un primer instante rechacé, pero que es verdad que luego efectivamente, erróneamente, acepté"",",https://meneame.net/story/lider-gurtel-reconoce-adjudicaciones-trama-arganda-rey-mordidas,303,336,475,117,186,0,politica,20,2025-03-03 21:15:02,Esteban_Rosador,europapress.es,https://www.europapress.es/nacional/noticia-lider-gurtel-reconoce-adjudicaciones-trama-arganda-rey-mordidas-yo-solia-ser-generoso-20250303143145.html,2025-03-04 14:12:40
