news_id,title,content,full_story_link,meneos,clicks,karma,positive_votes,anonymous_votes,negative_votes,category,comments,published_date,user,source,source_link,scraped_date
4038777,Iconografía de las utilidades de PuTTY [ENG],"En marzo de 2025 recibí un correo electrónico preguntando sobre el ""logotipo"" de Putty, el icono utilizado por el ejecutable de Windows. El remitente quería saber de dónde había venido y cómo había evolucionado con el tiempo. A veces recibo un correo electrónico haciendo una pregunta, y para cuando termine de responderlo, me doy cuenta de que vale la pena convertirme en una publicación de blog. Esta vez sabía que iba a ser uno de esos antes de que incluso comenzara a escribir, porque hay parte de diseño gráfico y parte técnica.",https://meneame.net/story/iconografia-utilidades-putty-eng,0,789,425,26,12,0,tecnología,4,2025-03-17 12:00:03,mr_b,chiark.greenend.org.uk,https://www.chiark.greenend.org.uk/~sgtatham/quasiblog/putty-icons/,2025-03-17 12:12:50
4038815,Cuando el destino nos alcance (Soylent Green) (1973),"Año 2022. La superpoblación, la contaminación y la falta de recursos energéticos y alimenticios han provocado que gran parte de la población mundial viva hacinada, en la pobreza y alimentada con galletitas baratas creadas por el Sistema, las Soylent Green. Mientras, una élite favorecida vive en apartamentos de lujo y sin problemas. En ese contexto de privilegio, un hombre importante es asesinado, y el agente Thorn habrá de investigar.",https://meneame.net/story/cuando-destino-nos-alcance-soylent-green-1973-1,0,410,416,36,24,1,cultura,20,2025-03-17 11:35:03,Deckardio,pasadizo.es,https://www.pasadizo.es/cuando-el-destino-nos-alcance-soylent-green-1973/,2025-03-17 12:12:50
4038824,UGT firma un convenio estatal que permite no pagar las horas extras,"La mejor prueba de que UGT es el peor “sindicato” de España, con mucha diferencia, son algunos de los convenios que les firma a las patronales. Muy especialmente los convenios estatales en los que UGT tiene la mayoría suficiente para firmarlo en solitario o impedir que lo firmen otros sin su acuerdo. En esta ocasión se trata de un convenio que afecta a más de 61.000 trabajadores, casi el 70% mujeres, de casi 18.000 empresas con más de 22.000 centros de trabajo en toda España, según los últimos datos oficiales al respecto.",https://meneame.net/story/ugt-firma-convenio-estatal-permite-no-pagar-horas-extras,0,989,412,112,133,1,actualidad,47,2025-03-17 11:05:02,Peka,laboro-spain.blogspot.com,https://laboro-spain.blogspot.com/2025/03/horas-guardia-extras-farmacias.html,2025-03-17 12:12:50
4038788,"Carlos Vila, abogado de Marea de Residencias: ""Acusamos a Díaz Ayuso de homicidio imprudente y de prevaricación""","Carlos Vila, abogado de Marea de Residencias, ha visitado La Roca para explicar el estado actual de las querellas presentadas contra Isabel Díaz Ayuso por su gestión en las residencias de ancianos durante la pandemia.",https://meneame.net/story/carlos-vila-abogado-marea-residencias-acusamos-diaz-ayuso,0,330,435,125,133,3,politica,50,2025-03-17 10:35:03,NPCmasacrado,lasexta.com,https://www.lasexta.com/programas/la-roca/carlos-vila-abogado-marea-residencias-acusamos-diaz-ayuso-homicidio-imprudente-prevaricacion_2025031667d707506e95850001ff72eb.html,2025-03-17 12:12:50
4038855,"Miguel López Abad, presidente de la Croem: ""Tenemos un Gobierno comunista que ha subido el salario mínimo un 61%""","«Yo soy la voz de lo que las empresas dicen», señaló el máximo responsable de la patronal regional murciana ante medio centenar de empresarios que asistieron al encuentro. El presidente de la Croem, Miguel López Abad, se lamentó ayer de que España tiene «un Gobierno comunista», al que reprochó que haya subido el salario mínimo interprofesional «un 61%» en seis años.",https://meneame.net/story/miguel-lopez-abad-presidente-croem-tenemos-gobierno-comunista-ha,0,706,417,102,112,1,actualidad,108,2025-03-17 10:15:03,Ratoncolorao,laopiniondemurcia.es,https://www.laopiniondemurcia.es/comunidad/2025/03/15/miguel-lopez-abad-gobierno-comunista-115311672.html?fbclid=IwY2xjawJEu3lleHRuA2FlbQIxMQABHVnqEHTvYyaytW77gx6wUFC62tGbaGIA0fHN49nSmKekQG--yg9h1pvUGQ_aem_1s2_uDugcc2sej8TOV_vTA,2025-03-17 12:12:50
4038798,Peter Sellers y la escena del ascensor,"El maestro Peter Sellers cuenta lo que les costó aguantarse la risa durante una secuencia de ""La venganza de la Pantera Rosa"" (1978) de Blake Edwards",https://meneame.net/story/peter-sellers-escena-ascensor,0,3046,468,57,46,1,ocio,10,2025-03-17 10:15:02,JanSmite,twitter.com,https://twitter.com/doctorfrusna/status/1901392736227410132,2025-03-17 12:12:50
4038850,La versión 3.0 del editor de imágenes GIMP disponible para descarga. Estas son sus novedades [ENG],"El equipo de desarrollo detrás del popular software de edición de imágenes de código abierto GIMP publicó hoy la compilación final del muy esperado lanzamiento GIMP 3.0. Los aspectos más destacados de GIMP 3.0 incluyen una interfaz muy refinada escrita en GTK3 que permite el uso de la rueda de desplazamiento del mouse para voltear diferentes pestañas de diálogo acoplables, junto con una nueva pantalla de barro y logotipo, así como mejoras en el tema del icono heredado para verse bien en pantallas HIDPI.",https://meneame.net/story/version-3-editor-imagenes-gimp-disponible-descarga-estas-son-eng,0,1002,476,75,43,1,tecnología,52,2025-03-17 09:55:02,mr_b,9to5linux.com,https://9to5linux.com/gimp-3-0-image-editor-is-now-available-for-download-heres-whats-new,2025-03-17 12:12:50
4038793,La AEMET activa el nivel amarillo por lluvias en València en uno de los días grandes de las Fallas,17/03 00:06 #AEMET actualiza #FMA por lluvias en C. Valenciana. Activos MAÑANA. Nivel máx amarillo. Imagen del mapa de avisos en vigor a las 00:06 .,https://meneame.net/story/aemet-activoa-nivel-amarillo-lluvias-valencia-uno-dias-grandes,0,861,407,53,69,2,actualidad,22,2025-03-17 09:45:02,NPCmasacrado,infotweet.aemet.es,http://infotweet.aemet.es/tu77.html?1742166376,2025-03-17 12:12:50
4038772,Toma de Rehenes en teatro ruso (2002) - Sale muy mal,"Lo que comenzó como una función de teatro terminó en uno de los secuestros más escalofriantes de la historia. ???? Más de 900 personas quedaron atrapadas, rodeadas de terroristas y sin saber si saldrían con vida. ???? Las autoridades tomaron una decisión extrema… y el final fue aterrador.",https://meneame.net/story/toma-rehenes-teatro-ruso-2002-sale-muy-mal,0,1864,447,53,35,1,cultura,73,2025-03-17 09:10:03,antesdarle,youtube.com,https://www.youtube.com/watch?app=desktop&v=1F_n0cDOTvs,2025-03-17 12:12:50
4038810,¿En qué se diferenciaban los protocolos para residencias de Madrid de los de otras comunidades?,"De esa forma, Ayuso repetía una falsedad (que su región no dictó esos protocolos tan cuestionados) y añadía una novedad (que esas directrices sí fueron aplicadas por otros). EL PAÍS vuelve a publicar en este artículo los cuatro protocolos que elaboró en marzo de 2020 la Comunidad de Madrid. Lo acompaña un análisis de los documentos restrictivos que publicaron otras regiones. No existe forma de saber si estos son todos los protocolos excluyentes que se elaboraron, porque las comunidades han tratado este asunto con opacidad y aparentemente...",https://meneame.net/story/diferenciaban-protocolos-residencias-madrid-otras-comunidades,0,1013,421,120,141,19,politica,64,2025-03-17 08:50:03,candonga1,elpais.com,https://elpais.com/espana/madrid/2025-03-17/en-que-se-diferenciaban-los-protocolos-para-residencias-de-madrid-de-los-de-otras-comunidades.html,2025-03-17 12:12:50
4038814,"Las empleadas domésticas de África Oriental se enfrentan a violaciones, agresiones y muerte en Arabia Saudí [ENG]","Un día cualquiera en Kenia, docenas, si no cientos, de mujeres zumban en la zona de salidas del aeropuerto internacional de Nairobi. Si pasan dos años en Arabia Saudí como amas de llaves o niñeras, podrán ganar lo suficiente para construir una casa, educar a sus hijos y ahorrar para el futuro [...] la zona de llegadas es donde la esperanza se topa con la cruda realidad. Las mujeres regresan con las mejillas hundidas, a menudo abatidas por salarios impagados, palizas, hambre y agresiones sexuales. Algunas están arruinadas. Otras están en ataúdes",https://meneame.net/story/empleadas-domesticas-africa-oriental-enfrentan-violaciones-saudi,0,548,448,102,133,0,actualidad,53,2025-03-17 08:20:03,geralt_,nytimes.com,https://www.nytimes.com/2025/03/16/world/africa/saudi-arabia-kenya-uganda-maids-women.html?unlocked_article_code=1.4U4.SW47.NcbHTRITJS00,2025-03-17 12:12:50
4038816,Aemet denuncia ante la Fiscalía la manipulación del audio de Emergencias difundido por Mazón,"El escrito, al que ha tenido acceso elDiario.es, considera la conversación filtrada entre la meteoróloga y la técnica del 112 ""una información de carácter reservado, con la finalidad estricta de gestionar la emergencia acaecida y siendo su difusión restringida""",https://meneame.net/story/aemet-denuncia-ante-fiscalia-manipulacion-audio-emergencias,0,1045,515,209,345,1,actualidad,30,2025-03-17 08:00:02,ikipol,eldiario.es,https://www.eldiario.es/comunitat-valenciana/valencia/aemet-denuncia-fiscalia-manipulacion-audio-emergencias-difundido-mazon_1_12133455.html,2025-03-17 12:12:50
4038386,"Así es la IA que, tras ayudarte con muchas líneas de código, te manda a paseo: ""aprender a programar, no voy a hacer el trabajo por ti""","Ahora bien, el caso de Cursor AI es un tanto especial, pues un usuario empezó a usarla con la versión ""Pro Trial"" que, como hacen otros programas, ofrece funciones de pago en un modo de prueba limitado. Tras pedirle que generase código para hacer desaparecer las marcas de derrape en un juego de coches, la IA paró tras escribir 750-800 líneas y en lugar de decir que había llegado al límite, le contestó: ""No puedo generar código para ti, ya que eso sería completar tu trabajo…""",https://meneame.net/story/asi-ia-tras-ayudarte-muchas-lineas-codigo-manda-paseo-aprender,0,1186,367,39,46,1,tecnología,27,2025-03-17 07:55:02,JanSmite,elchapuzasinformatico.com,https://elchapuzasinformatico.com/2025/03/ia-niega-generar-codigo/,2025-03-17 12:12:50
4038696,"Abogados Cristianos deberá pagar ""más de 50.000 euros"" a una letrada a la que despidió improcedentemente","La Sala de lo Social del Tribunal Supremo ha ratificado la improcedencia del despido de una letrada de la Asociación de Abogados Cristianos que fue cesada por ausentarse de su puesto de trabajo sin avisar, lo que se produjo poco después de que ésta iniciase una baja por incapacidad temporal.",https://meneame.net/story/abogados-cristianos-debera-pagar-mas-50-000-euros-letrada,0,291,340,113,179,0,actualidad,22,2025-03-17 07:00:07,Verdaderofalso,economistjurist.es,https://www.economistjurist.es/actualidad-juridica/una-asociacion-de-abogados-debera-pagar-mas-de-50-000-euros-a-una-letrada-a-la-que-despidio-improcedentemente/,2025-03-17 12:12:50
4038723,Estados Unidos deporta a El Salvador a cientos de presuntos pandilleros pese a la orden judicial que impedía hacerlo,"Estados Unidos deportó este domingo, por primera vez, a El Salvador, a cerca de 300 presuntos miembros de las bandas criminales Tren de Aragua y Mara Salvatrucha (MS-13), pese a una orden judicial que prohibía la medida. La acción se amparó en la controvertida Ley de Enemigos Extranjeros de 1798, activada por el presidente Donald Trump.",https://meneame.net/story/estados-unidos-deporta-salvador-cientos-presuntos-pandilleros,0,456,355,80,110,0,actualidad,78,2025-03-17 05:55:02,karakol,cadenaser.com,https://cadenaser.com/nacional/2025/03/16/estados-unidos-deporta-a-el-salvador-a-cientos-de-presuntos-pandilleros-pese-a-orden-judicial-que-impedia-hacerlo-cadena-ser/,2025-03-17 12:12:50
4038675,BlackRock ahora quiere que las generaciones mayores trabajen más tiempo para reducir la ansiedad económica de los jóvenes,"El Consejero Delegado de BlackRock, Larry Fink, advirtió de la creciente crisis de la jubilación, subrayando que sólo los empleados de las grandes empresas se benefician de una adecuada planificación de la jubilación, mientras que muchos estadounidenses no se sienten preparados. Insta a los líderes empresariales y a los políticos a replantearse el sistema, reconociendo la ansiedad económica de las generaciones más jóvenes y sugiriendo que las generaciones mayores trabajen más tiempo para restablecer la confianza y la seguridad financiera. [eng]",https://meneame.net/story/blackrock-ahora-quiere-generaciones-mayores-trabajen-mas-tiempo,0,401,352,91,132,0,politica,60,2025-03-17 04:50:06,NPCmasacrado,fortune.com,https://fortune.com/2025/03/14/larry-fink-retirement-planning-fortune-500/?xid=soc_socialflow_facebook_FORTUNE,2025-03-17 12:12:50
4038719,Lista de libros prohibidos 2025 en colegios públicos estadounidenses [ENG],"¿Qué libros están prohibidos en 2025? Se han eliminado miles de títulos de las escuelas públicas de todo el país. 'PEN America' ha documentado casi 16.000 prohibiciones de libros en escuelas públicas de todo el país desde 2021, una cifra no vista desde la era Red Scare McCarthy de la década de 1950. Esta censura está siendo movilizada por grupos conservadores— y se ha extendido a casi todos los estados— y apunta predominantemente a libros sobre raza y racismo o personas de color y también a libros sobre temas LGBTQ+ así como a lectores mayore",https://meneame.net/story/lista-libros-prohibidos-2025-colegios-publicos-estadounidenses,0,965,418,68,100,1,cultura,28,2025-03-17 03:45:02,Larpeirán,pen.org,https://pen.org/banned-books-list-2025/,2025-03-17 12:12:50
4038671,Losantos desquiciado con Feijóo y Mazón,Jiménez Losantos baja el dedo a Feijóo por su inactividad con Mazón y su responsabilidad con la DANA.,https://meneame.net/story/losantos-desquiciado-feijoo-mazon,0,3572,403,76,108,2,actualidad,44,2025-03-17 03:05:03,fareway,youtube.com,https://youtube.com/shorts/Dn3rnCzErC0?si=DIfer0P9EWQfDERX,2025-03-17 12:12:50
4038743,"Actas policiales prueban que al menos cinco residencias pidieron auxilio a la Comunidad de Madrid sin respuesta: ""Sugieren abandono de las instituciones""","Las inspecciones de los agentes de la Policía de Madrid reflejan la desatención por parte del Gobierno de Ayuso en los momentos más críticos, cuando los muertos se contaban por cientos y las residencias estaban siendo duramente golpeadas",https://meneame.net/story/actas-policiales-prueban-menos-cinco-residencias-pidieron-madrid-1,0,426,402,107,311,19,actualidad,20,2025-03-17 02:25:03,Uvieu1926,eldiario.es,https://www.eldiario.es/madrid/actas-comunidad-madrid-sugieren-instituciones_1_6013562.html,2025-03-17 12:12:50
4038717,Los hutíes anuncian un contraataque contra el portaaviones 'Harry S. Truman' en respuesta a los bombardeos de EEUU,"La insurgencia hutí de Yemen ha anunciado este domingo el lanzamiento de un contraataque contra el portaaviones de EEUU 'Harry S.Truman', plataforma de la ola de bombardeos estadounidenses que comenzó la pasada noche del sábado contra los rebeldes en la capital del país, Saná. A la espera de confirmación por parte de Estados Unidos, el portavoz militar hutí, Yahya Sarea, ha anunciado que el ataque contra el portaaviones ha sido efectuado con 18 misiles balísticos y de crucero y un dron.",https://meneame.net/story/huties-anuncian-contraataque-contra-portaaviones-harry-s-truman,0,588,392,60,80,1,actualidad,30,2025-03-17 01:45:02,Lord_Cromwell,europapress.es,https://www.europapress.es/internacional/noticia-huties-anuncian-contraataque-contra-portaaviones-uss-harry-truman-respuesta-bombardeos-eeuu-20250316182532.html,2025-03-17 12:12:50
4038784,"Le hicieron conducir 500 km en camión tras un infarto, y al llegar a España la empresa le despidió. El juez falla en su favor","Al juez no le ha parecido que eso fuera una ""válida extinción de un contrato de trabajo temporal por circunstancias de la producción""",https://meneame.net/story/hicieron-conducir-500-km-camion-tras-infarto-llegar-espana-juez-1,0,981,434,142,236,0,actualidad,16,2025-03-17 01:00:03,salteado3,genbeta.com,https://www.genbeta.com/actualidad/le-hicieron-conducir-500-km-camion-infarto-al-llegar-a-espana-empresa-le-despidio-juez-falla-su-favor,2025-03-17 12:12:50
4038574,"El 'Team Facha' de Vox, la milicia digital neonazi ligada a Jordi de la Fuente","Macarena Olona fue la última que habló del 'Team Facha'. Lo hizo en la entrevista concedida a Jordi Évole a mediados de febrero de 2023 tras su salida de Vox, en la que reconoció un fuerte acoso digital a su marcha por parte de trolls, perfiles falsos y anónimos, orquestados, dijo, por el propio partido. Especialmente vía X. Ahora, con el nombramiento de Jordi de la Fuente como nuevo secretario general del sindicato Solidaridad este sábado, ese grupo sale de nuevo a relucir.",https://meneame.net/story/team-facha-vox-milicia-digital-neonazi-ligada-jordi-fuente,0,656,433,85,136,1,tecnología,11,2025-03-17 00:15:02,Uvieu1926,elindependiente.com,https://www.elindependiente.com/espana/2025/03/16/el-team-facha-de-vox-la-milicia-digital-neonazi-ligada-a-jordi-de-la-fuente/,2025-03-17 12:12:50
4038703,"Masiva protesta contra el gobierno de Viktor Orban en Hungría: el primer ministro amenazó con eliminar a rivales políticos, jueces y ONGs","Miles de húngaros participaron este sábado de una multitudinaria movilización con motivo de la Fiesta Nacional del 15 de marzo, que recuerda la revolución magiar contra los Habsburgo. Varios de los manifestantes aprovecharon la ocasión para protestar contra el gobierno de Viktor Orban, quien ante sus seguidores amenazó con eliminar a rivales políticos, jueces, medios de comunicación y organizaciones no gubernamentales.",https://meneame.net/story/masiva-protesta-contra-gobierno-viktor-orban-hungria-primer-ongs,0,349,400,128,190,7,actualidad,17,2025-03-16 23:50:03,Ka1900,infobae.com,https://www.infobae.com/america/mundo/2025/03/15/masiva-protesta-contra-el-gobierno-de-viktor-orban-en-hungria-el-primer-ministro-amenazo-con-eliminar-a-rivales-politicos-jueces-y-ongs,2025-03-17 12:12:50
4038564,Tangerine Dream: Una odisea personal prog (eng),"Escuché por primera vez Tangerine Dream en 1985 cuando habría cumplido 14 años. El profesor de música había dado la vuelta a toda la clase preguntándole a todos a su vez qué tipo de música escuchaban. La música pop y las cartas lo eran todo para los adolescentes entonces. Algunos de los chicos tenían logotipos pintados en sus hamburguesas que me fascinaban: The Jam, The Who, The Specials. Un niño había recreado meticulosamente el logo de los Rolling Stones de Sticky Fingers. Las chicas estaban en Duran Duran y Ultravox.",https://meneame.net/story/tangerine-dream-odisea-personal-prog-eng,0,1159,437,54,32,0,ocio,17,2025-03-16 23:10:02,arariel,wearecult.rocks,https://wearecult.rocks/tangerine-dreaming,2025-03-17 12:12:50
4038603,Los asuntos cotidianos de un soldado francés de 16 años en el Mieres de 1811,"No hay mayor agravio para una persona que robarle su identidad y eso fue lo que hizo conscientemente el gran Goya dejando sin rostro a los soldados franceses que pintó fusilando a los madrileños el 3 de mayo de 1808. Los convirtió en una máquina de matar quitándoles así su esencia humana. «Sin embargo, también aquellos invasores fueron hombres y seguramente se diferenciaban en bien poco de sus enemigos españoles». La misiva enviada por Prosper Noubel desde Mieres en 1811 dirigida a su padre, que era librero e impresor en Agén, ciudad de Lot-et-",https://meneame.net/story/asuntos-cotidianos-soldado-frances-16-anos-mieres-1811,0,2418,440,49,46,2,cultura,8,2025-03-16 22:50:03,Charles_Dexter_Ward,elblogdeacebedo.blogspot.com,https://elblogdeacebedo.blogspot.com/2020/04/un-joven-soldado-frances-de-16-anos.html?m=1,2025-03-17 12:12:50
4038693,La Fundación Heritage y sus aliados debaten el desmantelamiento de la UE [ENG],"El grupo que elaboró un plan clave para el segundo mandato de Donald Trump convocó una reunión en Washington D.C. esta semana para considerar propuestas para disolver la Unión Europea (UE). El medio de investigación polaco VSquare reveló que la Fundación Heritage reunió a grupos conservadores de línea dura el 11 de marzo para escuchar cómo reformarían las estructuras actuales de la UE.  El taller a puerta cerrada incluyó un debate sobre un documento titulado: ""El Gran Reinicio: Restaurando la Soberanía de los Estados Miembros en el Siglo XXI""",https://meneame.net/story/fundacion-heritage-aliados-debaten-desmantelamiento-ue,0,1028,453,119,175,0,actualidad,68,2025-03-16 22:30:02,Gry,desmog.com,https://www.desmog.com/2025/03/14/heritage-foundation-project-2025-allies-mcc-ordo-iuris-discuss-dismantling-the-eu-european-union/,2025-03-17 12:12:52
4038759,"Jaime de los Santos fue asistente personal de Elvira Fernández (la mujer de Rajoy) durante 2 años y medio, con un sueldo de 60.000€","Jaime de los Santos fue asistente personal de Elvira Fernández (la mujer de Rajoy) durante 2 años y medio, con un sueldo de 60.000€ al año pagado por todos los españoles. Seguro que esto lo investigará el juez Peinado. PD: Jaime ahora es diputado del PP y grita mucho.  Meritocracia.",https://meneame.net/story/jaime-santos-fue-asistente-personal-elvira-fernandez-mujer-rajoy,0,1753,447,190,367,3,actualidad,44,2025-03-16 22:15:03,imagosg,bsky.app,https://bsky.app/profile/hannibal.bsky.social/post/3lkjditwtec24,2025-03-17 12:12:52
4038762,Serbia usa armas sónicas para dispersar manifestantes: este es el efecto que provocan,"La policía y fuerzas del Estado serbio habrían usado este tipo de armas en Belgrado en las últimas horas durante los quince minutos de silencio en honor a las quince víctimas de la estación de tren Novi Sad. En las imágenes, se pueden ver calles completamente colapsadas de manifestantes. De repente, instantes después de la activación de las armas sónicas, la multitud echa a correr entre gritos hacia los márgenes de las avenidas, que quedan despejadas en cuestión de segundos.",https://meneame.net/story/serbia-usa-armas-sonicas-dispersar-manifestantes-este-efecto,0,5122,481,116,138,2,actualidad,66,2025-03-16 22:10:03,Gry,elconfidencial.com,https://www.elconfidencial.com/tecnologia/2025-03-16/serbia-armas-sonicas-energia-dirigida-lrad-ads_4087245/,2025-03-17 12:12:52
4038654,Los pasajeros de un vuelo Madrid-Gran Canaria consiguen bajar del avión a diez borrachos,"Crecen los incidentes con personas en estado de embriaguez en vuelos con destino a Canarias en la misma proporción, seguramente, que crece el número de turistas y viajeros que viajan a las Islas. En los últimos tres días se han registrado dos casos, uno en un vuelo procedente de Newcastle y el otro de Madrid. La tripulación del Binter NT-6015 atendió las advertencias de los pasajeros, que ya habían sufrido en la terminal el griterío y los malos modos de los evacuados, que acudían a una despedida de soltero.",https://meneame.net/story/pasajeros-vuelo-madrid-gran-canaria-consiguen-bajar-avion-diez,0,1254,453,83,120,0,actualidad,32,2025-03-16 21:50:02,PaulDurden,eldiario.es,https://www.eldiario.es/canariasahora/sociedad/pasajeros-vuelo-madrid-gran-canaria-bajar-avion-diez-borrachos-incidentes-canarias-binter_1_12136965.html,2025-03-17 12:12:52
4038692,"Desfile de 800 falleras contra la lluvia y el fango: ""Es un acto histórico""",Las seis comisiones de las pedanías de València golpeadas por la DANA –y estos días por la lluvia– recorren las calles de Castellar unidas por la germanor y la resiliencia ante la tragedia,https://meneame.net/story/desfile-800-falleras-contra-lluvia-fango-acto-historico,0,1309,440,70,107,1,cultura,73,2025-03-16 21:35:02,NPCmasacrado,levante-emv.com,https://www.levante-emv.com/fallas/2025/03/16/desfile-800-falleras-lluvia-fango-115353815.html,2025-03-17 12:12:52
4038592,Denuncian la caza furtiva de erizos en terrenos de Alcorcón y Móstoles,"Las sospechas de un naturalista que frecuenta el parque de Prado Ovejero de Móstoles y el colindante de Fuente Cisneros en Alcorcón se han confirmado.

Grupos de personas amparándose en la noche han dado caza a varios ejemplares de erizo (Erinaceus europaeus), una especie protegida.

Ecologistas en Acción ha informado de estos hechos al constar, explican, antecedentes de la presencia de furtivos en busca de erizos en estos parajes. Los erizos tienen su mayor actividad nocturna entre los meses de marzo y septiembre.",https://meneame.net/story/denuncian-caza-furtiva-erizos-terrenos-alcorcon-mostoles,0,575,413,104,135,0,ciencia,40,2025-03-16 21:20:03,Gante_hrm,telemadrid.es,https://www.telemadrid.es/noticias/madrid/Denuncian-la-caza-furtiva-de-erizos-en-terrenos-de-Alcorcon-y-Mostoles-0-2760923911--20250314071409.html,2025-03-17 12:12:52
4038711,La IA de código abierto iguala a los mejores LLM propietarios en la resolución de casos médicos complejos (eng),"Los hallazgos sugieren que las herramientas de IA de código abierto se están volviendo cada vez más competitivas y podrían ofrecer una alternativa valiosa a los modelos propietarios. “Hasta donde sabemos, esta es la primera vez que un modelo de IA de código abierto iguala el rendimiento de GPT-4 en casos tan complejos evaluados por médicos”, afirmó el autor principal, Arjun Manrai . dx.doi.org/10.1001/jamahealthforum.2025.0040",https://meneame.net/story/ia-codigo-abierto-iguala-mejores-llm-propietarios-resolucion-eng,0,612,442,104,120,0,tecnología,41,2025-03-16 20:50:03,onainigo,hms.harvard.edu,https://hms.harvard.edu/news/open-source-ai-matches-top-proprietary-llm-solving-tough-medical-cases,2025-03-17 12:12:52
