news_id,title,content,full_story_link,meneos,clicks,karma,positive_votes,anonymous_votes,negative_votes,category,comments,published_date,user,source,source_link,scraped_date
4033550,"Sabíamos que las ventas de Tesla en Europa se han hundido. Ahora la sorpresa son las marcas chinas, y sus números son espectaculares","Mientras Tesla registró en enero una caída en las ventas del 45% en Europa, con 9.913 unidades, las ventas de las marcas chinas aumentaron un 52% respecto a enero del año pasado, según datos de Jato Dynamics. Las marcas chinas matricularon en Europa 37.134 vehículos en enero. Sigue siendo una cifra relativamente pequeña en el cómputo global del mercado europeo, pero su crecimiento es muy significativo. No sólo creció su volumen total, también aumentó su cuota de mercado, pasando del 2,4% en enero de 2024 al 3,7% al cierre del mes pasado, según",https://meneame.net/story/sabiamos-ventas-tesla-europa-han-hundido-ahora-sorpresa-son-son,264,1578,379,109,155,5,actualidad,54,2025-03-03 05:55:03,lavandeo,hibridosyelectricos.com,https://www.hibridosyelectricos.com/coches/ventas-coches-marcas-chinas-europa-2025_78789_102.html,2025-03-04 14:12:43
4033618,La UPV constata que la reversión de carriles en Colón dispara la contaminación del aire,"A finales del año 2023, se revirtió uno de los dos carriles bus, que fue reemplazado por un segundo carril para el tráfico general y se permitió el acceso a la calle Colón por la entrada de la Porta de la Mar. Como resultado, la intensidad del tráfico ha vuelto a aumentar considerablemente en el último año.",https://meneame.net/story/upv-constata-reversion-carriles-colon-dispara-contaminacion-aire,267,510,380,101,166,2,actualidad,44,2025-03-03 04:45:03,karakol,levante-emv.com,https://www.levante-emv.com/valencia/2025/03/01/upv-constata-reversion-carriles-colon-114705155.html,2025-03-04 14:12:43
4033599,Buscan a un hombre arrastrado por la rambla de Ramonete en Lorca,"Efectivos de la Guardia Civil buscan a un hombre que fue arrastrado por la corriente esta tarde tras el desbordamiento de la rambla de Ramonete, en Lorca, según ha informado el Centro de Coordinación de Emergencias. Además, la Dirección General de Seguridad Ciudadana y Emergencias emitió un aviso a la población alertando de otro desbordamiento en la rambla de El Albujón, en Cartagena. A través del sistema ES-Alert, se pidió extremar la precaución y evitar circular por la zona, especialmente en el área entre la A-30 y la vía ferroviaria.",https://meneame.net/story/buscan-hombre-arrastrado-rambla-ramonete-lorca,123,514,375,55,68,0,actualidad,7,2025-03-03 03:40:03,Pixmac,el-lorquino.com,https://el-lorquino.com/2025/03/02/region-de-murcia/lorca/buscan-a-un-hombre-arrastrado-por-la-rambla-de-ramonete-en-lorca/189865/,2025-03-04 14:12:43
4033625,Carteles antiguos ilustrados por Gaspar Camps i Junyent en la década de 1900 [ENG],"Gaspar Camps i Junyent (1874-1942) fue un dibujante, ilustrador y pintor español, influido por el modernismo y la publicidad. Su obra se caracteriza por la decoración modernista y la exuberancia de formas, visibles en numerosos dibujos publicados en la revista Album Salón (1897-1908) y en carteles publicitarios en París. En 1899, expone en la Sala Parés y funda la revista Pluma y Lápiz. El 5 de abril de 1934 recibió un homenaje de la Agrupación de Acuarelistas de Cataluña, y el 4 de junio fue nombrado hijo ilustre de la ciudad de Igualada.",https://meneame.net/story/carteles-antiguos-ilustrados-gaspar-camps-i-junyent-decada-1900,98,1759,443,56,42,0,cultura,4,2025-03-03 02:30:02,Hombre_de_Estado,vintag.es,https://www.vintag.es/2025/02/gaspar-camps-i-junyent.html,2025-03-04 14:12:43
4033627,"Steve Wozniak desvela casi 40 años después la gran mentira de Apple y Steve Jobs: ""Es todo un mito""","Cuando se habla de los comienzos de Apple, la imagen más recurrente es la de Steve Jobs y Steve Wozniak en un modesto garaje de California, dando forma a la revolución informática. Sin embargo, casi 40 años después, Wozniak ha desmentido esta versión, asegurando que el garaje no fue el epicentro de la innovación de la compañía. Según Wozniak, el garaje no fue más que un punto de reunión para él y Jobs. No se diseñaron circuitos, no se fabricaron prototipos y tampoco se hicieron pruebas allí. Era simplemente un lugar donde se almacenaban…",https://meneame.net/story/steve-wozniak-desvela-casi-40-anos-despues-gran-mentira-apple,242,3763,451,112,130,0,actualidad,52,2025-03-03 02:00:02,JanSmite,computerhoy.20minutos.es,https://computerhoy.20minutos.es/apple/steve-wozniak-desvela-casi-40-anos-despues-gran-mentira-apple-steve-jobs-todo-mito-1445130,2025-03-04 14:12:43
4033577,Gustavo Petro volvió a hablar del presidente de Ucrania: “Zelensky planteo una guerra con armas occidentales y ahora lo traicionan y se queda sin armas ante Rusia”,"“Zelensky planteó una guerra con armas occidentales y ahora lo traicionan y se queda sin armas ante Rusia qué usa las propias. Es la traición a Zelensky por el gas. Las guerras del siglo XXI, son las guerras de la economía fósil. En este momento Zelensky debería cambiar su política. Buscar la difícil unidad de los pueblos eslavos. Hablar sin intermediarios con Putin y hacer la paz y un gran acuerdo político y económico eslavo abierto al mundo”, escribió en su cuenta de X el presidente de la República.",https://meneame.net/story/gustavo-petro-volvio-hablar-presidente-ucrania-zelensky-planteo,228,554,434,90,138,2,actualidad,76,2025-03-03 01:30:03,Lord_Cromwell,infobae.com,https://www.infobae.com/colombia/2025/03/02/gustavo-petro-volvio-a-hablar-del-presidente-de-ucrania-zelensky-planteo-una-guerra-con-armas-occidentales-y-ahora-lo-traicionan-y-se-queda-sin-armas-ante-rusia/,2025-03-04 14:12:43
4033600,"Von der Leyen: ""Necesitamos urgentemente rearmar a Europa""","La presidenta de la Comisión Europea, Ursula von der Leyen, subrayó este domingo la necesidad de 'rearmar' a Ucrania y a Europa 'urgentemente', al término de una cumbre informal celebrada en Londres.",https://meneame.net/story/von-der-leyen-necesitamos-urgentemente-rearmar-europa,189,411,436,92,97,0,actualidad,154,2025-03-03 01:30:02,Icelandpeople,elimparcial.es,https://www.elimparcial.es/noticia/280476/mundo/von-der-leyen:-necesitamos-urgentemente-rearmar-a-europa.html,2025-03-04 14:12:43
4033428,"Ayuso, irritada con Feijoo por fichar al gurú creador del eslogan 'Perro Sanxe'","El fichaje de Aleix Sanmartín por el Partido Popular ha despertado un interés desorbitado dentro y fuera del partido. La jugada de Elías Bendodo, que muchos consideran incomprensible, pone en manos de un estratega clave del socialismo reciente la tarea de enderezar el rumbo del PP, abordar la descoordinación informativa y frenar la creciente incoherencia del equipo de Feijóo.",https://meneame.net/story/ayuso-irritada-feijoo-fichar-guru-creador-eslogan-perro-sanxe,131,1215,459,46,85,11,politica,24,2025-03-03 00:55:03,Gante_hrm,elinfiltrado.es,https://www.elinfiltrado.es/articulo/politica/ayuso-irritada-feijoo-fichar-guru-creador-eslogan-perro-sanxe/20250302104736002999.html,2025-03-04 14:12:43
4033612,La UE espera que EEUU retire 20.000 soldados de Europa (EN),Los diplomáticos europeos esperan que Estados Unidos reduzca su contingente militar en Europa en 20.000 soldados.El Washington Post informó sobre esto.,https://meneame.net/story/ue-espera-eeuu-retire-20-000-soldados-europa,200,568,458,91,109,0,actualidad,57,2025-03-03 00:35:03,Tkachenko,mil.in.ua,https://mil.in.ua/en/news/eu-expects-us-to-withdraw-20-000-troops-from-europe/,2025-03-04 14:12:43
4033603,Una aproximación a las claves del poder sionista mundial (I),"Aunque aparentemente, y así se muestra ante la ciudadanía, hay miles y miles de marcas que compiten en el mercado, en la práctica el proceso de centralización del capital ha ido conllevando que sean unas pocas empresas matrices gigantescas las que poseen empresas (marcas) grandes, que a su vez son dueñas de otras medianas, las cuales por su parte detentan la propiedad de muchas pequeñas, como en un perverso juego de muñecas rusas.",https://meneame.net/story/aproximacion-claves-poder-sionista-mundial-i,254,3480,467,104,150,5,cultura,33,2025-03-03 00:10:04,Pepy,rebelion.org,https://rebelion.org/una-aproximacion-a-las-claves-del-poder-sionista-mundial-i/,2025-03-04 14:12:45
4033547,Donald Trump anuncia la creación de una Reserva Estratégica de Criptomonedas en EE. UU,"En un reciente anuncio a través de la red social TRUTH Social, el presidente Donald Trump ha compartido su visión de convertir a Estados Unidos en el líder mundial en el ámbito de las criptomonedas. Como parte de esta estrategia, Trump señaló su intención de establecer una Reserva Estratégica de Criptomonedas que incluiría activos digitales como XRP, Solana (SOL) y Cardano (ADA).",https://meneame.net/story/donald-trump-anuncia-creacion-reserva-estrategica-criptomonedas,173,638,459,78,95,1,actualidad,66,2025-03-02 23:55:02,Atusateelpelo,criptotendencia.com,https://criptotendencia.com/2025/03/02/donald-trump-anuncia-la-creacion-de-una-reserva-estrategica-de-criptomonedas-en-ee-uu/,2025-03-04 14:12:45
4033607,"Pedro Rodríguez: ""Trump va a derrotar a EEUU, algo que no hicieron ni el nazismo, ni el fascismo ni la Unión Soviética","profesor de Relaciones Internacionales, Pedro Rodríguez, analiza en laSexta Xplica el impacto global de la guerra en Ucrania y cómo la postura de Donald Trump frente a Vladimir Putin podría debilitar a Estados Unidos más que cualquier otra amenaza en la historia reciente.",https://meneame.net/story/pedro-rodri-guez-trump-va-derrotar-eeuu-algo-no-hicieron-ni-ni-n,269,1305,483,96,173,4,actualidad,49,2025-03-02 23:35:02,totenburgh,lasexta.com,https://www.lasexta.com/programas/sexta-noche/pedro-rodriguez-trump-derrotar-eeuu-algo-que-hicieron-nazismo-fascismo-union-sovietica_2025030267c4b6d81ba31400010be7e1.html,2025-03-04 14:12:45
4033626,Hilo de fotos del antes y después,"1. El Ártico con 100 años de diferencia 2. Chichén Itzá en 1892 y ahora 3. El antes y después de la excavación del Estadio Griego Antiguo de Magnesia, ubicado en la actual Turquía. 4. Una pareja en Woodstock: 48 horas después de conocerse y la misma pareja 50 años después, aún juntos. ""Nos conocíamos desde hacía menos de 48 horas cuando se tomó esa foto"", revelaron Judy y Jerry Griffin. 5. Antes y después de la excavación y restauración del Zigurat de Ur en Irak. Este zigurat, el mejor conservado de los conocidos de Mesopotamia.",https://meneame.net/story/hilo-fotos-antes-despues,143,7281,488,70,73,9,cultura,14,2025-03-02 23:25:04,Grahml,nitter.net,https://nitter.net/theepicmap/status/1896064052029448551,2025-03-04 14:12:45
4033538,Intxaurrondo y Sala ACORRALAN a consejera valenciana de MAZÓN!,"Los presentadores de RTVE, Silvia Intxaurrondo y Marc Sala, han dejado en evidencia a la Consejera de Hacienda, Ruth Merino Peña, a cuenta de las mentiras del president Carlos Mazón. ¿Dónde estaba Mazón el día de la DANA?",https://meneame.net/story/intxaurrondo-sala-acorralan-consejera-valenciana-mazon,240,2443,441,84,156,5,actualidad,10,2025-03-02 23:20:02,Beltenebros,youtube.com,https://www.youtube.com/watch?si=XcAfEyNNrNqTZc-0&v=yajrQh6o0Ko,2025-03-04 14:12:45
4033594,Las acciones de Tesla acaban de tener su segundo peor mes de la historia mientras los inversores de Elon Musk se ponen nerviosos,"El repunte del 4% de las acciones de Tesla (TSLA) hoy no impidió que el fabricante de vehículos eléctricos de Elon Musk registrara su peor mes de la historia, ya que el repunte posterior a las elecciones desaparece y el valor de mercado de los fabricantes de automóviles se mantiene por debajo de los 1 billón de dólares.",https://meneame.net/story/acciones-tesla-acaban-tener-segundo-peor-mes-historia-mientras,277,728,469,104,173,2,actualidad,32,2025-03-02 22:50:03,JungSpinoza,qz.com,https://qz.com/tesla-stock-bad-month-elon-musk-1851767073,2025-03-04 14:12:45
4033564,Gobernador de Illinois culpa a Donald Trump de “destruir la democracia”,"Jay Robert Pritzker, gobernador de Illinois, asegura que el presidente Donald Trump ha comenzado a destruir la democracia estadounidense [...] Horas antes, en el programa de televisión “The View”, Pritzker apareció en un segmento grabado comparando las ideas de Donald Trump con lo realizado durante la etapa de los nazis en Alemania.",https://meneame.net/story/gobernador-illinois-culpa-donald-trump-destruir-democracia,346,745,465,125,221,1,actualidad,63,2025-03-02 22:30:03,kipper,laopinion.com,https://laopinion.com/2025/03/01/gobernador-de-illinois-culpa-a-donald-trump-de-destruir-la-democracia/,2025-03-04 14:12:45
4033588,Un huésped de un lujoso hotel de Vigo arroja cocaína a dos policías locales al estilo del filme «Airbag» y los intoxica,"Un huésped de un hotel boutique de cinco estrellas de Vigo dio la bienvenida a los policías locales que venían a detenerlo rompiendo una bolsa llena de droga y lanzando al aire polvo blanco al estilo de la película «Airbag». Los agentes inhalaron la droga, quedaron cubiertos de blanco y fueron hospitalizados durante tres horas para que los médicos comprobasen su estado de salud. El detenido guardaba en su habitación una segunda bolsa rellena de droga que contenía 100 gramos de cocaína.",https://meneame.net/story/huesped-lujoso-hotel-vigo-arroja-cocaina-dos-policias-locales,186,1259,459,82,104,0,actualidad,85,2025-03-02 22:10:03,knzio,lavozdegalicia.es,https://www.lavozdegalicia.es/noticia/vigo/vigo/2025/03/02/huesped-hotel-vigo-arroja-cocaina-dos-policias-locales-estilo-filme-air-bag-intoxica/00031740933516500534143.htm,2025-03-04 14:12:45
4033587,"Losantos: ""Para lo que ha quedado Abascal, la voz de su amo el matón Trump""","Aunque sólo fuera por estética, un español que tanto ha presumido de serlo no debería respaldar la encerrona y el chantaje de los dos matones contra Zelenski.",https://meneame.net/story/losantos-ha-quedado-abascal-voz-amo-maton-trump,275,1571,474,101,174,3,actualidad,66,2025-03-02 22:10:03,Icelandpeople,libertaddigital.com,https://www.libertaddigital.com/opinion/2025-03-02/federico-jimenez-losantos-el-maton-trump-no-humillo-a-zelenski-sino-a-su-propio-pais-y-a-la-causa-de-la-libertad-7225758/,2025-03-04 14:12:45
4033460,Esto es censura: Banderas palestinas tapadas en una gran exposición en la Galería Nacional de Australia [EN],"Un colectivo artístico indígena del Pacífico afirma que la NGA citó un riesgo de seguridad de «alto nivel» para retirar la bandera palestina del tapiz. Dos banderas palestinas de un tapiz expuesto en la Galería Nacional de Australia han sido ocultadas con tela blanca, en lo que los artistas han descrito como un acto de censura al que sólo accedieron a regañadientes. El gran tapiz forma parte de la exposición Te Paepae Aora'i - Where the Gods Cannot be Fooled, una muestra colectiva del colectivo de arte indígena del Pacífico SaVĀge K'lub. La ob",https://meneame.net/story/esto-censura-banderas-palestinas-tapadas-gran-exposicion-galeria,283,748,437,117,166,0,actualidad,14,2025-03-02 21:55:03,TooBased,theguardian.com,https://www.theguardian.com/artanddesign/2025/feb/20/palestinian-flags-covered-nga-gallery-exhibition-ntwnfb,2025-03-04 14:12:45
4033557,Los recursos mineros de Ucrania (2025),"En el mapa, se muestran con distintos colores las principales reservas minerales de Ucrania: Gris: Grafito. Verde oscuro: Litio. Verde claro: Uranio.Rosa: Tierras raras. Amarillo: Polimetálicos (oro, plomo, zinc…). Azul: Metales no ferrosos (níquel, cobalto, cobre…). Morado: Metales de transición (hierro, titanio, manganeso, circonio…)",https://meneame.net/story/recursos-mineros-ucrania-2025,105,1799,469,57,48,0,actualidad,27,2025-03-02 21:55:02,ccguy,mapasmilhaud.com,https://mapasmilhaud.com/mapas-geograficos/los-recursos-mineros-de-ucrania-2025/,2025-03-04 14:12:45
4033578,El motor de un avión de FedEx explota minutos después de despegar de Newark [EN],"El motor de un avión de FedEx estalló en llamas poco después de despegar del aeropuerto de Newark el sábado por la mañana, lo que obligó a realizar un aterrizaje de emergencia ante la estupefacción de los espectadores. Unas dramáticas imágenes muestran cómo el Boeing 767-3S2F regresa a la pista con el motor derecho envuelto en llamas hacia las 8 de la mañana. Otro vídeo muestra cómo el fuego alcanza varios metros de altura mientras dos camiones de bomberos del aeropuerto acuden al lugar de los hechos en el momento en que el avión aterriza.",https://meneame.net/story/motor-avion-fedex-explota-minutos-despues-despegar-newark,115,1662,459,60,55,1,actualidad,23,2025-03-02 21:30:02,TooBased,english.jagran.com,https://english.jagran.com/world/fedex-plane-engine-catches-fire-after-newark-takeoff-forces-emergency-landing-video-10221354,2025-03-04 14:12:45
4033593,Construyen de noche una pista de hormigón ilegal de 90 metros en el poblado (Mallorca),"La impunidad de los narcos no conoce límites. Hace unos días, con alevosía y nocturnidad, los jefes del poblado decidieron asfaltar la entrada, construyendo una pista de noventa metros de largo por veinte de ancho, con hormigón de buena calidad. La nueva pista está coronada por un barco en una rotonda, pintado con los colores de la bandera española",https://meneame.net/story/construyen-noche-pista-hormigon-ilegal-90-metros-poblado,213,4802,419,90,123,1,actualidad,71,2025-03-02 21:15:02,santim123,amp.ultimahora.es,https://amp.ultimahora.es/sucesos/ultimas/2025/03/02/2336609/construyen-noche-pista-hormigon-metros-poblado.html,2025-03-04 14:12:45
4033589,Los efectos colaterales del bloqueo de LaLiga: Movistar bloquea Movistar Plus+,"En las últimas semanas, Movistar, junto con otras operadoras como O2, DIGI y recientemente MásOrange, han implementado un bloqueo para evitar la piratería en el fútbol español. Esta medida solicitada por LaLiga es desproporcionada y termina afectando a servicios legítimos que no tienen ninguna relación con la piratería. El último despropósito de este caso es que el bloqueo activado por Movistar ha terminado afectando incluso al funcionamiento de su propia plataforma de televisión Movistar Plus+.",https://meneame.net/story/efectos-colaterales-bloqueo-laliga-movistar-bloquea-movistar,274,1476,432,109,165,2,actualidad,38,2025-03-02 20:55:03,Pozitronico,adslzone.net,https://www.adslzone.net/noticias/operadores/movistar-bloquea-movistar-plus-pirateria-laliga/,2025-03-04 14:12:45
4033562,Más de 40 militares retirados desafían al Gobierno y se suman a la campaña de apología franquista,"La iniciativa lanzada por la ultraderecha para tratar de contrarrestar los actos del Ejecutivo en defensa de la democracia suma ya más de 800 firmas, según sus promotores. Entre ellos se encuentra el general del Ejército de Tierra Antonio Budiño Carballo, quien obtuvo su último ascenso en el escalafón militar en 2013. Budiño se presentó como cabeza de lista de Vox al Congreso por Pontevedra. Ahora está al frente de un movimiento crítico que pide la refundación del partido de extrema derecha.",https://meneame.net/story/mas-40-militares-retirados-desafian-gobierno-suman-campana,363,621,442,137,226,2,actualidad,44,2025-03-02 20:35:02,Ratoncolorao,publico.es,https://www.publico.es/politica/40-militares-retirados-desafian-gobierno-suman-campana-apologia-franquista.html?fbclid=IwY2xjawIxa7JleHRuA2FlbQIxMQABHRZRHv3liqnzSIvVOdVtffmsWncfi3I6CZNBli8Mcy-TSzQDzIsdW9VYYA_aem_W9GwGQ4_UHYgteUUjWiKHA,2025-03-04 14:12:45
4033586,Kamala Harris asegura que Trump acabaría la guerra en Ucrania «en 24 horas» porque les «abandonaría» [HEMEROTECA],"La vicepresidenta de Estados Unidos, Kamala Harris, ha asegurado que su rival a la Presidencia del país, el exmandatario Donald Trump, acabaría con la guerra en Ucrania «en 24 horas», tal y como ha reclamado el magnate en numerosas ocasiones, porque les «abandonaría» frente a Rusia. «Creo que la razón por la que Donald Trump dice que esta guerra terminaría en 24 horas es porque simplemente les abandonaría», ha afirmado Harris durante el debate presidencial retransmitido por la cadena de televisión ABC News.",https://meneame.net/story/kamala-harris-asegura-trump-acabaria-guerra-ucrania-24-horas-les,311,427,401,114,197,5,cultura,95,2025-03-02 20:10:02,Grahml,lanzadigital.com,https://www.lanzadigital.com/internacional/harris-asegura-que-trump-acabaria-la-guerra-en-ucrania-en-24-horas-porque-les-abandonaria/,2025-03-04 14:12:45
4033528,Las dificultades de VOX para responder si el franquismo fue una dictadura,"Pepa Millán Parro, portavoz de VOX, reacciona a la pregunta sobre el franquismo.",https://meneame.net/story/dificultades-vox-responder-franquismo-fue-dictadura,271,3222,478,110,161,3,actualidad,48,2025-03-02 19:20:03,fareway,youtube.com,https://youtube.com/shorts/nqH5FiF-0Dg?si=nUnyjfH20maHu_qJ,2025-03-04 14:12:45
4033438,Era una emboscada (Eng),"El viernes fue uno de los días más sombríos de la historia de la diplomacia estadounidense. Todo el morbo infligido hoy a Zelensky no debe ocultar la realidad geopolítica de lo que acaba de ocurrir: El presidente de Estados Unidos tendió una emboscada a un aliado leal, presumiblemente para poder llegar pronto a un acuerdo con el dictador de Rusia para vender a una nación europea que lucha por su propia existencia.",https://meneame.net/story/era-emboscada-eng,327,1411,427,133,194,6,actualidad,68,2025-03-02 18:45:02,Verdaderofalso,theatlantic.com,https://www.theatlantic.com/ideas/archive/2025/02/ukraine-us-relations-trump/681880/,2025-03-04 14:12:45
4033468,Rusia avisa que el posible despliegue de fuerzas europeas en Ucrania es una nueva incitación a la guerra,"El ministro de Exteriores de Rusia, Sergei Lavrov, se ha pronunciado este domingo radicalmente en contra del posible despliegue de fuerzas europeas en territorio ucraniano, como barajan desde hace tiempo el primer ministro británico, Keir Starmer, y el presidente francés, Emmanuel Macron, al asegurar que esta decisión representaría una nueva ""incitación"" a la guerra.pero este plan de meter 'fuerzas de paz' en Ucrania no es más que una nueva incitación del régimen de Kiev a la guerra contra nosotros""...",https://meneame.net/story/rusia-avisa-posible-despliegue-fuerzas-europeas-ucrania-nueva,264,639,430,115,149,1,actualidad,189,2025-03-02 18:15:02,cocolisto,europapress.es,https://www.europapress.es/internacional/noticia-rusia-avisa-posible-despliegue-fuerzas-europeas-ucrania-nueva-incitacion-guerra-20250302122311.html,2025-03-04 14:12:45
4033251,"El avión anfibio chino AG600, el mayor del mundo, supera las pruebas para la certificación","El mayor avión anfibio del mundo, el chino AG600, ha completado todas las pruebas de vuelo requeridas para obtener la certificación necesario. El avión, construido en China, tiene 39,6 metros de longitud y una envergadura de 38,8 metros.Rel: www.meneame.net/story/gigantesco-ag600-mayor-avion-anfibio-mundo-punto",https://meneame.net/story/avion-anfibio-chino-ag600-mayor-mundo-supera-pruebas,113,1722,390,59,54,2,tecnología,24,2025-03-02 17:45:03,bonobo,naiz.eus,https://www.naiz.eus/es/gaiak/noticia/20250228/el-avion-anfibio-chino-ag600-el-mayor-del-mundo-supera-las-pruebas-para-la-certificacion?drg_aer6z5UUF-ssqlGA,2025-03-04 14:12:45
4033509,Magia imposible: Hernán Maccagno engaña a Penn & Teller en Fool Us [ENG],"Magia impresionante con monedas! Desde Buenos Aires, Argentina, Hernán Maccagno asombra a Penn & Teller en Fool Us con una rutina impecable. Su técnica y presentación logran lo que pocos pueden: engañar a los maestros del ilusionismo. Mira la reacción de Penn & Teller al ver este efecto mágico alucinante.",https://meneame.net/story/magia-imposible-hernan-maccagno-engana-penn-teller-fool-us-eng,122,3900,435,67,55,0,ocio,32,2025-03-02 16:55:03,Lord_Cromwell,youtube.com,https://www.youtube.com/watch?v=cqpVep7Z7C4,2025-03-04 14:12:45
4033516,"TalDíaComoHoy el joven anarquista y antifascista, Salvador Puig Antic, era asesinado por el franquismo","Tras un juicio sumarísimo, fue ejecutado por medio de garrote vil en la mañana del 2 de marzo de 1974. Fue la última persona ejecutada en España por este método.",https://meneame.net/story/taldiacomohoy-joven-anarquista-antifascista-salvador-puig-antic,511,656,424,209,302,7,cultura,55,2025-03-02 16:30:02,oghaio,bsky.app,https://bsky.app/profile/ecorepublicano.bsky.social/post/3ljfix7gg522s,2025-03-04 14:12:45
4033439,"Rusia declara en busca y captura a la primera ministra estonia Kaja Kallas por ""falsificación de la historia""","También emitió esta orden contra el ministro de Cultura de Lituania, Simonas Kairys, por la destrucción o daños causados a monumentos dedicados a los soldados soviéticos en el país báltico.  El portavoz del Kremlin Dmitri Peskov ha justificado en su rueda de prensa diaria la decisión. ""Se trata de personas responsables de decisiones que en realidad son un abuso de la memoria histórica"", explicó. Él mismo añadió que los políticos de los países bálticos – Estonia, Letonia y Lituania -""están llevando a cabo acciones hostiles...",https://meneame.net/story/rusia-declara-busca-captura-primera-ministra-estonia-kaja-kallas,274,805,417,121,153,2,actualidad,95,2025-03-02 16:15:02,Lord_Cromwell,sport.es,https://www.sport.es/es/noticias/internacional/rusia-declara-busca-captura-primera-ministra-estonia-114842766,2025-03-04 14:12:45
4033437,Saturday Night Live: Reunión de Zelensky con Trump y Vance en la Casa Blanca (ENG),Sketch de la reunion en la Casa Blanca segun Saturday Night Live,https://meneame.net/story/saturday-night-live-reunion-zelensky-trump-vance-casa-blanca-eng,200,7839,384,94,106,2,actualidad,23,2025-03-02 15:40:02,lavandeo,x.com,https://x.com/nbcsnl/status/1896062193524703261,2025-03-04 14:12:45
