news_id,title,content,full_story_link,meneos,clicks,karma,positive_votes,anonymous_votes,negative_votes,category,comments,published_date,user,source,source_link,scraped_date
4033800,"El creador del lenguaje C++ llama a actuar contra ""serios ataques"" al mismo [EN]","Bjarne Stroustrup, creador de C++, ha hecho un llamamiento para que la comunidad defienda el lenguaje de programación, que ha sido rechazado por agencias de ciberseguridad y expertos técnicos en los últimos años por sus deficiencias en la seguridad de la memoria.",https://meneame.net/story/creador-lenguaje-c-llama-actuar-contra-serios-ataques-mismo,0,849,445,74,83,0,tecnología,173,2025-03-03 20:20:03,Supercinexin,theregister.com,https://www.theregister.com/2025/03/02/c_creator_calls_for_action/,2025-03-17 12:13:51
4033833,El profesor que arrasa en redes con sus vídeos sobre arqueología: «Muchos alumnos me siguen y les gusta lo que hago»,"La historia y la arqueología se han convertido para Pedro Pérez en algo más que una vocación. Conocido en redes sociales como El Cubil de Peter, este gijonés se ha convertido en todo un referente dentro de la divulgación histórica en internet. Pero su pasión por contar datos curiosos no se queda solamente en el mundo online. Pedro es además profesor en un colegio concertado de Oviedo, un trabajo que, asegura, obtuvo gracias a las redes sociales. En la actualidad, este divulgador cuenta con más de 337 mil seguidores en Instagram y más de 380 mil",https://meneame.net/story/profesor-arrasa-redes-videos-sobre-arqueologia-muchos-alumnos,0,1200,438,82,94,1,cultura,9,2025-03-03 20:20:02,Elnuberu,lavozdeasturias.es,https://www.lavozdeasturias.es/noticia/gijon/2025/03/03/profesor-arrasa-redes-videos-sobre-arqueologia-alumnos-me-siguen-gusta-hago/00031740990544337265627.htm,2025-03-17 12:13:51
4033811,Muere de asfixia una bebé de tres meses por los gases lacrimógenos lanzados por Israel en Yenín,Un bebé de tres meses ha muerto en las últimas horas de este domingo después de resultar asfixiada por gases lacrimógenos lanzados por el Ejército de Israel,https://meneame.net/story/muere-asfixia-bebe-tres-meses-gases-lacrimogenos-lanzados-israel,0,219,405,113,109,0,actualidad,15,2025-03-03 19:50:02,Verdaderofalso,heraldo.es,https://www.heraldo.es/noticias/internacional/2025/03/03/muere-asfixia-bebe-gases-lacrimogenos-ejercito-israel-yenin-1804150.amp.html,2025-03-17 12:13:51
4033748,No hemos aprendido nada,"Yemen lleva ya más de 10 años en guerra. El bloqueo al que Arabia Saudí y Emiratos Árabes Unidos han sometido al país, ha provocado, según las estimaciones más optimistas de Save the Children, la muerte por inanición de 87.000 niños. Pero hay algo aún más grave: el seguimiento del conflicto ha pasado, según la Federación Internacional de Periodistas de un impacto de 12 noticias semanales en agencias internacionales, a tres o cuatro al mes. A nadie le interesa lo que sucede en Yemen y grandes …",https://meneame.net/story/no-hemos-aprendido-nada,0,2224,441,154,240,3,Artículos,57,2025-03-03 19:05:02,IanCutris,Desconocido,https://www.meneame.net/story/no-hemos-aprendido-nada,2025-03-17 12:13:51
4033813,El software libre gana el Oscar a la Mejor Película Animada,"El mundo de la animación fue anoche testigo de un hito histórico: 'Flow', la película dirigida por el cineasta letón Gints Zilbalodis, se ha alzado con el premio a Mejor Película de Animación en los Premios Oscar. Este triunfo marca un punto de inflexión tanto para la animación independiente como para la industria del software libre, ya que 'Flow' ha sido creada utilizando Blender, una histórica herramienta 'open source' que desafía el dominio de los programas privativos de animación 3D.",https://meneame.net/story/software-libre-gana-oscar-mejor-pelicula-animada,0,1593,423,175,214,1,actualidad,92,2025-03-03 18:30:02,Richaldor,genbeta.com,https://www.genbeta.com/actualidad/software-libre-gana-oscar-a-mejor-pelicula-animada-flow-pelicula-dialogos-desarrollada-blender,2025-03-17 12:13:51
4033610,2025 puede ser como 1968 y 1989: un año en el que la historia del mundo cambia y nada vuelve a ser igual,"Hay años en que el mundo atraviesa cambios fundamentales y convulsivos. Uno de ellos fue 1968, cuando la Unión Soviética invadió Checoslovaquia, y hubo violentos disturbios en Francia y multitudinarias protestas contra la guerra de Vietnam en Estados Unidos. Otro fue 1989, el año de la masacre de Tiananmen, la caída del Muro de Berlín y la sorpresiva implosión del imperio soviético. Viví cada uno de estos sucesos y bajo esa perspectiva me parece que, tras sólo 7 semanas, 2025 podría uno de esos años:",https://meneame.net/story/2025-puede-ser-como-1968-1989-ano-historia-mundo-cambia-nada-ser,0,2990,416,68,112,1,politica,83,2025-03-03 17:55:02,Yorga77,bbc.com,https://www.bbc.com/mundo/articles/c1mn5rx2x81o,2025-03-17 12:13:51
4033824,La Audiencia de Madrid avala ampliar la investigación contra la pareja de Ayuso por su relación con Quirón,"La Audiencia Provincial de Madrid ha decidido avalar que la investigación contra la pareja de Isabel Díaz Ayuso se amplíe a su relación comercial con el grupo sanitario Quirón. Los jueces han rechazado el recurso de Alberto González Amador contra la apertura de una pieza separada: “Las operaciones económicas y jurídicas realizadas podrán o no tener el alcance que se reseña, pero a la conclusión que corresponda debe llegarse tras la correspondiente investigación abierta”, explican.",https://meneame.net/story/audiencia-madrid-avala-ampliar-investigacion-contra-pareja-ayuso,0,520,460,212,310,2,actualidad,57,2025-03-03 17:05:03,Chinchorro,eldiario.es,https://www.eldiario.es/politica/audiencia-madrid-avala-amplie-investigacion-pareja-ayuso-relacion-grupo-quiron_1_12061184.html,2025-03-17 12:13:51
4033796,Al menos un muerto y varios heridos en un atropello masivo en la ciudad alemana de Mannheim,"Al menos una persona ha muertos y varias han resultado heridas este lunes tras ser arrollados por un coche que embistió contra una multitud en la ciudad alemana de Mannheim, al oeste del país, según informa el diario local Mannheimer Morgen. La Policía germana ha confirmado que los agentes están llevando a cabo una operación policial en el centro de la urbe, sin ofrecer por el momento más detalles.",https://meneame.net/story/menos-muerto-varios-heridos-atropello-masivo-ciudad-alemana,0,581,477,125,102,2,actualidad,150,2025-03-03 16:45:04,mariKarmo,eldebate.com,https://www.eldebate.com/internacional/20250303/menos-muerto-varios-heridos-atropello-masivo-ciudad-alemana-mannheim_275252.html,2025-03-17 12:13:51
4033792,"Ayuso llama a empresarios, funcionarios, fiscales y jueces a enfrentarse al Gobierno","La presidenta de la Comunidad de Madrid, Isabel Díaz Ayuso, pidió este domingo a empresarios, funcionarios, fiscales y jueves a que se enfrenten al Gobierno, pongan “pie en pared” y carguen abiertamente contra Pedro Sánchez. En acto del PP de Madrid, Ayuso consideró que es el momento de “perder el miedo y el confort” y “jugársela, salir del armario” y “decir estoy cansado de que el sanchismo arruine a España”. “Esto va de valientes y de gente comprometida con su país”, enfatizó la presidenta regional, que apeló a grandes empresarios, medios...",https://meneame.net/story/ayuso-llama-empresarios-funcionarios-fiscales-jueces-enfrentarse,0,1115,467,176,289,2,actualidad,165,2025-03-03 16:35:03,Harkon,eldiario.es,https://www.eldiario.es/politica/ultima-hora-actualidad-politica-directo_6_12097909_1112520.html,2025-03-17 12:13:51
4033741,El Corte Inglés alerta a todos sus clientes de un ciberataque que ha podido robar miles de cuentas,"El Corte Inglés acaba de encender todas las alarmas tras detectar en la madrugada del lunes una entrada no autorizada de un posible grupo desalmado con intenciones de robar todas las cuentas posibles de sus clientes y hacerse con un buen botín. En el email que la compañía ha enviado sobre las 2:30 horas, se expone que finalmente este incidente se ha subsanado y que afectó a los números de tarjeta de El Corte Inglés. No obstante, siempre hay que extremar las precauciones.",https://meneame.net/story/informacion-enlace-corte-ingles-alerta-todos-clientes-ha-podido,0,1615,454,98,149,0,actualidad,47,2025-03-03 16:15:03,kwisatz_haderach,adslzone.net,https://www.adslzone.net/noticias/seguridad/corte-ingles-ciberataque-robar-cuentas-protegerte/,2025-03-17 12:13:51
4033713,El lince es el nuevo lobo: el ambiente hostil de cazadores y agricultores paraliza tres planes de reintroducción del felino,"El lince fue una alimaña tardía. Mucho después que lobos, osos o zorros, la ley los calificó como dañinos en 1902 a 3,75 pesetas el ejemplar muerto. Bastaron unas décadas del siglo XX para dejar a la especie al borde de la extinción: menos de 100 ejemplares en 2002. La situación la revertió un programa de recuperación (con millones de dinero público) al que todo el mundo parecía querer apuntarse: Castilla-La Mancha, Extremadura, Portugal o la Región de Murcia pidieron linces. Ahora le tocaba el turno a Castilla y León, Aragón y Catalunya.",https://meneame.net/story/lince-nuevo-lobo-ambiente-hostil-cazadores-agricultores-paraliza,0,709,469,118,177,0,actualidad,87,2025-03-03 15:50:03,manzitor,eldiario.es,https://www.eldiario.es/sociedad/lince-nuevo-lobo-ambiente-hostil-cazadores-agricultores-paraliza-tres-planes-reintroduccion-felino_1_12093794.html,2025-03-17 12:13:51
4033728,Vox echa a su portavoz en València por los audios de presunta corrupción,"Vox ha decidido echar del partido a su portavoz en el Ayuntamiento de València, Juanma Badenas. Lo hace tras abrir una investigación interna tras conocerse el presunto amaño de un contrato publicitario en la Fundación Valencia Activa, que preside el propio Badenas, también concejal de Empleo.",https://meneame.net/story/vox-echa-portavoz-valencia-audios-presunta-corrupcion,0,406,437,106,168,0,actualidad,24,2025-03-03 15:35:02,guajevilla7,valenciaplaza.com,https://valenciaplaza.com/valenciaplaza/valencia/vox-echa-a-su-portavoz-en-valencia-por-los-audios-de-presunta-corrupcion-en-valencia-activa,2025-03-17 12:13:51
4033730,"Ayuso admite que se refería a las 7.291 muertes en residencias cuando habló de ""mierdas""","El proceder comunicativo de la presidenta de la Comunidad de Madrid, Isabel Díaz Ayuso, es de sobra conocido y se basa en el establecimiento de un ruido ensordecedor que tape cualquier controversia. Ante una situación de arrinconamiento, la baronesa del Partido Popular (PP) procede a pronunciar una barbaridad que posteriormente tapa o se atribuye su equipo. Sin embargo, esta máquina tan bien engrasada a veces falla y la propia líder autonómica deja a sus subordinando expuestos en la mentira.",https://meneame.net/story/ayuso-admite-referia-7-291-muertes-residencias-cuando-hablo,0,1578,440,163,293,26,politica,56,2025-03-03 15:10:02,Barney_77,elplural.com,https://www.elplural.com/autonomias/madrid/ayuso-admite-referia-7291-muertes-residencias-cuando-hablo-mierdas_347563102,2025-03-17 12:13:51
4033408,"Julián Casanova, biógrafo de Franco: “En España, en 1945, sabían que la represión era una inversión de futuro”","Una biografía para la gente que no sabe apenas sobre Franco. Ese es el propósito que se fijó Julián Casanova, catedrático de Historia Contemporánea en la Universidad de Zaragoza, cuando comenzó a preparar una de sus obras culmen.",https://meneame.net/story/julian-casanova-biografo-franco-espana-1945-sabian-represion-era,0,895,437,94,144,3,cultura,16,2025-03-03 14:45:03,Uvieu1926,lamarea.com,https://www.lamarea.com/2025/03/02/julian-casanova-biografo-de-franco-en-espana-en-1945-sabian-que-la-represion-era-una-inversion-de-futuro/,2025-03-17 12:13:51
4033771,Guardia Civil vs La Tienda Comprometida,"El 5 de febrero, el director de la nave donde trabajamos abre la puerta de nuestro local para avisarnos que teníamos visita. Situación hasta aquí normal si los visitantes no hubieran sido unos 10 Guardias Civiles…",https://meneame.net/story/guardia-civil-vs-tienda-comprometida,0,5412,440,105,133,7,actualidad,49,2025-03-03 14:45:02,Juanro49,latiendacomprometida.com,https://latiendacomprometida.com/blog/noticias-de-nuestra-cooperativa/guardia-civil-vs-la-tienda-comprometida,2025-03-17 12:13:51
4033764,"Losantos: ""El partido de Putin en España se llama VOX""","Federico recuerda con Vanessa Vallecillo y Sergio Heras el ""matonismo televisado"" contra Zelensky de ""los matones Trump y Vance"". [16:25]",https://meneame.net/story/losantos-partido-putin-espana-llama-vox,0,1496,440,122,184,2,actualidad,80,2025-03-03 14:20:03,Icelandpeople,youtube.com,https://www.youtube.com/watch?si=X7UaMxPnpxoLUpbB&t=985&v=cADEfjm7lbc,2025-03-17 12:13:51
4033787,"Ángel Ruiz Sánchez, miembro de VOX, amenaza de muerte a un periodista de Diario Red: ""Te voy a cortar en pedazos""","Ángel Ruiz Sánchez es un seguidor de Vox Monfocar y Vox Betera, dos de las agrupaciones locales del partido ultra que difundieron la campaña racista que ahora rescata Vox Calella y (curioso) en las listas de este partido en dicho municipio a las elecciones municipales de 2023 figuraba de nº 7 un tal Ángel Ruiz Sánchez.",https://meneame.net/story/angel-ruiz-sanchez-miembro-vox-amenaza-muerte-periodista-diario,0,1521,453,145,273,5,actualidad,23,2025-03-03 14:20:02,Harkon,x.com,https://x.com/PabloEchenique/status/1896485279059341766,2025-03-17 12:13:51
4033597,Desbordamiento Rambla Albujón Murcia,"La Dirección General de Seguridad Ciudadana y Emergencias de la Región de Murcia ha activado el sistema ‘ES-Alert’ para alertar a la población sobre el desbordamiento de la Rambla del Albujón, pidiendo a los ciudadanos que eviten la zona y extremen la precaución. El mensaje ha sido recibido en todos los teléfonos móviles de la diputación de Pozo Estrecho y en las áreas próximas a la rambla, desde la A-30 hasta la vía ferroviaria.",https://meneame.net/story/desbordamiento-rambla-albujon-murcia,0,932,392,59,70,0,actualidad,31,2025-03-03 13:55:02,Yorga77,diariodealicante.net,https://diariodealicante.net/es-alert-desbordamiento-rambla-albujon-murcia/,2025-03-17 12:13:51
4033643,Ucrania afirma haber atacado con drones una de las mayores refinerías de petróleo de Rusia,"Ucrania afirmó el sábado haber atacado con un dron una de las mayores refinerías de petróleo de Rusia, provocando un incendio en las instalaciones a más de 1.120 kilómetros dentro de territorio ruso. El ataque a la refinería de Taneco en la ciudad de Nizhnekamsk, Tartaristán, una de las refinerías más grandes y modernas de Rusia Imágenes de las redes sociales geolocalizadas parecen mostrar enormes llamas y humo en el cielo oscuro mientras los trabajadores caminan con dificultad a través de la nieve para evacuar el edificio en llamas.",https://meneame.net/story/ucrania-afirma-haber-atacado-drones-mayores-refinerias-petroleo,0,1080,386,73,104,0,actualidad,177,2025-03-03 13:05:02,VPiscinas,msn.com,https://www.msn.com/en-us/war-and-conflicts/military/ukraine-says-it-has-hit-one-of-russia-s-largest-oil-refineries-in-a-drone-strike/ar-BB1rioBx,2025-03-17 12:13:51
4033456,"Anécdotas de comunidades de vecinos: cuando la realidad supera a ""La que se avecina""","Hasta los 31 años viví en una comunidad de vecinos murciana de clase media-baja. Aunque las paredes eran de papel y se oía con total nitidez la caída de un mondadientes en el piso de al lado, la particular idiosincrasia de la fauna humana que habitábamos el bloque me regaló muchísimas horas de risas a carcajadas (como podréis intuir cuando acabéis la lectura, me encanta el humor negro). Seguidamente os contaré 13 anécdotas de mi vieja comunidad, que os pueden servir como radiografía de una parte muy …",https://meneame.net/story/anecdotas-comunidades-vecinos-cuando-realidad-supera-avecina,0,15756,451,148,131,0,Siénteme,92,2025-03-03 12:10:02,Livingstone85,Desconocido,https://www.meneame.net/story/anecdotas-comunidades-vecinos-cuando-realidad-supera-avecina,2025-03-17 12:13:54
4033709,Un misil ruso ataca un carguero sospechoso de transportar armas británicas a Ucrania (EN),"Dos misiles balísticos Iskander-M atacaron al MSC LEVANTE F, con bandera de Panamá, que se cree es de propiedad suiza, poco después de que atracara en el puerto de Odessa el 1 de marzo, tras una escala en Turquía.",https://meneame.net/story/misil-ruso-ataca-carguero-sospechoso-transportar-armas-ucrania,0,1553,429,75,102,3,actualidad,73,2025-03-03 11:45:02,Tkachenko,baohaiduong.vn,https://baohaiduong.vn/en/ten-lua-nga-tan-cong-tau-hang-nghi-cho-vu-khi-anh-cho-ukraine-406425.html,2025-03-17 12:13:54
4033629,"Project 2025, la agenda negacionista que Trump dice no seguir (aunque sus acciones dicen lo contrario)","La financiación de las políticas de Trump proviene de 6 dinastías familiares multimillonarias que han financiado con un total de 122 millones de dólares al Project 2025. El Proyecto 2025 es un ambicioso plan ultraconservador para reestructurar el Gobierno de EE. UU. encabezado por la Heritage Foundation, el lobby negacionista climático de sobra conocido que ha sido financiado por diferentes petroleras y que, a su vez, financia el negacionismo climático. La iniciativa cuenta con el respaldo de más de 100 grupos conservadores,",https://meneame.net/story/project-2025-agenda-negacionista-trump-dice-no-seguir-aunque,0,1098,434,102,142,2,actualidad,38,2025-03-03 11:10:03,Verdaderofalso,climatica.coop,https://climatica.coop/project-2025-agenda-negacionista-trump/,2025-03-17 12:13:54
4033666,"La trampa oculta en el expediente del PP al ""chalet ilegal"" del juez Peinado en La Adrada: ""Pura corrupción""","Sospechas de “corrupción” en la investigación abierta por parte del Ayuntamiento de La Adrada (Ávila) al chalet que el juez Juan Carlos Peinado, encargado de investigar a Begoña Gómez, posee en esta localidad castellanoleonesa.",https://meneame.net/story/trampa-oculta-expediente-pp-chalet-ilegal-juez-peinado-adrada,0,1606,478,167,369,4,actualidad,32,2025-03-03 10:35:03,Barney_77,elplural.com,https://www.elplural.com/politica/espana/trampa-oculta-expediente-pp-chalet-ilegal-juez-peinado-adrada-pura-corrupcion_347453102,2025-03-17 12:13:54
4033679,¿Pueden los EE.UU. dejar en tierra los F-35 de los países europeos?,El control estadounidense sobre los cazas F-35 preocupa en Europa. Aumenta la preocupación en Europa por la capacidad de Estados,https://meneame.net/story/pueden-ee-uu-dejar-tierra-f-35-paises-europeos,0,3692,510,109,134,0,actualidad,158,2025-03-03 10:35:02,exducados,galaxiamilitar.es,https://galaxiamilitar.es/pueden-los-ee-uu-dejar-en-tierra-los-f-35-de-los-paises-europeos/,2025-03-17 12:13:54
4033657,Un expresidente del Real Madrid confiesa el pago de una mordida de 25 millones a la Gürtel dos décadas después,"El constructor Fernando Martín, quien fuera presidente de la promotora Martinsa, ha admitido que coordinó y participó en el pago de una comisión de 25 millones de euros a la trama Gürtel, encabezada por el empresario Francisco Correa, para asegurarse la adjudicación de un pelotazo inmobiliario en Arganda del Rey (Madrid) entre 2004 y 2006, cuando el PP gobernaba en dicho municipio. Dos décadas después, Fernando Martín ha enviado un escrito firmado a la Audiencia Nacional para confesar su implicación en la red de corrupción...",https://meneame.net/story/expresidente-real-madrid-confiesa-pago-mordida-25-millones-dos,0,845,472,184,389,21,actualidad,74,2025-03-03 10:20:04,candonga1,elpais.com,https://elpais.com/espana/2025-03-03/un-expresidente-del-real-madrid-confiesa-el-pago-de-una-mordida-de-25-millones-a-la-gurtel-dos-decadas-despues.html,2025-03-17 12:13:54
4033675,El fraude de los “manitas” y “chapucillas”.,"Los que se dedican a las pequeñas reparaciones e instalaciones, pero defraudando a Hacienda y a la Seguridad Social.",https://meneame.net/story/fraude-manitas-chapucillas,0,2897,464,96,105,9,actualidad,112,2025-03-03 10:05:02,Mark_Renton_1,laboro-spain.blogspot.com,https://laboro-spain.blogspot.com/2025/03/fraude-instaladores-oficios.html?m=1,2025-03-17 12:13:54
4033662,Mazón paga a las contratistas elegidas a dedo por la DANA entre un 30% y un 300% más que el Gobierno central,"La Generalitat Valenciana ha disparado mucho más que el Ministerio de Transportes el precio que paga por los materiales de la reconstrucción de sus carreteras afectadas por la DANA del pasado 29 de octubre. De la comparativa de las tablas de Presupuestos de Ejecución Material (PEM), creadas por ambas administraciones para las obras de emergencia, se desprende que la Conselleria de Medio Ambiente, Infraestructuras y Territorio ha elaborado una lista de precios unitarios para el coste final de las obras mucho más generosa que el Gobierno de Españ",https://meneame.net/story/mazon-paga-contratistas-elegidas-dedo-dana-entre-30-300-mas,0,613,469,226,360,0,politica,35,2025-03-03 09:45:03,Esteban_Rosador,eldiario.es,https://www.eldiario.es/comunitat-valenciana/mazon-paga-contratistas-elegidas-dedo-dana-30-300-gobierno-central_1_12092598.html,2025-03-17 12:13:54
4033689,Sobre cómo evitó Kodak una III Guerra Mundial y acabó en la quiebra,"Las alianzas entre el gobierno estadounidense y la empresa fotográfica más poderosa del mundo. Cómo se logró una victoria militar estratégica que contribuyó, paradójicamente, a la caída de la Eastman Kodak Co.",https://meneame.net/story/sobre-como-evito-kodak-iii-guerra-mundial-acabo-quiebra,0,3100,454,76,68,0,cultura,12,2025-03-03 09:25:02,arariel,oscarenfotos.com,https://oscarenfotos.com/2014/10/24/de-como-evito-kodak-una-iii-guerra-mundial-y-acabo-en-la-quiebra/,2025-03-17 12:13:54
4033685,"Así manipula Juana Rivas a sus hijos, en los audios de Daniel Arcuri a su padre: ""Mamá me pide que mienta y diga que nos pegas""","«Mamá me dice que diga mentiras». «Vamos a los Carabinieri y mentimos porque mamá nos lo dice». «Mamá dice que diga que tú nos pegas, y no es verdad». «Decimos mentiras a los policías». «Digo mentiras porque no quiero que mamá se enoje conmigo». «Gabriel dice más mentiras que yo». «Sé por mamá que ella también le dice a Gabriel que mienta». tres audios jamás divulgados antes en que Daniel Arcuri, hoy retenido por su madre, Juana Rivas, en Granada, confesaba a su padre que ella y su hermano le pedían que acusara a Francesco Arcuri de maltratarle",https://meneame.net/story/asi-manipula-juana-rivas-hijos-audios-daniel-arcuri-padre-mama,0,2290,451,235,282,22,actualidad,230,2025-03-03 09:05:03,turuleto,elmundo.es,https://www.elmundo.es/cronica/2025/03/02/67bf1e9de4d4d8276b8b45a2.html,2025-03-17 12:13:54
4033650,Solo porque algo no se pueda explicar no hay que apelar a “fuerzas” mágicas,"En tan solo un minuto Neil DeGrasse imparte una lección magistral de pensamiento crítico, enseñanza que debería ser repetida año tras año al comienzo del calendario lectivo para así poder llegar a formar en un futuro una ciudadanía con una mínima capacidad de análisis y racionalismo.",https://meneame.net/story/solo-porque-algo-no-pueda-explicar-no-hay-apelar-fuerzas-magicas,0,2843,523,115,139,0,ciencia,62,2025-03-03 08:35:03,ccguy,cnho.wordpress.com,https://cnho.wordpress.com/2025/03/03/solo-porque-algo-no-se-pueda-explicar-no-hay-que-apelar-a-fuerzas-magicas/,2025-03-17 12:13:54
4033342,El presidente Putin llega a Quahog,El presidente Putin llega a Quahog.  Padre de familia. Temporada 16 Episodio 7,https://meneame.net/story/presidente-putin-llega-quahog,0,3652,393,51,49,0,ocio,9,2025-03-03 08:05:05,Charles_Dexter_Ward,youtube.com,https://www.youtube.com/watch?si=vxhOvThmpL9f7T4k&v=wJFFfgDICQM,2025-03-17 12:13:54
4033483,Elon Musk apoya la retirada de EE.UU. de la OTAN [EN],"Elon Musk, figura clave en la administración del presidente Donald Trump y jefe del Departamento de Eficiencia Gubernamental de Estados Unidos, ha respaldado los llamamientos para que Estados Unidos abandone la Organización del Tratado del Atlántico Norte (OTAN). Musk expresó su apoyo en X (antes Twitter) el sábado por la noche cuando respondió «Estoy de acuerdo» a un post que decía: «Es hora de abandonar la OTAN y la ONU.» Su apoyo se alinea con los crecientes llamamientos de algunos legisladores republicanos, entre ellos el senador Mike Lee.",https://meneame.net/story/elon-musk-apoya-retirada-ee-uu-otan,0,706,362,132,160,2,politica,171,2025-03-03 07:10:11,Pablosky,ukdefencejournal.org.uk,https://ukdefencejournal.org.uk/elon-musk-backs-us-withdrawal-from-nato-alliance/,2025-03-17 12:13:54
4033550,"Sabíamos que las ventas de Tesla en Europa se han hundido. Ahora la sorpresa son las marcas chinas, y sus números son espectaculares","Mientras Tesla registró en enero una caída en las ventas del 45% en Europa, con 9.913 unidades, las ventas de las marcas chinas aumentaron un 52% respecto a enero del año pasado, según datos de Jato Dynamics. Las marcas chinas matricularon en Europa 37.134 vehículos en enero. Sigue siendo una cifra relativamente pequeña en el cómputo global del mercado europeo, pero su crecimiento es muy significativo. No sólo creció su volumen total, también aumentó su cuota de mercado, pasando del 2,4% en enero de 2024 al 3,7% al cierre del mes pasado, según",https://meneame.net/story/sabiamos-ventas-tesla-europa-han-hundido-ahora-sorpresa-son-son,0,1611,379,114,160,5,actualidad,54,2025-03-03 05:55:03,lavandeo,hibridosyelectricos.com,https://www.hibridosyelectricos.com/coches/ventas-coches-marcas-chinas-europa-2025_78789_102.html,2025-03-17 12:13:54
