news_id,title,content,full_story_link,meneos,clicks,karma,positive_votes,anonymous_votes,negative_votes,category,comments,published_date,user,source,source_link,scraped_date
4035493,"Trump castiga a la Universidad de Columbia por ""antisemitismo"" y cancela 400 millones de dólares en subvenciones",La Administración ha tomado esta decisión casi un año después de las protestas propalestinas que sacudieron el campus de la prestigiosa universidad de Nueva York,https://meneame.net/story/trump-castiga-universidad-columbia-antisemitismo-cancela-400,0,421,379,159,235,1,actualidad,39,2025-03-08 03:50:03,Tkachenko,eldiario.es,https://www.eldiario.es/internacional/trump-castiga-universidad-columbia-antisemitismo-cancela-400-millones-dolares-subvenciones_1_12114545.html,2025-03-17 12:13:28
4035417,Polonia - Tusk anuncia un plan de entrenamiento militar a gran escala para todos los hombres adultos de Polonia,"El primer ministro de Polonia, Donald Tusk, ha anunciado este viernes ante el Sejm --el Parlamento-- un plan de Gobierno para ofrecer entrenamiento militar a gran escala a todos los ciudadanos polacos adultos con el fin de aumentar las filas de las Fuerzas Armadas hasta el medio millón de efectivos. ""Se está trabajando para preparar un entrenamiento militar a gran escala para todos los varones adultos en Polonia"", ha contado Tusk, quien confía en que el plan esté listo para finales de 2025 y así puedan esta ""entrenados en caso de guerra"".",https://meneame.net/story/polonia-tusk-anuncia-plan-entrenamiento-militar-gran-escala,0,644,379,112,131,0,actualidad,165,2025-03-08 03:00:03,dvdkrku,europapress.es,https://www.europapress.es/internacional/noticia-polonia-tusk-anuncia-plan-entrenamiento-militar-gran-escala-todos-hombres-adultos-polonia-20250307164452.html,2025-03-17 12:13:28
4035513,El dólar cae con fuerza y se encamina a su peor semana desde 2022,Los aranceles impuestos y postergados por el presidente Donald Trump están generando incertidumbre y han ensombrecido las perspectivas económicas de Estados Unidos.,https://meneame.net/story/dolar-cae-fuerza-encamina-peor-semana-desde-2022,0,1513,411,110,169,0,actualidad,90,2025-03-08 02:10:02,Icelandpeople,bloomberglinea.com,https://www.bloomberglinea.com/mercados/el-dolar-cae-con-fuerza-y-se-encamina-a-su-peor-semana-desde-2022/,2025-03-17 12:13:30
4035514,Canadá mantendrá aranceles a EEUU a pesar del aplazamiento que anunció Trump,"Los aranceles de represalia que impuso Canadá en un principio a Estados Unidos permanecerán vigentes por el momento, a pesar de que el presidente Donald Trump anunció un aplazamiento en el gravamen del 25% sobre muchas de las importaciones procedentes de Canadá durante un mes. Los aranceles de represalia iniciales de Canadá, que ascienden a 30.000 millones de dólares canadienses, se han aplicado a artículos como jugo de naranja, mantequilla de maní, café, electrodomésticos, calzado, cosméticos, motocicletas y papel.",https://meneame.net/story/canada-mantendra-aranceles-eeuu-pesar-aplazamiento-anuncio-trump,0,560,406,145,176,0,actualidad,23,2025-03-08 01:50:03,jm22381,latimes.com,https://www.latimes.com/espanol/internacional/articulo/2025-03-06/canada-mantendra-aranceles-a-eeuu-a-pesar-del-aplazamiento-que-anuncio-trump,2025-03-17 12:13:30
4035521,Gene Hackman murió de un fallo cardiaco días después de que su esposa falleciera por un virus,"El médico forense del condado de Santa Fe (Nuevo México) ha determinado que un fallo cardiaco provocó la muerte del actor, de 95 años. Este murió días después de su esposa, Betsy Arakawa, de 65, quien falleció afectada por el hantavirus, una infección mortal transmitida por el contacto con la orina o excrementos de los roedores. Las autoridades han señalado este viernes que el Alzheimer jugó un papel en la muerte de Hackman, quien pudo no haberse percatado de que su mujer había fallecido.",https://meneame.net/story/gene-hackman-murio-fallo-cardiaco-dias-despues-esposa-falleciera,0,1608,419,114,108,1,actualidad,49,2025-03-08 01:30:03,Zoidborg,elpais.com,https://elpais.com/cultura/2025-03-07/gene-hackman-murio-de-un-fallo-cardiaco-dias-despues-de-que-su-esposa-falleciera-por-un-virus.html,2025-03-17 12:13:30
4035393,Localizan en Bérchules los restos del campamento militar donde se amotinó el último rey morisco de Granada,"Investigadores de la Universidad de Granada han localizado restos arqueológicos -cerámica y un muro- que atestiguarían dónde se atrincheró el último rey morisco de la Alpujarra, Abén Aboo, capturado tras ser traicionado y cuya muerte puso fin a la guerra de Las Alpujarras, uno de los conflictos más singulares en la Europa del siglo XVI y que se produjo entre los años 1568 y 1571. La evidencia cobra mayor interés por el hecho de que se hila con una leyenda que, como no puede ser de otra manera, está cuajada de hechos inverosímiles pero hermosos",https://meneame.net/story/localizan-berchules-restos-campamento-militar-donde-amotino-rey,0,740,400,59,79,0,cultura,2,2025-03-08 01:10:07,Lord_Cromwell,granadahoy.com,https://www.granadahoy.com/granada/localizan-berchules-restos-campamento-militar-rey-morisco-granada_0_2003470941.html,2025-03-17 12:13:30
4035478,"En Nueva York, los huevos ya se venden por unidad tras dispararse los precios: hay supermercados donde la docena se vende por 15 dólares","En la ciudad más rica de EE.UU., donde más de un cuarto de la población vive bajo el umbral de la pobreza, surgió la idea de vender huevos por unidad cuando los clientes empezaron a decir que “ya no podían permitirse” la caja entera. Una desempleada compró 3 huevos por $2,90. “Una docena es demasiado cara”, confesó avergonzada. Se trata de un golpe para la clase trabajadora, noqueada por la inflación. No es el único producto de primera necesidad que sube, “otros productos también suben cada día”, como el aguacate en trozos envuelto en plástico.",https://meneame.net/story/nueva-york-huevos-ya-venden-unidad-tras-disararse-precios-hay-15,0,916,434,123,165,0,actualidad,79,2025-03-08 00:25:02,Dragstat,elpais.com.co,https://www.elpais.com.co/mundo/en-nueva-york-los-huevos-ya-se-venden-por-unidad-tras-disparada-de-precios-esta-es-la-razon-0116.html,2025-03-17 12:13:30
4035489,Ana Peleteiro siempre vuelve: segundo oro europeo indoor (triple salto),"La gallega se impone con un mejor salto de 14,37 metros, marca europea del año, y logra su octava medalla en una gran competición internacional.",https://meneame.net/story/ana-peleteiro-siempre-vuelve-segundo-oro-europeo-indoor-triple,0,634,434,171,195,3,actualidad,40,2025-03-08 00:05:02,Chitauri,marca.com,https://www.marca.com/atletismo/2025/03/07/ana-peleteiro-siempre-vuelve-segundo-oro-europeo-indoor.html,2025-03-17 12:13:30
4035224,El rechazo,Viñeta humorística de Ferran Martín para diario red,https://meneame.net/story/el-rechazo-1,0,3153,413,109,138,1,Toréame,49,2025-03-07 23:50:02,Mark_Renton_1,diario.red,https://www.diario.red/articulo/vinetas/el-rechazo/20250227191724043398.html,2025-03-17 12:13:30
4035463,Nace una opaca plataforma que pide el boicot a productos made in USA,"Contra los coches Ford o Tesla, vehículos VW, Renault o Skoda. Ante Google, Gmail, Microsoft o ChatGPT... Qwant, Proton Mail, Libre Office o Mistral. En vez de Instagram, Mastodon. Y en materia de moda, Zara en lugar de Levi's... La plataforma Buy European Made (compre fabricado en Europa), también llamada BuyFromEU, difunde en internet un listado de marcas europeas alternativas.",https://meneame.net/story/nace-opaca-plataforma-pide-boicot-productos-made-in-usa,0,2715,457,126,219,0,actualidad,91,2025-03-07 23:30:03,capitan__nemo,elperiodico.com,https://www.elperiodico.com/es/internacional/20250302/nace-plataforma-europea-pide-boicot-estados-unidos-anti-trump-114853254,2025-03-17 12:13:30
4035385,Trump critica ahora a Putin y amenaza con sanciones a Rusia hasta que firme la paz con Ucrania,"El presidente de EEUU censura los últimos ataques rusos y exige que ambos bandos negocien ""antes de que sea tarde""",https://meneame.net/story/trump-critica-ahora-putin-amenaza-sanciones-rusia-hasta-firme,0,1017,449,102,114,0,actualidad,112,2025-03-07 23:00:02,ikipol,eldiario.es,https://www.eldiario.es/internacional/trump-critica-ahora-putin-amenaza-sanciones-rusia-firme-paz_1_12113565.html,2025-03-17 12:13:30
4035455,El cantante iraní Mehdi Yarrahi recibe 74 latigazos por canción de protesta en apoyo a las mujeres,"El cantante Mehdi Yarrahi recibió 74 latigazos como condena por una de sus canciones donde llama a las mujeres a dejar de usar el velo islámico. Yarrahi fue arrestado por “desafiar la moral y costumbres de la sociedad islámica”.Previo a recibirlos dijo “aunque condeno esta tortura inhumana, no haré ninguna solicitud para cancelarla”. ""Gracias por su apoyo constante y por la sincera compañía de los respetados abogados Mustafa Nili y Zahra Minouei. Quien no está dispuesto a pagar el precio de la libertad, no la merece. Les deseo libertad”",https://meneame.net/story/cantante-irani-mehdi-yarrahi-recibe-74-latigazos-cancion-apoyo,0,1518,487,173,238,0,actualidad,60,2025-03-07 22:35:03,Meneador_Compulsivo,biobiochile.cl,https://www.biobiochile.cl/noticias/sociedad/debate/2025/03/06/cantante-irani-recibe-74-latigazos-por-cancion-de-protesta-en-apoyo-a-las-mujeres.shtml,2025-03-17 12:13:30
4035432,Reflexiones sobre nuestro maravilloso saco ingobernable y una petición a los dueños de Menéame,"Ayer tenía karma 20 y hoy tan sólo karma 6, pero me siento más orgulloso que nunca de pertenecer a esta comunidad. Cada uno de los usuarios de Menéame somos de nuestro padre y nuestra madre, y muchos somos radicales desde cosmovisiones del mundo claramente opuestas. Somos susceptibles y hasta picajosos, nos ponemos a parir con relativa asiduidad y no pocas veces acabamos peleándonos todos contra todos en comentarios o notas. Pero cuando intentan censurarnos, la inmensa mayoría nos unimos y acabamos derrotando a la autoridad que pretende...",https://meneame.net/story/reflexiones-sobre-nuestro-maravilloso-saco-ingobernable-peticion,0,4243,460,336,232,11,Artículos,264,2025-03-07 22:20:02,Livingstone85,Desconocido,https://www.meneame.net/story/reflexiones-sobre-nuestro-maravilloso-saco-ingobernable-peticion,2025-03-17 12:13:30
4035378,"Pausanias, el rey espartano que venció a los persas en Platea y murió emparedado por sus propios conciudadanos","En el año 467 a.C. una enfurecida mujer se acercó a la puerta del templo de Atenea Calcieco, en Esparta, y colocó un ladrillo con una inscripción que decía: «Indigno de ser espartano, no eres mi hijo». Ese duro mensaje iba dirigido a su vástago, que se había refugiado allí huyendo de la justicia y quedó encerrado cuando otros espartanos tapiaron esa entrada, impidiéndole no sólo salir sino recibir comida y agua. No se trataba de un prófugo cualquiera sino del mismísmo Pausanias, vencedor de los persas en la batalla de Platea.",https://meneame.net/story/pausanias-rey-espartano-vencio-persas-platea-murio-emparedado,0,1946,453,65,69,1,cultura,1,2025-03-07 21:50:03,Jai077,labrujulaverde.com,https://www.labrujulaverde.com/2025/03/pausanias-el-rey-espartano-que-vencio-a-los-persas-en-platea-y-murio-emparedado-por-sus-propios-conciudadanos,2025-03-17 12:13:30
4035301,"Iñaki López, ante las críticas del Ayuntamiento de Lorca a la AEMET: ""¡Ni que fueran dos señores decidiendo el tiempo mientras se toman un sol y sombra!""","Iñaki López y Francisco Cacho, meteorólogo de laSexta, dejan claro que la ""AEMET no cambia de opinión constantemente"", como ha indicado el Ayuntamiento de Lorca, sino que ""la meteorología no es una ciencia exacta"". El alcalde de Lorca ha solicitado a los vecinos de la localidad murciana que se queden en casa debido a las fuertes lluvias y, como apunta Iñaki López en MVT, ""parece que la explicación que han dado es por los 'constantes cambios de opinión de la AEMET'"". ""¡Cómo si la AEMET fueran dos señores decidiendo el tiempo mientras se...""",https://meneame.net/story/inaki-lopez-ante-criticas-ayuntamiento-lorca-aemet-ni-fueran-dos,0,1007,398,90,142,2,actualidad,18,2025-03-07 21:15:02,ContinuumST,lasexta.com,https://www.lasexta.com/programas/mas-vale-tarde/inaki-lopez-criticas-ayuntamiento-lorca-aemet-que-fueran-dos-senores-decidiendo-tiempo-mientras-toman-sol-sombra_2025030667c9e8fc39a0dc0001bf725a.html,2025-03-17 12:13:30
4035174,China ve en el mundo actual «más razones que nunca» para buscar buena relación con la UE,"El ministro chino de Exteriores, Wang Yi, consideró este viernes que en el escenario mundial actual hay «más razones que nunca» para que su país y la Unión Europea (UE) mantengan una buena relación y la fortalezcan.",https://meneame.net/story/china-ve-mundo-actual-mas-razones-nunca-buscar-buena-relacion-ue,0,1060,400,237,347,1,politica,120,2025-03-07 20:30:03,Éder_Militao,efe.com,https://efe.com/mundo/2025-03-07/china-fortalecimiento-relacion-ue/,2025-03-17 12:13:30
4035426,"Tensión en el centro de Málaga por una intervención policial con un artista callejero: ""¡Id a por los rateros!""","El centro de Málaga vivió ayer momentos de tensión debido a una intervención policial con un artista callejero, que estaba realizando un espectáculo acrobático con una rueda denominada ""cyr"" en la plaza de la Constitución. Los asistentes captaron con sus móviles los momentos previos a la actuación de la Policía Local de Málaga, en los que se aprecia a un joven ejecutando una coreografía con música frente a un nutrido grupo de personas, que habían abierto un gran círculo para asistir al show.",https://meneame.net/story/tension-centro-malaga-intervencion-policial-artista-callejero-id,0,2172,415,107,209,1,actualidad,91,2025-03-07 19:45:03,Lord_Cromwell,diariodemallorca.es,https://www.diariodemallorca.es/sucesos/2025/03/07/tension-centro-malaga-intervencion-policial-115045586.html,2025-03-17 12:13:30
4035278,El gigante neerlandés de los chips se sale del guión de EEUU y levantará un nuevo centro en China,"La hoja de ruta de EEUU para vencer a China en la carrera tecnológica pasa por obstaculizar el desarrollo de Pekín en este ámbito. Para ello, la Administración Biden llevó a cabo un proceso de conversaciones y negociaciones con países aliados que poseen un rol clave en la industria de los chips, logrando que la neerlandesa ASML vetara la venta de sus máquinas litográficas -necesarias para fabricar procesadores avanzados- a China. Ahora, el gobierno de Trump está estudiando nuevas fórmulas para contener el desarrollo tecnológico de China.",https://meneame.net/story/gigante-neerlandes-chips-sale-guion-eeuu-levantara-nuevo-centro,0,1420,453,173,224,0,actualidad,81,2025-03-07 19:05:02,IkkiFenix,eleconomista.es,https://www.eleconomista.es/tecnologia/noticias/13254682/03/25/el-gigante-neerlandes-de-los-chips-se-sale-del-guion-de-eeuu-y-levantara-un-nuevo-centro-en-china.html,2025-03-17 12:13:30
4035238,Héroes de guerra y pioneras militares se encuentran entre las 26.000 imágenes marcadas para su eliminación en la purga DEI del Pentágono (ENG),"Referencias a un receptor de la Medalla de Honor de la Segunda Guerra Mundial, al avión Enola Gay que lanzó una bomba atómica sobre Japón y a las primeras mujeres en aprobar el entrenamiento de infantería de marina se encuentran entre las decenas de miles de fotos y publicaciones online marcadas para su eliminación mientras el Departamento de Defensa trabaja para purgar el contenido de diversidad, equidad e inclusión .",https://meneame.net/story/heroes-guerra-pioneras-militares-encuentran-entre-26-000-purga,0,817,465,92,133,0,actualidad,55,2025-03-07 18:40:02,Ratoncolorao,apnews.com,https://apnews.com/article/dei-purge-images-pentagon-diversity-women-black-8efcfaec909954f4a24bad0d49c78074,2025-03-17 12:13:30
4035412,Anuncio de Scattergories (1996),"Anuncio de televisión de Scattergories de los años 90. ""Es mi Scattegories y me lo llevo""",https://meneame.net/story/anuncio-scattergories-1996,0,3096,536,169,96,3,ocio,42,2025-03-07 18:15:02,jonolulu,youtube.com,https://www.youtube.com/watch?v=ScNlOTCmxRg,2025-03-17 12:13:30
4035054,"Varsavsky, el astrofísico que escuchaba susurrar al universo","Parecía una inmensa araña patas para arriba. “Es la maqueta del primer radiotelescopio de Sudamérica”, anunció en el Aula Magna de la Facultad de Física de la Universidad de La Plata, en una clase magistral que dio en abril de 1965. Carlos Varsavsky había ideado una portentosa estructura de acero y aluminio, con una pantalla receptora de 30 metros de diámetro.",https://meneame.net/story/varsavsky-astrofisico-escuchaba-susurrar-universo,0,793,748,117,104,30,ciencia,51,2025-03-07 18:00:10,XQNO,diariohoy.net,https://diariohoy.net/interes-general/carlos-manuel-varsavsky-el-hombre-que-escuchaba-susurrar-al-universo-211855,2025-03-17 12:13:30
4035289,"'Polònia' parodia la sobremesa de Mazón el día de la DANA, con aparición sorpresa de Feijóo: ""La culpa fue de Pedro""",El programa satírico de TV3 recrea el famoso videoclip de C. Tangana y Antonio Carmona para cantar con Carlos Mazón desde El Ventorro al ritmo de...,https://meneame.net/story/polonia-parodia-sobremesa-mazon-dia-dana-aparicion-sorpresa-fue,0,4080,429,135,180,3,actualidad,9,2025-03-07 17:55:02,CosasQueLees,eldiario.es,https://www.eldiario.es/vertele/videos/actualidad/polonia-parodia-sobremesa-mazon-dia-dana-aparicion-sorpresa-feijoo-culpa-pedro_7_12111806.html,2025-03-17 12:13:30
4035343,"Tras la amenaza de Trump, el líder de la Columbia Británica dice que la provincia impondrá peajes al comercio con Alaska [Ing]","El primer ministro de Columbia Británica, David Eby, dijo el jueves que tiene la intención de introducir una legislación que impondría peajes a los camiones comerciales que viajan desde los 48 estados inferiores a Alaska a través de su provincia. En la Asamblea Legislativa en Victoria, Eby dijo que la medida es una de varias en respuesta a los erráticos planes arancelarios del presidente Trump con Canadá. ""La nueva ley Incluirá contramedidas como permitir que la provincia aplique tasas a los camiones comerciales que transiten por ella.""",https://meneame.net/story/tras-amenaza-trump-lider-columbia-britanica-dice-provincia-ing,0,593,443,115,176,0,actualidad,30,2025-03-07 17:35:03,JanSmite,alaskabeacon.com,https://alaskabeacon.com/2025/03/06/after-trump-threat-british-columbia-leader-says-province-will-impose-tolls-on-alaska-bound-commerce/,2025-03-17 12:13:30
4035351,Los nuevos desarrolladores no saben programar sin IA: la preocupante tendencia que alarma a los veteranos del sector,"“Con StackOverflow, tenías que leer varias discusiones de expertos para entender todo”, “era más lento, pero aprendías no solo qué funcionaba, sino por qué funcionaba”, mientras más usan las IA más pierden sus habilidades de pensamiento crítico.  “Cada desarrollador junior con el que hablo tiene Copilot, Claude o GPT funcionando las 24 horas. Están lanzando código más rápido. “Claro, el código funciona, pero pregúntales por qué funciona de esa manera en lugar de otra… silencio absoluto. Pregúntales sobre casos extremos… miradas en blanco”.",https://meneame.net/story/nuevos-desarrolladores-no-saben-programar-sin-ia-preocupante,0,1316,453,113,162,2,tecnología,163,2025-03-07 17:20:03,Dragstat,facialix.com,https://facialix.com/los-nuevos-desarrolladores-no-saben-programar-sin-ia-la-preocupante-tendencia-que-alarma-a-los-veteranos-del-sector/,2025-03-17 12:13:30
4035389,"Bueno. Vamos a llevarnos bien, porque si no, va a haber hondonadas de ostias aquí, ¡eh!","Extracto de la película Air-bag donde el legendario Pazos, expone su visión de lo que debe ser un acto de negociación para llegar a acuerdos.",https://meneame.net/story/vamos-llevarnos-bien-porque-no-va-haber-hondonadas-ostias-aqui,0,3501,419,120,107,2,ocio,63,2025-03-07 17:05:02,mis_cojones_33,youtube.com,https://www.youtube.com/watch?app=desktop&v=6_uYRUIAum4,2025-03-17 12:13:30
4034679,GT Voice: ¿Pueden los agricultores estadounidenses soportar las repercusiones de la política arancelaria de EE.UU.? (Eng),"Los crecientes costos asociados con los aranceles estadounidenses se están materializando rápidamente en una crisis real y formidable para los agricultores estadounidenses, quienes probablemente serán los primeros en sufrir el peso de las hostilidades comerciales desencadenadas por la política arancelaria de Washington. Cuando Washington vuelve a recurrir a la vara arancelaria, parece haber olvidado una realidad crucial: la dependencia fundamental de la agricultura estadounidense de los mercados internacionales sigue siendo la misma. Esto sig",https://meneame.net/story/gt-voice-pueden-agricultores-estadounidenses-soportar-politica,0,879,411,59,100,0,politica,17,2025-03-07 16:45:02,onainigo,globaltimes.cn,https://www.globaltimes.cn/page/202503/1329495.shtml,2025-03-17 12:13:30
4035335,"Nuestro experto en jardinería, José Luis Martínez-Almeida, te explica cómo sustituir los geranios de tu balcón por baldosas sobre una base de hormigón","Prueba de que el calentamiento no existe es que estamos en los meses de frío y nuestros balcones del chalé o del piso que tenemos en la calle Serrano no pueden ocultar la tristeza de unas plantas mustias de color marrón caca. Por su bien y por el nuestro, llega el momento de retirarlas y sustituirlas por un embaldosado sobre base de hormigón que aportará un aire moderno a nuestras viviendas, amén de un pavimento resistente y estable.",https://meneame.net/story/nuestro-experto-jardineria-jose-luis-martinez-almeida-explica-tu,0,1347,435,136,175,4,ocio,9,2025-03-07 16:25:02,Thornton,elmundotoday.com,https://www.elmundotoday.com/2025/03/nuestro-experto-en-jardineria-jose-luis-martinez-almeida-te-explica-como-sustituir-los-geranios-de-tu-balcon-por-baldosas-sobre-una-base-de-hormigon/,2025-03-17 12:13:30
4035213,Hay más trabajadores de 50 años opositando en secreto para ser funcionarios de lo que crees,"Un perfil de opositor se ha disparado en los últimos años: el empleado que, al llegar a su quinta década, empieza a verle las orejas al lobo y prepara su salida al sector público",https://meneame.net/story/hay-mas-trabajadores-50-anos-opositando-secreto-ser-funcionarios,0,2282,447,86,166,1,actualidad,99,2025-03-07 16:05:02,zanguangaco,elconfidencial.com,https://www.elconfidencial.com/economia/2025-03-07/trabajadores-50-opositando-secreto-funcionarios_4080313/,2025-03-17 12:13:32
4035291,Lo que vio Mariano,Lo que vio Mariano.  Rajoy asegura en el Congreso que no tiene “ningún conocimiento” de la Operación Catalunya. Viñeta de Manel Fontdevila,https://meneame.net/story/lo-que-vio-mariano,0,2043,439,116,137,1,politica,13,2025-03-07 15:30:03,jdmf,eldiario.es,https://www.eldiario.es/opinion/vio-mariano_131_12107812.html,2025-03-17 12:13:32
4035119,6 de  Marzovsky,El 6 de Marzovsky es el 65.º (sexagésimo quinto) día del año en el calendario gregoriano y el 66.º en los años bisiestos. Quedan 300 días para finalizar el año.,https://meneame.net/story/7-de-marzavsky,0,6358,403,148,115,29,cultura,44,2025-03-07 15:00:03,aPedirAlMetro,es.wikipedia.org,https://es.wikipedia.org/wiki/7_de_marzo,2025-03-17 12:13:32
4035254,"""No somos héroes"": los senegaleses que trataron de salvar a un joven asesinado en un ataque homófobo en España","Ibrahima Diack camina lento por el paseo que bordea el mar en La Coruña y que lleva al estadio de fútbol de Riazor. Pasa por las escaleras blancas donde todo ocurrió como si no reconociera el sitio. No cambia de paso, no alza la mirada. El 3 de julio de 2021 había quedado en este paseo con su amigo Magatte N´Diaye. Ambos crecieron en la misma aldea a las afueras de Dakar y llegaron a España en el mismo cayuco atravesando el estrecho de Gibraltar. Esa noche en la ciudad gallega se encontraron de bruces con una ""jauría humana"" que pateaba.",https://meneame.net/story/no-somos-heroes-senegaleses-trataron-salvar-joven-asesinado,0,914,436,112,180,1,actualidad,52,2025-03-07 14:20:03,Elnuberu,bbc.com,https://www.bbc.com/mundo/articles/cvg54z2n983o,2025-03-17 12:13:32
4035332,Menéame censura una publicación que relaciona a Martín Varsavsky con la agenda de Epstein,"Los administradores eliminaron la información que señala al empresario, principal accionista del agregador de noticias, entre los contactos del depredador sexual.",https://meneame.net/story/meneame-censura-publicacion-relaciona-martin-varsavsky-agenda,0,7249,464,683,810,16,actualidad,270,2025-03-07 14:00:03,decker,ctxt.es,https://ctxt.es/es/20250301/Firmas/48771/gerardo-tece-meneame-martin-varsavsky-epstein.htm,2025-03-17 12:13:32
4035100,"Mobuzz, Dans y la economía de la cancamusa [HEMEROTECA]","Ellos se relamen gustosos el centro de gravedad, se consideran triunfadores, y tratan con cierto desdén a los que nos sudamos el jornal. Son arrogantes mientras dura la sopa boba; creen elevarse por encima de los mortales flotando en su nube de cancamusa. Se acaban creyendo la propaganda y, como Narciso, se enamoran de su reflejo en un PowerPoint y pierden absolutamente la perspectiva. Valga de ejemplo el comentario de nuestro amigo en Japón después de recibir una charla cancamusera del señor que regala routers: “por la tarde llegó el mito […]",https://meneame.net/story/mobuzz-dans-economia-cancamusa-hemeroteca,0,1463,444,75,46,0,cultura,19,2025-03-07 13:50:03,Pertinax,managersmagazine.com,https://managersmagazine.com/index.php/2010/05/mobuzz-dans-y-la-economia-de-la-cancamusa/,2025-03-17 12:13:32
