news_id,title,content,full_story_link,meneos,clicks,karma,positive_votes,anonymous_votes,negative_votes,category,comments,published_date,user,source,source_link,scraped_date
4037473,Donald Trump en Atlantic City: casinos en bancarrota y promesas sin cumplir,"... Trump creó su imperio de casinos pidiendo prestado a tasas de interés tan altas —después de decirle a los reguladores que no lo haría— que las posibilidades de tener éxito de sus negocios eran casi nulas. Las empresas de sus casinos terminaron cuatro veces en un tribunal de quiebras, y en cada ocasión persuadieron a los titulares para que aceptaran menos dinero del que les correspondía en lugar de ser eliminados del esquema de pagos.",https://meneame.net/story/donald-trump-atlantic-city-casinos-bancarrota-promesas-sin,0,1298,409,86,167,0,politica,28,2025-03-13 11:45:02,Ramen,nytimes.com,https://www.nytimes.com/es/2016/06/17/espanol/donald-trump-en-atlantic-city-casinos-en-bancarrota-y-promesas-sin-cumplir.html,2025-03-17 12:13:08
4037453,‘Vickie el vikingo’: cómo entrenar tu entusiasmo,"¿sabes realmente por qué nunca te pegaste con el matón de clase? Porque sabías que la fuerza bruta no sirve absoluta mente para nada.  Te lo enseñó Vickie el vikingo desde el primer capítulo. Aprendiste que una catapulta construida con las flexibles ramas de un álamo era más eficaz para transportar piedras que llevarlas una a una a lo bruto. Aprendiste que, si están suficiente mente camufladas, unas espadas azules de madera y barro son tan poderosas como el mejor de los aceros. Aprendiste que construir un depósito de agua facilita la vida.",https://meneame.net/story/vickie-vikingo-como-entrenar-tu-entusiasmo,0,1138,375,92,91,0,cultura,33,2025-03-13 11:20:02,ccguy,jotdown.es,https://www.jotdown.es/2025/03/vickie-el-vikingo-entrenar-tu-entusiasmo/,2025-03-17 12:13:08
4037460,Más de cien detenidos y cientos de heridos en la represión de Milei a la protesta de los jubilados,"El Gobierno argentino hizo un despliegue de su mano dura contra la marcha de los jubilados, en la que participaron aficionados de fútbol, organizaciones sociales y la izquierda. El fotógrafo Pablo Grillo está herido de gravedad tras el impacto de un cartucho de gas lacrimógeno",https://meneame.net/story/mas-cien-detenidos-cientos-heridos-represion-milei-protesta,0,821,413,188,314,1,actualidad,155,2025-03-13 10:35:02,imagosg,eldiario.es,https://www.eldiario.es/internacional/javier-milei-jubilados-argentina-protesta_1_12128099.html,2025-03-17 12:13:08
4037486,Las descargas de LibreOffice se disparan con el rechazo a la nube y los modelos de suscripción como principales estímulos,"Ha pasado poco más de un mes desde que se lanzó LibreOffice 25.2, la nueva versión de la suite ofimática de código abierto, y la recepción no podía ser mejor: más de un millón de descargas semanales está teniendo la aplicación, y eso es solo lo que puede contabilizar The Document Foundation (TDF), la organización encargada de gestionar el proyecto.",https://meneame.net/story/descargas-libreoffice-disparan-rechazo-nube-modelos-suscripcion,0,1735,439,203,266,0,tecnología,130,2025-03-13 10:25:02,SACROMONTE,muylinux.com,https://www.muylinux.com/2025/03/12/descargas-de-libreoffice-se-disparan/,2025-03-17 12:13:08
4037477,Ayuso quiere que TVE emita un vídeo ensalzando su gestión de la pandemia,"El Gobierno madrileño quiere contrarrestar la emisión del documental 7.291 sobre lo sucedido en las residencias. El Gobierno regional quiere que RTVE emita esta noche la declaración institucional que hizo ayer la presidenta madrileña, Isabel Díaz Ayuso, por los 5 años de la pandemia, coincidiendo con la emisión del documental 7.291, que analiza las muertes de mayores en las residencias madrileñas. Se lo ha pedido por carta al presidente de la corporación, José Pablo López. Ayuso quiere contrarrestar la emisión de un documental que, para el Gobi",https://meneame.net/story/ayuso-quiere-tve-emita-video-ensalzando-gestion-pandemia,0,943,354,123,214,1,politica,147,2025-03-13 10:05:03,zanguangaco,cadenaser.com,https://cadenaser.com/cmadrid/2025/03/13/ayuso-quiere-que-tve-emita-un-video-ensalzando-su-gestion-de-la-pandemia-radio-madrid/,2025-03-17 12:13:08
4037476,"Estreno del especial de RTVE 'La pandemia que paró el mundo' y el documental '7291': horario, dónde ver y claves","El jueves 13 de marzo a las 23.10 horas se estrena en La 2 y en el Canal 24 horas el documental ‘7.291’, sobre el drama de las residencias durante la pandemia de la Covid en la Comunidad de Madrid. Previamente, el Canal 24 horas emitirá a las 21.55 horas 'La pandemia que paró el mundo', un programa especial presentado por Xabier Fortes. Estará acompañado de cuatro periodistas y contará con varias entrevistas, entre ellas, a la exvicepresidenta del gobierno, Carmen Calvo, y a la actualministra de Sanidad, Mónica García.",https://meneame.net/story/estreno-especial-rtve-pandemia-paro-mundo-documental-7291-donde,0,891,429,259,486,4,actualidad,72,2025-03-13 09:40:02,zanguangaco,rtve.es,https://www.rtve.es/noticias/20250312/estreno-especial-rtve-pandemia-documental-7291-horario/16488477.shtml,2025-03-17 12:13:08
4037335,Movistar está devolviendo dinero a los clientes que reclaman por los bloqueos del fútbol,"La Carta de Derechos del Usuario de los Servicios de Comunicaciones Electrónicas reconoce el derecho de los consumidores a ser compensados económicamente cuando su acceso a internet sea interrumpido. El importe no es gran cosa, pues se trata de un prorrateo de la cuota mensual a la duración de la incidencia.",https://meneame.net/story/movistar-esta-devolviendo-dinero-clientes-reclaman-bloqueos,0,1187,354,114,200,0,actualidad,24,2025-03-13 09:15:06,el.dani.el,bandaancha.eu,https://bandaancha.eu/articulos/movistar-esta-devolviendo-dinero-11282,2025-03-17 12:13:08
4037420,Manifestantes e hinchas de Argentina chocan con la policía en una masiva protesta,"Manifestantes de Argentina se enfrentaron a un imponente operativo policial en una nueva protesta de los jubilados en el Congreso, en Buenos Aires, que contó con la participación de una veintena de hinchadas de fútbol, sindicatos y agrupaciones políticas. La protesta tiene que ver con la pérdida del poder adquisitivo de los jubilados, que se ha deteriorado gravemente desde que se implementaron las políticas de ajuste por parte del Gobierno de Milei.",https://meneame.net/story/manifestantes-hinchas-argentina-chocan-policia-masiva-protesta,0,1577,384,79,131,0,actualidad,36,2025-03-13 08:50:09,Dragstat,globovision.com,https://www.globovision.com/internacional/35783/video-manifestantes-e-hinchas-de-argentina-chocan-con-la-policia-en-una-masiva-protesta,2025-03-17 12:13:08
4037398,El jurado declara culpable a la mujer que mató de 50 martillazos a un amigo en Bétera,"El jurado popular ha declarado culpable por unanimidad a la mujer acusada de matar a martillazos a un amigo de 64 años, el 22 de diciembre de 2021, por causas que no han podido esclarecerse en el juicio celebrado en la Ciudad de la Justicia de Valencia. El tribunal ha rechazado la tesis que planteó la defensa de una legítima defensa ante una agresión sexual y un ataque con un cuchillo, y ha desestimado también la atenuante de arrebato, ya que considera que Begoña C. G. era consciente de sus actos cuando cometió el horrendo crimen.",https://meneame.net/story/jurado-declara-culpable-mujer-mato-50-martillazos-amigo-betera,0,1294,397,96,112,6,actualidad,158,2025-03-13 08:30:14,M.Rajoy.,lasprovincias.es,https://www.lasprovincias.es/sucesos/jurado-declara-culpable-mujer-mato-martillazos-amigo-20250310213508-nt.html,2025-03-17 12:13:08
4037299,Descubierto en Atapuerca el primer rostro humano de Europa Occidental,"Son los huesos faciales más antiguos conocidos de un homínido en Europa y tienen entre 1,4 y 1,1 millones de años. Revolucionan las teorías sobre migraciones hacia nuestro continente y lo ha anunciado un equipo español a través de la revista 'Nature'",https://meneame.net/story/descubierto-atapuerca-primer-rostro-humano-europa-occidental,0,922,381,108,115,0,ciencia,19,2025-03-13 08:10:07,Trapi,cadenaser.com,https://cadenaser.com/nacional/2025/03/12/descubierto-en-atapuerca-el-primer-rostro-humano-de-europa-occidental-cadena-ser/,2025-03-17 12:13:08
4037449,Un informe pericial concluye que la foto de Mazón entrando al Cecopi es ‘técnicamente falsa’,"Tras un exhaustivo análisis utilizando diferentes técnicas forenses, el perito Luis Duque, que además de ser profesor en criminalística forense y presidente de la Asociación Pericial Europea, también ha sido especialista en Policía Científica e Investigación de delitos en el cuerpo de Policía-Mossos d’Esquadra en la que sirvió durante 28 años, afirma que “solamente puedo concluir de manera taxativa que, técnicamente, esta imagen digital es falsa”.",https://meneame.net/story/informe-pericial-concluye-foto-mazon-entrando-cecopi-falsa,0,8137,560,394,680,0,actualidad,185,2025-03-13 07:45:12,enjoyingbreathtaking,elsaltodiario.com,https://www.elsaltodiario.com/valencia/un-informe-pericial-concluye-foto-mazon-entrando-al-cecopi-es-tecnicamente-falsa,2025-03-17 12:13:08
4037397,¿Sabes lo que es una carta sincronológica? [Vídeo de 2 minutos],"Hoy te hablamos de una obra de casi 7 metros de longitud que narra la historia de la humanidad desde la creación de Adán y Eva hasta el siglo XIX en forma de ríos entrelazados. Carmen Calatayud, jefa del servicio de cartografía, nos explica la importancia de la unión entre la cronología y la geografía, necesarias para poder contar la historia de la humanidad. En ella se puede encontrar desde una ilustración de la torre de Babel, inventos como el fonógrafo de Edison hasta escenas bíblicas y personajes mitológicos. | Continua en #1",https://meneame.net/story/sabes-carta-sincronologica,0,1087,362,42,38,0,cultura,24,2025-03-13 07:25:11,Rorschach_,xcancel.com,https://xcancel.com/BNE_biblioteca/status/1899792831780159628,2025-03-17 12:13:08
4037409,China anuncia una nueva tecnología que permite ver caras perfectamente desde el espacio,"La tecnología utiliza un rayo láser capaz de capturar detalles faciales humanos de menos de dos milímetros desde más de 100 kilómetros de distancia, superando a los satélites americanos más avanzados. 100 veces mejor que la última tecnología espía demostrada por Estados Unidos. El estudio que explica su funcionamiento acaba de ser publicado en el diario científico revisado por pares Chinese Journal of Lasers.",https://meneame.net/story/china-anuncia-nueva-tecnologia-permite-ver-caras-perfectamente,0,1120,401,87,138,2,tecnología,68,2025-03-13 07:00:07,Desideratum,elconfidencial.com,https://www.elconfidencial.com/tecnologia/novaceno/2025-03-12/satelite-espia-chino-ve-caras-precision-milimetrica_4084244/,2025-03-17 12:13:08
4037187,"Tras romper el acuerdo con Francia, Australia teme no recibir nunca los submarinos estadounidenses","El artículo recuerda la ruptura del contrato de submarinos entre Australia y Francia en 2021 (56.000 M€), a favor de uno con Estados Unidos y Reino Unido (AUKUS). La ruptura causó una crisis diplomática entre Francia y Australia. Australia ahora comienza a preguntarse si Estados Unidos les entregará los submarinos nucleares que ya han empezado a pagar. AUKUS ahora pone en riesgo la capacidad defensiva del país, que podría quedarse sin flota submarina y verse obligado a buscar alternativas propias.",https://meneame.net/story/tras-romper-acuerdo-francia-australia-teme-no-recibir-nunca,0,848,354,81,137,1,politica,88,2025-03-13 06:40:09,Laro__,marianne.net,https://www.marianne.net/monde/geopolitique/apres-avoir-rompu-l-accord-avec-la-france-les-australiens-s-inquietent-de-ne-jamais-recevoir-les-sous-marins-americains,2025-03-17 12:13:08
4037360,“Golpear donde duele”: los aranceles de la UE se dirigen a productos simbólicos de EEUU y de estados de Trump,"La escalada de la guerra comercial ya es una realidad. Donald Trump ha seguido adelante con la amenaza de imponer aranceles del 25% al acero y al aluminio europeos y, apenas una hora después de que entraran formalmente en vigor, la Comisión Europea ha respondido con “contramedidas proporcionadas” al daño que las tasas “injustas e injustificadas” de EEUU harán a la economía europea. El cálculo de los servicios comunitarios es que el valor de los aranceles a la UE ascenderán a 26.000 millones de euros y la respuesta afectará a un mercado similar,",https://meneame.net/story/golpear-donde-duele-aranceles-ue-dirigen-productos-simbolicos,0,2379,346,101,185,0,actualidad,65,2025-03-13 05:45:08,HeilHynkel,eldiario.es,https://www.eldiario.es/economia/golpear-duele-aranceles-ue-dirigen-productos-simbolicos-eeuu-estados-trump_1_12125010.html,2025-03-17 12:13:08
4037332,El email de Elon Musk llegó a Italia. No fue bien recibido - The New York Times,"Los empleados de la Base Aérea de Aviano que sirven a las fuerzas estadounidenses recibieron la consabida exigencia de enumerar sus logros. Los sindicatos locales dicen que su país “no es el Salvaje Oeste”.Dejaron de hacer hamburguesas, descargar camiones y reponer existencias en las estanterías para abrir un correo electrónico de sus jefes en el que les exigían que enumeraran cinco logros clave de la semana anterior.",https://meneame.net/story/email-elon-musk-llego-italia-no-fue-bien-recibido-the-new-york,0,3095,363,90,128,0,actualidad,52,2025-03-13 04:30:02,solnegre,nytimes.com,https://www.nytimes.com/es/2025/03/12/espanol/mundo/italia-mail-elon-musk.html,2025-03-17 12:13:08
4037222,Los más de 200 sitios web vigilados por un contratista del ICE [EN],"404 Media ha obtenido la lista de sitios y servicios de los que ShadowDragon, contratista del ICE, extrae datos. ShadowDragon extrae datos de toda la web y permite a los analistas gubernamentales buscarlos fácilmente y establecer conexiones entre las personas. Un contratista del Servicio de Inmigración y Control de Aduanas (ICE) y de muchas otras agencias gubernamentales de Estados Unidos ha desarrollado una herramienta que permite a los analistas extraer más fácilmente los datos públicos disponibles de una persona de una amplia gama de sitios,",https://meneame.net/story/mas-200-sitios-web-vigilados-contratista-ice,0,602,355,42,65,0,tecnología,5,2025-03-13 03:35:08,TooBased,404media.co,https://www.404media.co/the-200-sites-an-ice-surveillance-contractor-is-monitoring,2025-03-17 12:13:08
4037391,"Última hora de la guerra de Rusia y Ucrania, en directo | Putin visita un centro de mando en el frente de Kursk en plenas negociaciones para la tregua","El presidente ruso, Vladímir Putin, ha visitado este miércoles por sorpresa un centro de mando de sus fuerzas en la región de Kursk. Lo ha hecho ataviado con uniforme militar, una estampa poco habitual en el mandatario, justo cuando tiene sobre la mesa una oferta de tregua de Estados Unidos y Ucrania. El secretario de Estado de EE UU, Marco Rubio, ha pedido a Rusia que ponga fin a las hostilidades en Ucrania y espera una respuesta positiva a la propuesta para un alto el fuego de 30 días surgida de las negociaciones bilaterales del martes entre",https://meneame.net/story/ultima-hora-guerra-rusia-ucrania-directo-putin-visita-centro,0,491,404,47,61,1,actualidad,55,2025-03-13 02:40:02,cocolisto,elpais.com,https://elpais.com/internacional/2025-03-12/ultima-hora-de-la-guerra-de-rusia-y-ucrania-en-directo.html,2025-03-17 12:13:08
4037362,¿Quién maneja Gestlife?,"Una investigación de ‘La Marea’ ha reunido evidencias de que la agencia de gestación subrogada Gestlife, registrada en EE.UU. (donde esta actividad es legal), desarrolla su operativa desde Barcelona sin ser fiscalizada. Para ello utiliza un complejo entramado de sociedades. Todas ellas tienen el mismo administrador único: Diego Prados Hill, el nuevo nombre del empresario condenado por pederastia por abusar de un niño del Casal del Raval.",https://meneame.net/story/quien-maneja-gestlife,0,373,399,122,171,0,actualidad,11,2025-03-13 01:55:02,Ovlak,lamarea.com,https://www.lamarea.com/2025/03/12/investigacion-quien-maneja-gestlife/,2025-03-17 12:13:08
4037093,"Trump sobre el coche eléctrico: ""Son buenos si tienes una empresa de grúas""","El presidente de Estados Unidos, Donald Trump, es capaz de decir una cosa y a los pocos minutos, decir la contraria. Eso es lo que acaba de hacer también con los coches eléctricos. Después de varios años criticando y burlándose de los vehículos eléctricos, el mandatario estadounidense ha anunciado su intención de comprarse un coche eléctrico de Tesla. Trump hizo este inesperado anuncio mientras el CEO de Tesla, Elon Musk, le mostraba algunos de sus vehículos eléctricos en los jardines de la Casa Blanca.",https://meneame.net/story/trump-sobre-coche-electrico-son-buenos-tienes-empresa-gruas,0,851,390,86,115,1,actualidad,56,2025-03-13 01:10:03,Grahml,expansion.com,https://www.expansion.com/empresas/motor/2025/03/11/67d0aacfe5fdea27378b458a.html,2025-03-17 12:13:08
4037145,Trump dice que la recesión es un paso desafortunado pero necesario para llegar hasta la depresión [EN],"Advirtiendo que los estadounidenses deben prepararse para un «período de transición», el presidente Donald Trump dijo a los periodistas que una recesión sería un paso desafortunado pero necesario en el camino hacia una depresión económica. «Miren, lo que estamos haciendo es muy grande y causará algo de dolor, pero ese dolor es necesario para causar un colapso económico total», dijo Trump durante una rueda de prensa. «Será la depresión más grande que la nación haya visto jamás», declaró.",https://meneame.net/story/trump-dice-recesion-paso-desafortunado-pero-necesario-llegar,0,1043,375,109,152,5,ocio,48,2025-03-13 00:25:02,Vlemix,theonion.com,https://theonion.com/trump-says-recession-unfortunate-but-necessary-step-to-get-to-depression/,2025-03-17 12:13:09
4037285,Ayuso incendia el 5º aniversario de la pandemia: niega los protocolos de la vergüenza y dice que no murieron 7291 ancianos,"La presidenta de la Comunidad de Madrid, Isabel Díaz Ayuso, hablará a lo largo de esta tarde coincidiendo con el 5º aniversario del inicio del Covid-19, pero ya ha calentado el ambiente. Al estilo que la presidenta madrileña acostumbra, ésta ha rebasado todos los límites al negar los conocidos como protocolos de la vergüenza o decir que las muertes en residencias no fueron 7.291.",https://meneame.net/story/ayuso-incendia-5-aniversario-pandemia-niega-protocolos-verguenza,0,741,483,192,362,2,actualidad,58,2025-03-12 23:35:04,concentrado,elplural.com,https://www.elplural.com/autonomias/madrid/ayuso-incendia-5o-aniversario-pandemia-niega-protocolos-verguenza-dice-no-murieron-7291-ancianos_348219102,2025-03-17 12:13:09
4037317,"El principal investigado del caso FP apunta al Gobierno de Ayuso y admite a la jueza el uso de un procedimiento irregular ""desde siempre""","El subdirector cesado tras saltar a la luz obras millonarias sin concurso declara que la Consejería de Educación, entonces en manos de Enrique Ossorio, hoy presidente de la Asamblea, promovía que las obras se pasaran como gastos de funcionamiento. Obras millonarias en institutos de secundaria se hicieron pasar por contratos menores para evitar sacarlas a concurso y se dieron a dedo. Para ello, se trocearon facturas en importes inferiores de 40.000 euros, lo cual ha provocado una investigación por posible prevaricación.",https://meneame.net/story/principal-investigado-caso-fp-apunta-gobierno-ayuso-admite-jueza,0,370,422,137,228,0,politica,14,2025-03-12 23:30:05,SVSRTZ,eldiario.es,https://www.eldiario.es/madrid/politica/principal-investigado-caso-fp-apunta-gobierno-ayuso-declara-troceaban-contratos_1_12126945.html,2025-03-17 12:13:09
4037370,La Justicia condena a la agitadora ultra Cristina Seguí por difamar a la aerolínea Plus Ultra,La Audiencia de Madrid confirma una multa de 1.800 euros para ella por un delito de injurias graves por varios tuits e intervenciones en Estado de Alarma vinculando sin pruebas a la empresa con el tráfico de drogas,https://meneame.net/story/justicia-condena-agitadora-ultra-cristina-segui-difamar-plus,0,642,460,156,219,0,actualidad,44,2025-03-12 22:45:02,Livingstone85,eldiario.es,https://www.eldiario.es/politica/justicia-condena-agitadora-ultra-cristina-segui-difamar-aerolinea-plus-ultra_1_12125139.html,2025-03-17 12:13:09
4037346,El CEO de Spagnolo: Reconoce que fabrica en China porque en España «no hay capacidad».,El CEO de Spagnolo: «No me compran ropa para que no les llamen facha por llevar la bandera» La firma está en transformación para huir del estereotipo de que son prendas «para rancios o cortijeros» Reconoce que fabrica en China porque en España «no hay capacidad». Es la cuarta generación dedicada al textil: en 1937 una bomba destruyó al completo el negocio familiar.,https://meneame.net/story/ceo-spagnolo-reconoce-fabrica-china-porque-espana-no-hay,0,1923,467,131,200,8,actualidad,105,2025-03-12 22:20:02,HijosdeKroker,abc.es,https://www.abc.es/sevilla/economia/ceo-spagnolo-compran-llamen-facha-llevar-bandera-20250309140721-nts.html,2025-03-17 12:13:09
4037376,Un equipo de investigadores chinos crean nuevo chip sin silicio que supera a Intel con un 40% más de velocidad y un 10% menos de energía,"El nuevo transistor basado en bismuto podría revolucionar el diseño de chips, ofreciendo una mayor eficiencia y superando las limitaciones del silicio. Un equipo de investigadores de la Universidad de Pekín ha desarrollado un transistor basado en bismuto que supera a los chips de 3 nanómetros de Intel y TSMC. Este nuevo diseño es 40% más rápido y consume un 10% menos de energía, marcando un hito en la tecnología de semiconductores.",https://meneame.net/story/equipo-investigadores-chinos-crean-nuevo-chip-sin-silicio-supera,0,946,440,139,205,6,actualidad,101,2025-03-12 22:00:03,DORO.C,ecoinventos.com,https://ecoinventos.com/nuevo-chip-sin-silicio-que-supera-a-intel-con-un-40-mas-de-velocidad-y-un-10-menos-de-energia/,2025-03-17 12:13:09
4037342,El 'Made in Spain' le come la tostada a Alemania: el Banco de España detecta que las empresas españolas le están quitando cuota a las alemanas,"El Banco de España detecta que España le está quitando cuota a Alemania: las exportaciones españolas sustituyen a Alemania en Finlandia, Francia, Italia o Portugal.",https://meneame.net/story/made-in-spain-come-tostada-alemania-banco-espana-detecta-estan,0,1881,425,123,208,0,politica,80,2025-03-12 21:35:02,vicus.,businessinsider.es,https://www.businessinsider.es/economia/made-spain-come-tostada-alemania-banco-espana-detecta-empresas-espanolas-estan-quitando-cuota-alemanas-1447685?amp=1,2025-03-17 12:13:09
4037116,Todas las presas son temporales [ENG],"Una descripción general de la sedimentación en los embalses. A primera vista, parece un problema tonto, casi elemental. ¡Es solo suciedad! Pero quiero mostrarle por qué es una catástrofe que avanza lentamente y que tiene implicaciones que abarcan todo el mundo.",https://meneame.net/story/todas-presas-son-temporales-eng,0,3891,448,86,83,0,cultura,26,2025-03-12 21:05:04,rubianes,youtube.com,https://www.youtube.com/watch?v=XiUOBdEUqjY,2025-03-17 12:13:09
4037234,Condenado José Luis Moreno a devolver 35 millones a su socio en la producción de la serie sobre San Francisco de Asís,"El Juzgado de Primera Instancia número 52 de Madrid ha condenado al empresario a devolver 35.264.686,41 euros, más intereses, al que fuera su socio para la producción de la serie Resplandor y Tinieblas, centrada en la vida de San Francisco de Asís, que nunca llegó a ver la luz.  La jueza ha estimado la demanda presentada por Alejandro G. Roemmers al considerar que ha quedado acreditado que el conocido ventrílocuo incumplió sus compromisos contractuales, ya que no entregó ni un solo capítulo.",https://meneame.net/story/condenado-jose-luis-moreno-devolver-35-millones-socio-produccion,0,466,397,137,169,0,actualidad,36,2025-03-12 20:45:03,Wolfgang,elpais.com,https://elpais.com/economia/2025-03-12/la-justicia-condena-a-jose-luis-moreno-a-devolver-mas-de-35-millones-de-euros-a-su-socio-en-la-produccion-de-la-serie-sobre-san-francisco-de-asis.html,2025-03-17 12:13:09
4036945,Maxwell se adelantó a Einstein en más de 40 años: la ecuación que podría revelar el verdadero origen de los fotones y cambiar nuestra comprensión de la luz,"Un nuevo estudio sugiere que el concepto de fotón podría derivarse del electromagnetismo clásico y no de la mecánica cuántica. ¿Podría Maxwell haber anticipado a Einstein en la comprensión de la luz?
Un nuevo estudio del investigador Dhiraj Sinha, publicado en Annals of Physics, plantea una idea sorprendente: el concepto de fotón podría derivarse del electromagnetismo clásico, en lugar de ser una propiedad intrínsecamente cuántica. 
dx.doi.org/10.1016/j.aop.2024.169893",https://meneame.net/story/maxwell-adelanto-einstein-mas-40-anos-ecuacion-podria-revelar,0,1074,422,104,103,0,ciencia,40,2025-03-12 20:05:02,onainigo,muyinteresante.com,https://www.muyinteresante.com/ciencia/maxwell-se-anticipo-a-einstein-la-ecuacion-oculta-sobre-los-fotones.html,2025-03-17 12:13:09
