news_id,title,content,full_story_link,meneos,clicks,karma,positive_votes,anonymous_votes,negative_votes,category,comments,published_date,user,source,source_link,scraped_date
4033378,La alcaldesa de Marbella nombra jefe de la Policía local al agente que su hijastro quería reclutar para la “banda”,"Marbella tiene un nuevo jefe de Policía local. Se trata del intendente Ricardo del Río, quien ejercía de número dos de su antecesor, Javier Martín, que se ha jubilado. El nuevo responsable del Cuerpo aparece en las escuchas del caso contra el marido –ya fallecido– de la alcaldesa Ángeles Muñoz y su hijastro, Joakim Broberg. En una de esas escuchas, Joakim Broberg expresa a un colaborador su deseo de que Del Río, con el que dice tener una relación habitual, pase a integrar su “banda”.",https://meneame.net/story/alcaldesa-marbella-nombra-jefe-policia-local-agente-hijastro,498,507,437,184,314,1,politica,50,2025-03-02 13:35:02,candonga1,eldiario.es,https://www.eldiario.es/politica/alcaldesa-marbella-nombra-jefe-policia-local-agente-hijastro-queria-reclutar-banda_1_12071397.html,2025-03-04 14:12:45
4033399,"‘Yes We Help’, la falsa ONG que ofrecía “más vacaciones que voluntariados” a menores en Ghana y Sri Lanka: se enfrenta a dos años y medio de cárcel","Hace siete años, un supuesto programa de voluntariado promovido por la página ‘Yes We Help’ prometía a los jóvenes una “experiencia única para ayudar a los más necesitados” de países como Sri Lanka, Ghana o Tailandia. Nada más lejos de la realidad, pues cuando los voluntarios llegaban a destino, los cientos de jóvenes y adolescentes españoles en Ghana y Sri Lanka que creían que iban a pasar el verano de su vida realizando un voluntariado se encontraron en unas desastrosas —y hasta peligrosas— colonias en un país exótico.",https://meneame.net/story/yes-we-help-falsa-ong-ofrecia-mas-vacaciones-voluntariados-ghana,175,1693,428,74,101,0,actualidad,44,2025-03-02 13:10:03,Elnuberu,infobae.com,https://www.infobae.com/espana/2025/03/02/yes-we-help-la-falsa-ong-que-ofrecia-mas-vacaciones-que-voluntariados-a-menores-en-ghana-y-sri-lanka-se-enfrenta-a-dos-anos-y-medio-de-carcel/,2025-03-04 14:12:47
4033384,Israel detiene la ayuda humanitaria a Gaza (EN),"Israel suspendió el domingo la ayuda humanitaria a la Franja de Gaza y cerró sus pasos fronterizos tras las consultas celebradas por el primer ministro, Benjamin Netanyahu. La medida se tomó en coordinación con la administración estadounidense, según informaron las autoridades.",https://meneame.net/story/israel-detiene-ayuda-humanitaria-gaza,207,211,428,107,100,0,actualidad,43,2025-03-02 13:10:03,Tkachenko,ynetnews.com,https://www.ynetnews.com/article/ryz2t00bojg,2025-03-04 14:12:47
4033443,"Los astronautas de la NASA estallan contra Musk: ""Cuando te atrevas, ven a hablar con nosotros""","El magnate ha salido recientemente en una entrevista diciendo que dos astronautas siguen en el espacio ""por razones políticas"".",https://meneame.net/story/astronautas-nasa-estallan-contra-musk-cuando-atrevas-ven-hablar,364,2019,469,141,223,1,actualidad,34,2025-03-02 12:40:02,Icelandpeople,eleconomista.es,https://www.eleconomista.es/tecnologia/noticias/13241617/02/25/los-astronautas-de-la-nasa-estallan-contra-musk-cuando-te-atrevas-ven-a-hablar-con-nosotros.html,2025-03-04 14:12:47
4033365,"La Casa Blanca niega la ""emboscada"" y culpa a Zelenski del enfrentamiento con Trump","«Esto de que fuera una emboscada es absolutamente y categóricamente falso», declaró Mike Waltz, asesor de Seguridad Nacional de Trump, en una entrevista con la cadena Fox News. Según Waltz, Zelenski optó por «litigar» con Trump a pesar de que se le había advertido de que no lo hiciera y demostró que «no está claro» que Ucrania realmente quiera finalizar la guerra. «Tuvo un enfoque equivocado, en un momento histórico equivocado y definitivamente con el presidente equivocado para intentar hacer eso», agregó Waltz.",https://meneame.net/story/casa-blanca-niega-emboscada-culpa-zelenski-enfrentamiento-trump,301,626,418,112,189,0,actualidad,101,2025-03-02 12:20:03,Lord_Cromwell,efe.com,https://efe.com/mundo/2025-03-01/trump-zelenski-emboscada-casa-blanca/,2025-03-04 14:12:47
4033404,"Los autos de la jueza ponen contra las cuerdas al Consell: muertes “evitables”, SMS “tardío” y competencia de la Generalitat","La jueza relaciona esa tardanza con el “abrumador número de fallecimientos” y lo atribuye a la Generalitat, a la que señala como responsable por su ""inactividad""",https://meneame.net/story/autos-jueza-ponen-contra-cuerdas-consell-muertes-evitables-sms,525,688,422,188,337,0,actualidad,55,2025-03-02 11:45:03,Tkachenko,levante-emv.com,https://www.levante-emv.com/comunitat-valenciana/2025/03/02/autos-jueza-ponen-cuerdas-consell-114806340.html,2025-03-04 14:12:47
4033381,Churchill en la Casa Blanca  sin traje ni corbata porque está en guerra [ENG],Churchill en la Casa Blanca sin llevar traje porque está en guerra. Nadie le hizo preguntas.,https://meneame.net/story/churchill-casa-blanca-llevar-traje-ni-corbata-porque-esta-guerra,313,11014,400,141,172,5,cultura,100,2025-03-02 11:05:02,Grahml,reddit.com,https://www.reddit.com/r/pics/comments/1j0ukq2/churchill_at_the_white_house_not_wearing_a_suit/,2025-03-04 14:12:47
4033375,Crece la censura ‘infernal’ de libros en Estados Unidos,"Desde julio de 2023 más de diez mil libros han sido prohibidos. Los contenidos objeto de mayor censura se refieren a las cuestiones raciales, a cuestiones de la comunidad LGBTQ+ y al sexo. Según dice la asociación de escritores PEN América, desde julio de 2023 más de diez mil libros han sido censurados en distintas instancias, bibliotecas y escuelas públicas de 220 distritos de casi una treintena de estados del territorio estadounidense. “Si hacemos el recuento total desde julio de 2021, hemos registrado 15.940 prohibiciones de libros…",https://meneame.net/story/crece-censura-infernal-libros-estados-unidos,355,484,388,133,222,5,actualidad,119,2025-03-02 10:10:02,JanSmite,ctxt.es,https://ctxt.es/es/20250201/Politica/48644/Paco-Audije-libros-censura-EEUU-LGTBIQ-racial-sexo.htm,2025-03-04 14:12:47
4033363,"Macron advierte que Putin ""avanzará sobre Moldavia"" e ""incluso"" Rumanía si no se le frena","El presidente de Francia, Emmanuel Macron, advertió que si no se pone freno al presidente ruso, Vladimir Putin, -que lanzó una ofensiva en Ucrania en 2022- ""sin duda avanzará sobre Moldavia y quizás incluso más allá, sobre Rumanía"", En una entrevista concedida a varios periódicos dominicales franceses, Macron estimó además, tras el tenso encuentro que mantuvieron la víspera los presidentes estadounidense y ucraniano, que Washington no se ""beneficiaría"" de una eventual ""desvinculación"" de Ucrania.",https://meneame.net/story/macron-advierte-putin-avanzara-sobre-moldavia-incluso-rumania-no,273,669,392,104,169,2,actualidad,317,2025-03-02 09:00:08,Lord_Cromwell,elperiodico.com,https://www.elperiodico.com/es/internacional/20250301/macron-advierte-putin-avanzara-moldavia-rumania-freno-114836537,2025-03-04 14:12:47
4033347,"Elon Musk, el apartheid y el nuevo movimiento de boicot estadounidense  (Eng)","Me encontré reconstruyendo esta historia hace poco, cuando comenzaron las protestas y los boicots contra Tesla. ¿Necesitas que te recuerde por qué? Muy bien: Elon Musk, CEO de Tesla -el hombre más rico del mundo y el mayor donante de la campaña de Trump; un padre no electo, feliz con la ketamina, tramposo con los videojuegos, transfóbico, devorador de subsidios y moroso- está dirigiendo a un grupo de mini-yo de mierda que empuñan guadañas a través de las entrañas del gobierno federal, recolectando y comprometiendo los datos más esenciales",https://meneame.net/story/elon-musk-apartheid-nuevo-movimiento-boicot-estadounidense-eng,285,1196,385,114,171,6,actualidad,11,2025-03-02 08:00:06,Verdaderofalso,motherjones.com,https://www.motherjones.com/politics/2025/02/elon-musk-apartheid-boycott-tesla-doge-trump/,2025-03-04 14:12:47
4033323,"Drones filman a narvales usando sus colmillos para explorar, buscar comida y jugar","Utilizando drones, investigadores proporcionan la primera evidencia de narvales usando sus colmillos en la naturaleza para investigar, manipular e influir en el comportamiento de la trucha ártica, incluyendo la aplicación de suficiente fuerza con sus colmillos para aturdir y posiblemente matar al pez. Los investigadores recogieron 17 distintos comportamientos, que arrojaron luz sobre la dinámica entre el narval, sus presas y sus competidores aviares.",https://meneame.net/story/drones-filman-narvales-usando-colmillos-explorar-buscar-comida,121,3474,463,56,65,1,cultura,23,2025-03-02 06:55:04,Ripio,vistaalmar.es,https://www.vistaalmar.es/especies-marinas/ballenas/14376-drones-filman-narvales-usando-colmillos-explorar-buscar-comida-jugar.html,2025-03-04 14:12:47
4033203,Compra de Luisiana [Eng],"La colonia de Luisiana se fundó el 9 de abril de 1682, cuando el explorador francés René-Robert Cavelier, Sieur de La Salle, llegó a la desembocadura del río Misisipi. La Salle erigió una cruz en el lugar y, en una ceremonia celebrada ante sus propios hombres y sus guías indígenas, procedió a reclamar toda la cuenca del Misisipi para Francia. La compra fue un acuerdo de tierras realizado en 1803, en el que EE. UU. compró a Francia 2.144.510 km² de tierra al oeste del río Misisipi por 15 millones de dólares, o una media de tres centavos el acre",https://meneame.net/story/compra-luisiana-eng,95,961,396,44,51,0,cultura,8,2025-03-02 05:50:03,Charles_Dexter_Ward,worldhistory.org,https://www.worldhistory.org/trans/es/1-19589/compra-de-luisiana/,2025-03-04 14:12:47
4033212,Descenso al ‘tubo rojo’ en el interior del volcán de La Palma: la vida se abre paso en la boca del infierno,"Tres años y medio después de la erupción, los científicos están encontrando microorganismos extremófilos en los tubos aún calientes por los que en 2021 emergieron grandes masas de lava: entramos en las cuevas y caminamos por la zona de exclusión en busca de vida",https://meneame.net/story/descenso-tubo-rojo-interior-volcan-palma-vida-abre-paso-boca,137,2011,405,71,66,0,ciencia,4,2025-03-02 04:55:02,Fluor,eldiario.es,https://www.eldiario.es/sociedad/descenso-tubo-rojo-interior-volcan-palma-vida-abre-paso-boca-infierno_1_12085636.html,2025-03-04 14:12:47
4033362,Mazón pudo manipular imágenes del CECOPI - Desmontan su defensa,"En las últimas hora se ha conocido que las imágenes presentadas por Carlos Mazón a la entrada del CECOPI han podido ser fácilmente manipuladas. Una de las que a postada por esta teoría es la ex diputada socialista Zaida Cantera que han remarcado que aun asumiendo el cambio de hora que explica la Generalitat , lo que realmente estaría mostrando la famosa imágenes es la llegada de Carlos Mazón al CECOPI a las 7:28 de la tarde , tal como aseguran numerosos testigos.",https://meneame.net/story/mazon-pudo-manipular-imagenes-cecopi-desmontan-defensa,383,2376,403,141,242,1,actualidad,77,2025-03-02 04:05:03,fareway,youtube.com,https://www.youtube.com/watch?v=vHgh3ijADGI,2025-03-04 14:12:47
4033325,"El vicepresidente de Estados Unidos, J.D. Vance mintió ayer sobre Zelensky, al afirmar que no dio las gracias al pueblo estadounidense [ENG]","La periodista Nicolle Wallace, verifica los hechos sobre los comentarios de JD Vance sobre Ucrania durante un acalorado intercambio entre el presidente ucraniano Volodymyr Zelenskyy, el presidente Donald Trump y el vicepresidente en el Despacho Oval.",https://meneame.net/story/vicepresidente-estados-unidos-j-d-vance-mintio-ayer-sobre-no-dio,345,804,407,121,224,2,actualidad,32,2025-03-02 03:15:03,Grahml,youtube.com,https://youtube.com/shorts/bzZV0Swlyjg,2025-03-04 14:12:47
4033256,"Serranito, el bocadillo sevillano que resiste generaciones","Nació como evolución de un montadito muy popular en los setenta. Hoy muchos locales clásicos y modernos mantienen en carta este bocata de lomo de cerdo, pimiento frito, tomate y jamón. La cultura gastronómica de una localidad se completa cuando además cuenta con un bocadillo propio. Que una generación tras otra decidan poner lo mismo entre dos rebanadas de pan es algo de lo que no todos pueden presumir. Le ocurre a Málaga con los camperos, a Santiago con la tortizorza, a Valencia con su chivito y a Madrid con el de calamares.",https://meneame.net/story/serranito-bocadillo-sevillano-resiste-generaciones,127,1161,412,68,59,2,cultura,58,2025-03-02 02:30:03,Leclercia_adecarboxylata,elpais.com,https://elpais.com/gastronomia/el-comidista/2023-08-31/serranito-el-bocadillo-sevillano-que-resiste-generaciones.html,2025-03-04 14:12:47
4033339,Proveedor noruego de combustible rechaza cargar combustible a buques de guerra estadounidenses por Ucrania [ENG],"La compañía de combustible noruega Haltbakk Bunkers ha anunciado que dejará de suministrar combustible a las fuerzas militares estadounidenses en Noruega y a los barcos estadounidenses que atracan en puertos noruegos, debido al malestar por la reciente política estadounidense hacia Ucrania. En una enérgica declaración, la compañía criticó la reunión televisada en el que participaron el presidente estadounidense Donald Trump y el vicepresidente JD Vance, y lo calificó como el “mayor espectáculo de mierda jamás presentado en vivo por TV"".",https://meneame.net/story/proveedor-noruego-combustible-rechaza-cargar-combustible-buques,447,449,435,165,282,0,politica,53,2025-03-02 01:45:02,Bifaz,ukdefencejournal.org.uk,https://ukdefencejournal.org.uk/norwegian-fuel-supplier-refuses-u-s-warships-over-ukraine/,2025-03-04 14:12:47
4033364,"Estaba totalmente a favor de la nueva prohibición draconiana del aborto en Texas, hasta que casi mata a su hija. [Ing]","Kelsie Norris-De La Cruz luchó por no llorar mientras un médico de urgencias del Texas Health Arlington Memorial Hospital le daba uno de los diagnósticos más aterradores que una mujer embarazada puede escuchar: lo más probable era que tuviera un embarazo ectópico, un trastorno grave y peligroso en la que el embrión se implanta fuera del útero. Aunque la ley de Texas que prohíbe el aborto tras la caída del caso Roe vs Wade permite a los médicos tratar embarazos ectópicos, los médicos del hospital se negaron a interrumpir el embarazo.",https://meneame.net/story/estaba-totalmente-favor-nueva-prohibicion-draconiana-aborto-casi,282,1553,430,111,171,1,actualidad,41,2025-03-02 01:15:03,JanSmite,sinhalaguide.com,https://sinhalaguide.com/she-was-all-for-the-new-draconian-texas-abortion-ban-until-it-nearly-killed-her-daughter/,2025-03-04 14:12:47
4033181,ACO denuncia a Jan Sin Miedo por la difusión de contenido que incita a agredir a inmigrantes,"El modus operandi empleado por este autor de numerosas agresiones contra personas de origen magrebí y subsahariano es siempre similar: graba a personas que identifica como inmigrantes mientras los rocía con gas pimienta en la cara para, a continuación, compartir esos vídeos, que en muchos casos suman más de dos millones de visualizaciones. Basándose exclusivamente en su color de piel, este “influencer de la xenofobia” justifica sus acciones como lucha contra la delincuencia.",https://meneame.net/story/aco-denuncia-jan-sin-miedo-difusion-contenido-incita-agredir,255,1196,415,108,147,10,actualidad,109,2025-03-02 00:40:03,karakol,ctxt.es,https://ctxt.es/es/20250201/Politica/48648/aco-Jan-Sin-Miedo-incitacion-agresiones-xenofobia-inmigrante.htm,2025-03-04 14:12:47
4033317,Patético intento de @MemoriasDePez por lavarle la cara a Milei con el Criptogate,Esto sobrepasa cualquier límite: no os perdáis el descarado intento de Memorias de Pez de lavarle la cara a Milei en el escándalo de la criptoestafa.,https://meneame.net/story/patetico-intento-memoriasdepez-lavarle-cara-milei-criptogate,275,2447,468,107,168,7,politica,46,2025-03-02 00:00:02,RTTZ,youtube.com,https://www.youtube.com/watch?v=AHVY_VZwJa8,2025-03-04 14:12:47
4033343,Shock de China en los semiconductores por el precio de los chips,"En el sector de los semiconductores se habla del Shock de China, donde están bajando tanto el precio de las obleas que nadie puede competir con ellas.",https://meneame.net/story/shock-china-semiconductores-precio-chips,208,2416,488,92,116,0,actualidad,71,2025-03-01 23:50:03,RoterHahn,elchapuzasinformatico.com,https://elchapuzasinformatico.com/2025/02/china-shock-semiconductores-precio-chips/,2025-03-04 14:12:47
4033338,La economía de EEUU se desploma por el 'efecto Trump': la previsión del PIB cae hasta cuatro puntos,"Era evidente que los mercados no iban a ser indiferentes a la llegada de Donald Trump a la Casa Blanca. Lo que no era de esperar es el terrible impacto que la política económica del nuevo presidente de Estados Unidos está teniendo en los indicadores del gigante norteamericano. Este viernes, un dato aportado por la Reserva Federal ha hecho saltar todas las alarmas, dejando claro que las primeras consecuencias del enfriamiento del consumo y la incertidumbre que generan los abusivos aranceles de Trump ya son visibles.",https://meneame.net/story/economia-eeuu-desploma-efecto-trump-prevision-pib-cae-hasta,399,1721,454,155,244,0,actualidad,60,2025-03-01 23:40:03,Grahml,elplural.com,https://www.elplural.com/economia/economia-eeuu-desploma-efecto-trump-prevision-pib-cae-hasta-cuatro-puntos_347523102,2025-03-04 14:12:47
4033332,JD Vance se va a esquiar a Vermont... y se encuentra a algunos manifestantes [ENG],"FOX News informa de que manifestantes en Shugarbush, Vermont, han interrumpido hoy las vacaciones de JD Vance, con pancartas de ""Vete a esquiar a Rusia"", ""Vermont está con Ucrania"", ""Apoya a Ucrania, no a Putin"", etc.",https://meneame.net/story/jd-vance-va-esquiar-vermont-encuentra-algunos-manifestantes-eng,266,3332,468,98,168,12,actualidad,22,2025-03-01 23:25:02,suppiluliuma,x.com,https://x.com/OstapYarysh/status/1895922546916409433,2025-03-04 14:12:47
4033314,Se abre una nueva oportunidad para los hijos de muertos en residencias días antes de que prescriba el delito,Los jueces de Madrid reciben sobre la bocina nuevas denuncias que suponen un cambio de estrategia para las familias porque ahora apuntan contra cuatro responsables del Gobierno de Ayuso por denegación de asistencia sanitaria,https://meneame.net/story/abre-nueva-oportunidad-hijos-muertos-residencias-dias-antes,545,721,433,196,349,0,actualidad,57,2025-03-01 23:00:04,Ratoncolorao,elpais.com,https://elpais.com/espana/madrid/2025-03-01/se-abre-una-nueva-oportunidad-para-los-hijos-de-muertos-en-residencias-dias-antes-de-que-prescriba-el-delito.html,2025-03-04 14:12:47
4033303,EN DIRECTO | Quinta manifestación para exigir la dimisión de Mazón,"Quinta manifestación que vive la ciudad desde la devastadora riada del pasado 29 de octubre. Bajo el lema “Mazón dimissió”, la convocatoria ha cambiado el recorrido que hasta ahora seguía y arrancó a las 18:00 en la calle Colón de València, encabezada por los familiares de los fallecidos.",https://meneame.net/story/directo-quinta-manifestacion-exigir-dimision-mazon,446,449,448,162,284,1,actualidad,39,2025-03-01 22:35:03,emmett_brown,levante-emv.com,https://www.levante-emv.com/videos/levante-tv/2025/02/28/directo-quinta-manifestacion-exigir-dimision-114788672.html,2025-03-04 14:12:47
4033305,"Volodymyr Zelensky recibido con un fuerte abrazo por el primer ministro de Reino Unido, Keir Starmer, frente a Downing Street después del enfrentamiento con Donald Trump [ENG]","Keir Starmer caminó por Downing Street antes de abrazar cálidamente al presidente de Ucrania, Volodymyr Zelensky, a su llegada para mantener conversaciones con el primer ministro. Starmer se reunió con Zelensky en Downing Street la tarde del sábado (1 de marzo), antes de albergar una cumbre de defensa con líderes europeos el domingo. El Rey de Inglaterra también se reunirá con el líder ucraniano el domingo como parte de su visita al Reino Unido.",https://meneame.net/story/volodymyr-zelensky-recibido-abrazo-primer-ministro-reino-unido,279,1378,469,110,169,2,actualidad,84,2025-03-01 22:10:03,Grahml,independent.co.uk,https://www.independent.co.uk/tv/news/zelensky-starmer-hug-downing-street-trump-clash-latest-b2707256.html,2025-03-04 14:12:47
4033252,"Empresarios trasladan a Génova su malestar con Mazón mientras crece la presión: ""No se puede aguantar dos años así""","Hace semanas que Carlos Mazón transmitió a su entorno que no sólo estaba dispuesto a seguir al frente de la Generalitat, sino que se veía capaz de optar a la reelección como candidato del PP. En su entorno lo ven «fuerte». Para él fue un punto de inflexión el respaldo público que recibió del líder del partido, Alberto Núñez Feijóo, cuando a principios de enero lo puso de ejemplo en una reunión con alcaldes por haber «dado la cara» tras la dana.",https://meneame.net/story/empresarios-trasladan-genova-malestar-mazon-mientras-crece-no,312,724,408,116,196,0,politica,36,2025-03-01 21:55:03,NPCmasacrado,elmundo.es,https://www.elmundo.es/comunidad-valenciana/2025/02/28/67c2147621efa0c5628b4583.html,2025-03-04 14:12:50
4033316,"Sharleen Spiteri, cantante de Texas: Recibo muchos insultos homófobos y ni siquiera soy gay","'Sólo porque tengo una determinada apariencia o me visto de cierta manera, porque soy una mujer fuerte hay gente que te dice ""Ah, debes ser lesbiana. Tienes el pelo corto”.",https://meneame.net/story/sharleen-spiteri-cantante-texas-recibo-muchos-insultos-homofobos,259,1855,420,114,145,2,actualidad,53,2025-03-01 21:05:02,Ratoncolorao,metro.co.uk,https://metro.co.uk/2025/02/28/sharleen-spiteri-get-a-lot-homophobic-abuse-im-not-even-gay-22644030/?fbclid=IwY2xjawIwMnVleHRuA2FlbQIxMQABHbGvxA0BeSX2dCTgrGpbTPeCPE6WBLKkQAXafT3s0MsHEzuphMyOILCegA_aem_GrKyaWBAeGuAT_tjtfvpwg,2025-03-04 14:12:50
4033221,Zelensky es woke. Revelador análisis desde la lente de un vocero de la ultraderecha internacional,"Antes de empezar a leer el texto, os recomiendo ver este vídeo con la discusión íntegra entre Trump, Vance y Zelensky en el Despacho Oval  Un segundo factor a valorar antes de entrar en faena: Trump se burló de Zelensky a la entrada de la Casa Blanca por acudir con ropa militar al encuentro. Más adelante, fuentes del gobierno estadounidense manifestaron que presentarse sin traje había sido una falta de respeto. Ciertamente Trump es un …",https://meneame.net/story/zelensky-woke-revelador-analisis-desde-lente-vocero-ultraderecha,293,5807,414,158,135,3,Artículos,69,2025-03-01 20:30:02,Livingstone85,Desconocido,https://www.meneame.net/story/zelensky-woke-revelador-analisis-desde-lente-vocero-ultraderecha,2025-03-04 14:12:50
4033204,Muere la alcaldesa de Lugo tras sufrir un infarto,"Paula Alvarellos pereció en el Chuac, a donde fue trasladada de madrugada desde el Hula, tras sufrir una parada cardíaca antes de asistir al pregón del Carnaval",https://meneame.net/story/muere-alcaldesa-lugo-tras-sufrir-infarto,144,1277,426,84,60,1,actualidad,21,2025-03-01 19:55:03,r3v,elprogreso.es,https://www.elprogreso.es/articulo/lugo/muere-alcaldesa-lugo-sufrir-infarto/202503011027011852088.html,2025-03-04 14:12:50
4033307,Telefónica despedirá a Chema Alonso tras fracasar sus principales proyectos tecnológicos,"Chema Alonso está en la casilla de salida en Telefónica tras fracasar con sus principales proyectos. El mediático hacker está contando sus últimos días tras nueve años ocupando cargos de muchísima responsabilidad en la operadora. El conocido hacker era el único directivo con un contrato que le permitía dar conferencias cobrando por ello. Gracias a estos emolumentos y a su elevado salario, el hacker ha cambiado Móstoles por la exclusiva urbanización La Finca en Pozuelo de Alarcón a escasos metros de la casa de Kylian Mbappé.",https://meneame.net/story/telefonica-despedira-chema-alonso-tras-fracasar-principales,337,4985,459,150,187,0,tecnología,147,2025-03-01 19:25:03,Alaplancha,adslzone.net,https://www.adslzone.net/noticias/operadores/chema-alonso-despido-telefonica/,2025-03-04 14:12:50
4033228,El déficit comercial de Estados Unidos pulveriza récords en plena ofensiva de aranceles de Trump,"Las continuas y confusas amenazas de aranceles del presidente de Estados Unidos, Donald Trump, parecen estar teniendo de momento un efecto llamada sobre las importaciones estadounidenses. Los datos provisionales publicados por el censo este viernes muestran que el déficit comercial de la primera potencia mundial pulverizó récords en el mes de enero. Trump había anunciado que impondría aranceles a México, Canadá y China, sus tres principales socios comerciales, en su primer día en el cargo, aunque luego incumplió esa y muchas otras de sus promes",https://meneame.net/story/deficit-comercial-estados-unidos-pulveriza-records-plena-trump,269,1497,440,109,160,0,actualidad,55,2025-03-01 19:05:02,Mauro_Nacho,elpais.com,https://elpais.com/economia/2025-02-28/el-deficit-comercial-de-estados-unidos-pulveriza-records-en-plena-ofensiva-de-aranceles-de-trump.html,2025-03-04 14:12:50
