news_id,title,content,full_story_link,meneos,clicks,karma,positive_votes,anonymous_votes,negative_votes,category,comments,published_date,user,source,source_link,scraped_date
4033257,"Tras el cruce con Trump, Milei ordenó borrar sus fotos con Zelenski","Milei ordenó romper lazos diplomáticos con Ucrania y borró todas sus fotos con Volodimir Zelenski. «Lo que pasó hoy es un antes y un despues», manifestaron en Cancillería. El enfrentamiento vivido este viernes en el Despacho Oval de la Casa Blanca entre el presidente de Ucrania, Volodímir Zelenski, y su homólogo estadounidense, Donald Trump, desató un terremoto en la Cancillería Argentina. Confundidos, los diplomáticos recibieron en horas de la tarde plegarse a la estrategia de Trump y Putin.",https://meneame.net/story/tras-cruce-trump-milei-ordeno-borrar-fotos-zelenski,338,659,433,142,196,1,politica,67,2025-03-01 18:40:02,TooBased,rtn.com.ar,https://rtn.com.ar/tras-el-cruce-con-trump-milei-ordeno-borrar-sus-fotos-con-zelenski/,2025-03-04 14:12:50
4033197,La discusión integra entre D. Trump y V. Zelenaky en la reunión sobre Ucrania en la Casa Blanca [Subtitulada],"La reunión entre Donald Trump y Volodímir Zelenski en la Casa Blanca ha sido un completo desastre. Trump ha reprendido públicamente a Zelenski en el Despacho Oval, acusándolo de ""jugar con la tercera guerra mundial"", lo que ha dejado al futuro de Ucrania en una situación incierta. El presidente estadounidense ha cancelado la rueda de prensa conjunta y ha expresado en redes sociales que su homólogo ucraniano ""no está preparado para la paz"".",https://meneame.net/story/discusion-integra-entre-d-trump-v-zelenaky-reunion-sobre-ucrania,218,2169,491,103,115,0,actualidad,198,2025-03-01 18:00:02,perogrullobrrr,youtube.com,https://www.youtube.com/watch?si=fy7kJFlRAhijrBdh&v=x0FsiAurZnM,2025-03-04 14:12:50
4033264,"Barómetro laSexta | Un 86,5% de los votantes del PP no creen las explicaciones de Mazón sobre la gestión de la DANA","El 88% de los encuestados en la Comunidad Valenciana cree que el president miente y el 92,7% considera, igualmente, que sus explicaciones son ""insuficientes"".",https://meneame.net/story/barometro-lasexta-86-5-votantes-pp-no-creen-explicaciones-mazon,392,543,444,145,247,2,politica,64,2025-03-01 17:55:02,Esteban_Rosador,lasexta.com,https://www.lasexta.com/noticias/nacional/barometro-lasexta-865-votantes-creen-explicaciones-mazon-gestion-dana_2025030167c2fece1ba314000109a6be.html,2025-03-04 14:12:50
4033270,Afectados piden en los tribunales el suspenso de los bloqueos de LaLiga demostrando cómo daña a terceros,"La última campaña de bloqueos indiscriminados ejercida por LaLiga y Telefónica para perseguir las emisiones piratas durante los partidos de fútbol, podría tener las horas contadas si sale adelante la solicitud presentada por un grupo de afectados ante el juez que autorizó las medidas. La comunidad de ciberseguridad y organizadores del congreso Rooted CON ha dicho basta a los bloqueos de LaLiga.",https://meneame.net/story/afectados-piden-tribunales-suspenso-bloqueos-laliga-demostrando,418,738,428,164,254,0,tecnología,20,2025-03-01 17:20:03,Pablosky,bandaancha.eu,https://bandaancha.eu/articulos/grupo-afectados-pide-tribunales-suspenso-11266,2025-03-04 14:12:50
4033246,"Abascal defiende a Trump y carga contra los líderes europeos por ""celebrar"" que no se firmara el acuerdo con Zelenski","El presidente de Vox, Santiago Abascal, ha cargado contra los políticos españoles e internacionales, entre ellos el presidente del Gobierno, Pedro Sánchez, y el presidente del PP, Alberto Núñez Feijóo, por “celebrar” que no se firmara el acuerdo sobre tierras raras entre EEUU y Ucrania y que podría “ser el principio del fin de la guerra”.",https://meneame.net/story/abascal-defiende-trump-carga-contra-lideres-europeos-celebrar-no,351,543,415,149,202,0,politica,144,2025-03-01 16:55:03,bonobo,elindependiente.com,https://www.elindependiente.com/espana/2025/03/01/abascal-defiende-a-trump-y-carga-contra-los-lideres-europeos-por-celebrar-que-no-se-firmara-el-acuerdo-con-zelenski/,2025-03-04 14:12:50
4033210,Lo de que los jóvenes son de derechas,"Hay un tuit que me gusta mucho y que dice así: “Facebook le ha hecho a nuestros padres lo que siempre dijeron que los videojuegos nos harían a nosotros”. Efectivamente, mientras generaciones enteras se preocupan por la progresiva e inevitable degeneración de “los jóvenes”, están viviendo en cámaras de eco llenas de bulos que se tragan sin rechistar...",https://meneame.net/story/jovenes-son-derechas-1,203,2058,427,94,109,2,actualidad,94,2025-03-01 16:20:03,CosasQueLees,publico.es,https://www.publico.es/opinion/columnas/jovenes-son-derechas.html,2025-03-04 14:12:50
4033258,"Gritos de '¡El president, a Picassent!' y pancartas de 'asesino' contra un Mazón ausente en el arranque de las Fallas","Los valencianos y las valencianas han expresado su descontento contra la gestión del president en la DANA, después de que además haya cambiado de nuevo de versión sobre la hora a la que llegó al CECOPI.",https://meneame.net/story/gritos-president-picassent-pancartas-asesino-contra-mazon-fallas,359,448,408,127,232,0,actualidad,21,2025-03-01 15:50:02,Tkachenko,lasexta.com,https://www.lasexta.com/noticias/nacional/gritos-president-picassent-pancartas-asesino-mazon-ausente-arranque-fallas_2025030167c31216829a09000193c20a.html,2025-03-04 14:12:50
4032960,Ayuso evita respaldar la gestión de Mazón durante la dana,"Díaz Ayuso ha afirmado que se le «escapa de quién depende» algunos de los acontecimientos que ocurrieron el día de la dana, como las aguas torrenciales que llegaron a algunos municipios en los que no llovía.",https://meneame.net/story/ayuso-evita-respaldar-gestion-mazon-durante-dana,218,407,361,94,124,0,politica,46,2025-03-01 15:40:02,Tkachenko,efe.com,https://efe.com/espana/2025-02-28/ayuso-mazon-dana-dimision/,2025-03-04 14:12:50
4033164,Los partidarios de Trump pierden 12.000 millones de dólares por el desplome de la criptomoneda del presidente [ENG],La «moneda meme» de Donald Trump pierde el 80% de su valor desde su investidura en medio de un desplome generalizado del mercado,https://meneame.net/story/partidarios-trump-pierden-12-000-millones-dolares-desplome-eng,423,1029,382,162,261,3,actualidad,104,2025-03-01 14:40:03,Mediorco,telegraph.co.uk,https://www.telegraph.co.uk/business/2025/02/27/trump-supporters-lose-12bn-as-presidents-crypto-boom-fades/,2025-03-04 14:12:50
4032855,Los autos de la jueza de la DANA y los silencios de la exconsellera Pradas acorralan a Mazón,La investigación judicial no ha hecho sino agravar su gestión de la catástrofe hasta el punto de utilizar como estrategia de defensa que se demoró todavía más en ponerse al frente de la emergencia. Los audios manipulados y un cambio radical de versión sobre lo que estaba haciendo durante la tarde del 29 de octubre no le ayudan a ganar confianza en Génova 13. Su paradero desde las 18.45 hasta que una cámara de À Punt lo capta a las 20.30 horas es un secreto que nadie ha desvelado.,https://meneame.net/story/autos-jueza-dana-silencios-exconsellera-pradas-acorralan-mazon,329,679,410,119,210,0,politica,29,2025-03-01 13:50:03,doyou,eldiario.es,https://www.eldiario.es/comunitat-valenciana/politica/autos-jueza-dana-silencios-exconsellera-pradas-acorralan-mazon_1_12090742.html,2025-03-04 14:12:50
4033201,"Un experto en ciberseguridad de la Universidad de Berkley carga contra las criptomonedas tras lo sucedido con Trump y Milei: ""es un esquema Ponzi""","Nos hemos acostumbrado a que la mayoría de comunicaciones y análisis sobre el mundo de las criptomonedas vengan de parte de los propios inversores. Sin embargo, de vez en cuando surgen voces distintas como la de Nicholas Weaver, astrofísico e investigador del Instituto Internacional de Ciencias de la Computación de California, que nos dan una visión completamente distinta de lo que ocurre alrededor del precio del Bitcoin y las polémicas alrededor de las cripto.",https://meneame.net/story/experto-ciberseguridad-universidad-berkley-carga-contra-tras,295,1456,422,118,177,4,actualidad,91,2025-03-01 13:15:03,Sinfonico,3djuegos.com,https://www.3djuegos.com/3djuegos-trivia/noticias/objetivo-mercado-criptomonedas-estafas-experto-ciberseguridad-carga-bitcoin-asegura-que-esquema-ponzi,2025-03-04 14:12:50
4033182,Transcripción editada del discurso del profesor Jeffrey Sachs en el Parlamento Europeo,"Jeffrey Sachs, en el Parlamento Europeo, carga contra la política exterior de EE.UU.: guerras, expansión de la OTAN y sumisión europea. ¿Paz? Solo si Europa deja de ser un vasallo.",https://meneame.net/story/transcripcion-editada-discurso-profesor-jeffrey-sachs-parlamento,249,2017,412,114,135,9,actualidad,51,2025-03-01 12:50:02,AntonPirulero,rafaelpoch.com,https://rafaelpoch.com/2025/02/28/la-geopolitica-de-la-paz/,2025-03-04 14:12:50
4032939,"Cómo Grok, la IA de Twitter (X), está dando instrucciones para fabricar explosivos, armas químicas y nucleares de destrucción masiva","Varios usuarios de Twitter han denunciado que Grok 3, el nuevo modelo de inteligencia artificial de la plataforma, proporciona una guía detallada sobre cómo fabricar armas nucleares encubiertas, explosivos y minas. Alertan de la facilidad para engañar a este modelo de IA para que revele esta información, por ejemplo, haciéndole creer que está hablando con Elon Musk. Expertos en inteligencia artificial han publicado en sus redes sociales y advertido a Maldita.es de la falta de mecanismos de ética y de seguridad que tiene Grok 3.",https://meneame.net/story/como-grok-ia-twitter-x-esta-dando-instrucciones-fabricar-armas,258,864,386,98,160,5,tecnología,47,2025-03-01 12:20:02,Vlemix,maldita.es,https://maldita.es/malditatecnologia/20250224/grok-twitter-instrucciones-fabricar-armas-nucleares/,2025-03-04 14:12:50
4033154,“Sigo llorando a mi padre en un lugar lleno de mierda”: los efectos aún visibles de la Dana tras cuatro meses de “abandono” en Catarroja,"A Felipe García, como a otros muchos vecinos de la localidad valenciana de Catarroja, la tromba de agua del pasado 29 de octubre le pilló por sorpresa en plena calle. Se subió a una valla para no ser arrastrado por la riada y ahí aguantó “hasta que no pudo más”. Su familia lo buscó incansablemente hasta que su cuerpo apareció 10 días después a varios kilómetros del pueblo. Fueron varios voluntarios quienes lo hallaron. Cuatro meses después de aquel fatídico día en el que las autoridades no alertaron a tiempo por teléfono a la población.",https://meneame.net/story/sigo-llorando-padre-lugar-lleno-mierda-efectos-aun-visibles-dana,332,791,443,121,211,0,actualidad,38,2025-03-01 11:35:06,Elnuberu,infobae.com,https://www.infobae.com/espana/2025/03/01/sigo-llorando-a-mi-padre-en-un-lugar-lleno-de-mierda-los-efectos-aun-visibles-de-la-dana-tras-cuatro-meses-de-abandono-en-catarroja/,2025-03-04 14:12:50
4033123,India y la UE unen fuerzas: tratado de libre comercio para desafiar a Estados Unidos y China,"Ambas partes acordaron concluir un acuerdo de libre comercio para finales de este año, después de años de negociaciones que no llegaron a un fin. El pacto, considerado el más grande del mundo, busca fortalecer la cooperación en tecnología, defensa y comercio, mientras ambas partes enfrentan desafíos económicos como las amenazas arancelarias de Estados Unidos.",https://meneame.net/story/india-ue-unen-fuerzas-tratado-libre-comercio-desafiar-estados,371,744,403,143,228,2,actualidad,103,2025-03-01 11:20:07,Dragstat,france24.com,https://www.france24.com/es/programas/economía/20250228-india-y-la-ue-unen-fuerzas-tratado-de-libre-comercio-para-desafiar-a-estados-unidos-y-china,2025-03-04 14:12:50
4033029,DanielFez: Como tener un Bugatti según Llados,Llados: “vi un reel de una persona y ponía que hay 4 billones de hombres en el mundo y solo 500 Bugatti Chyron”,https://meneame.net/story/danielfez-como-tener-bugatti-segun-llados,228,7074,478,107,121,12,ocio,58,2025-03-01 10:45:05,Verdaderofalso,youtube.com,https://www.youtube.com/watch?si=cZVjR3xgwr8SSYYs&v=X0iF4VloS_A,2025-03-04 14:12:50
4033112,Paseo por la Torre del Reloj: cómo se gestó en la Barcelona de hace 230 años el sistema métrico que usamos hoy,"Los yates de lujo que fondean en Barcelona, propiedad de magnates de medio mundo, conviven todavía hoy en el Port Vell con una veintena botes pesqueros. Les separa un pequeño muelle, el de Pescadores, presidido por la Torre del Reloj, un viejo faro que ha sido testigo del último cuarto de milenio del Puerto, pero sobre todo de uno de los grandes hitos de la historia de la ciencia: la creación del metro como unidad de medida universal.",https://meneame.net/story/paseo-torre-reloj-como-gesto-barcelona-hace-230-anos-sistema-hoy,135,1277,436,75,60,0,cultura,17,2025-03-01 10:25:07,arariel,eldiario.es,https://www.eldiario.es/catalunya/paseo-torre-reloj-gesto-barcelona-230-anos-sistema-metrico-hoy_1_12082723.html,2025-03-04 14:12:50
4033156,Interior asegura que no vio nada extraño en el registro de un grupo neonazi como asociación legal,Núcleo Nacional consiguió su inscripción en el Registro Nacional de Asociaciones en agosto pasado. En sus estatutos se presentó como un colectivo con fines deportivos o de protección de la naturaleza,https://meneame.net/story/interior-asegura-no-vio-nada-extrano-registro-grupo-neonazi-como,324,505,424,124,200,1,actualidad,74,2025-03-01 10:25:05,Tkachenko,publico.es,https://www.publico.es/politica/interior-asegura-vio-extrano-registro-grupo-neonazi-asociacion-legal.html,2025-03-04 14:12:50
4033163,"Juliana: ""EEUU empujó a Ucrania a las puertas de la OTAN y ahora matan a Zelenski en directo""","""La figura de Zelenski sí ya estaba debilitada, pues ahora lo está aún más desde el punto de vista de las negociaciones. Ahora mismo, Rusia, desde el Kremlin, deben estar brindando porque han ganado una negociación porque la parte acaba de liquidar a la figura visible de la resistencia ucraniana"", apunta en relación a cómo se encuentra la figura internacional del líder ucraniano.",https://meneame.net/story/juliana-eeuu-empujo-ucrania-puertas-otan-ahora-matan-zelenski,417,1742,417,157,260,2,actualidad,154,2025-03-01 10:00:06,Dav3n,cadenaser.com,https://cadenaser.com/nacional/2025/02/28/enric-juliana-eeuu-empujo-a-ucrania-a-las-puertas-de-la-otan-y-ahora-matan-a-zelenski-en-directo-cadena-ser/,2025-03-04 14:12:50
4033114,China descubre una fuente de energía “ilimitada” que podría “alimentar al país durante 60.000 años” [ENG],"China ha descubierto una fuente de energía ""infinita"" que podría suministrar suficiente combustible para abastecer al país durante 60.000 años, afirmaron geólogos en Pekín. El complejo minero de Bayan Obo, en Mongolia Interior, una región autónoma del norte de China, podría contener suficiente torio para satisfacer las demandas energéticas de los hogares chinos ""casi para siempre"", según un estudio nacional. Este elemento ligeramente radiactivo puede utilizarse para crear un tipo de central nuclear llamada reactor de sal fundida, que...",https://meneame.net/story/china-descubre-fuente-energia-ilimitada-podria-alimentar-pais-60,235,2225,414,91,144,14,actualidad,93,2025-03-01 09:25:05,Bifaz,dailymail.co.uk,https://www.dailymail.co.uk/news/article-14447257/China-discovers-limitless-energy-source-power-country.html,2025-03-04 14:12:53
4032983,El trumpismo del deporte; «Lo que ha hecho la AMA con Jannik Sinner es el fin del sistema antidopaje como lo hemos conocido»,"Absueltos de forma injustificable por la ITIA, la AMA se fingió muy severa y preocupada y, al mismo tiempo, le ofreció un acuerdo con una sanción de tres meses que coincidía casualmente con un periodo sin Grand Slams que le permite llegar justo a tiempo para Roland Garros. Un insulto a todos los aficionados, que se lo tienen que tragar porque viene dado desde una posición de fuerza. Trumpismo puro.",https://meneame.net/story/trumpismo-deporte-ha-hecho-ama-jannik-sinner-fin-sistema-como,260,1062,401,86,174,3,cultura,26,2025-03-01 08:55:05,nomassuf,sport.jotdown.es,https://sport.jotdown.es/2025/02/27/jannik-sinner/,2025-03-04 14:12:53
4033130,La reunión (por Roger Senserrich),"Uno de espectáculos más vergonzosos de la era Trump.  A estas alturas, supongo que habréis visto el video de esa reunión en el despacho oval. La de J.D. Vance, Marco Rubio, y un hombre que dice ser el Presidente de Estados Unidos, Donald Trump. Es un espectáculo lamentable, patético. Un jefe de estado no organiza una reunión con el jefe de estado de un (téorico) aliado delante de los medios, le miente y menosprecia repetidamente a la cara, y acaba por gritarle, tratándole como un vasallo que debe rendirle pleitesía.",https://meneame.net/story/reunion-roger-senserrich,303,3704,376,133,170,2,actualidad,186,2025-03-01 08:15:05,Horus,4freedoms.es,https://www.4freedoms.es/p/la-reunion,2025-03-04 14:12:53
4033071,El Departamento de Estado pone fin al apoyo de EE.UU. a la restauración de la red eléctrica de Ucrania (EN),La iniciativa de USAID había invertido cientos de millones de dólares para ayudar a la red energética de Ucrania a recuperarse de los ataques de Rusia.,https://meneame.net/story/departamento-estado-pone-fin-apoyo-ee-uu-restauracion-red,273,456,373,124,149,0,actualidad,76,2025-03-01 07:25:10,Tkachenko,nbcnews.com,https://www.nbcnews.com/politics/state-department-terminates-us-support-ukraine-energy-grid-restoration-rcna194259,2025-03-04 14:12:53
4032797,"Mazón, escapista",Las contradicciones de Carlos Mazón en sus versiones sobre su actuación durante la emergencia de la DANA han estallado con la afirmación de que llegó al Cecopi incluso después de que se enviara la ya tardía e inútil alerta a todos los móviles. Intenta desesperadamente escapar de la investigación judicial sin tener que dimitir como presidente de la Generalitat Valenciana,https://meneame.net/story/mazon-escapista,196,480,401,66,130,0,politica,14,2025-03-01 06:35:08,Esteban_Rosador,eldiario.es,https://www.eldiario.es/comunitat-valenciana/siete-dias/mazon-escapista_132_12090838.html,2025-03-04 14:12:53
4033072,Europa muestra su respaldo a Zelenski tras su tenso encontronazo con Trump en la Casa Blanca,"Europa ha comenzado a mostrar su apoyo a Zelenski momentos después del tenso encuentro entre el presidente ucraniano y el estadounidense Donald Trump. Uno de los primeros en reaccionar ha sido el presidente francés, Emmanuel Macron, que ha asegurado que el mundo ""debe respetar a aquellos que han luchado desde el principio"". El presidente del Gobierno de España, Pedro Sánchez, ha escrito un conciso mensaje a través de la red social X donde ha mostrado públicamente su cierre de files con Zelenski tras su bronca con Trump.",https://meneame.net/story/europa-muestra-respaldo-zelenski-tras-tenso-encontronazo-trump,295,769,379,122,173,3,actualidad,153,2025-03-01 05:50:04,Grahml,cadenaser.com,https://cadenaser.com/nacional/2025/02/28/europa-muestra-su-respaldo-a-zelenski-tras-su-tenso-encontronazo-con-trump-en-la-casa-blanca-cadena-ser/,2025-03-04 14:12:53
4033092,▷ Culebrillas ciegas. Las grandes desconocidas de la herpetofauna ibérica,"Los anfisbenas, anfisbenios, anfisbénidos o culebrillas ciegas (Amphisbaenia), son un suborden peculiar y poco conocido de reptiles sin patas adaptados a la vida subterránea. NO SON SERPIENTES NI CULEBRAS, SINO OTRO SUBORDEN DE REPTILES, que junto a tortugas, serpientes y lagartos forman las 4 patas taxonómicas de los reptiles. Su nombre procede de Amphisbaenia, que significa «que va en dos direcciones», ya que tienen la capacidad de desplazarse bidireccionalmente. Si sumamos a esto que no se distingue bien cual es la cola y cual la cabeza,",https://meneame.net/story/culebrillas-ciegas-grandes-desconocidas-herpetofauna-iberica,113,828,377,56,57,0,ciencia,18,2025-03-01 05:00:02,lectorcritico,bicheando.net,https://bicheando.net/2019/03/culebrillas-ciegas-las-grandes-desconocidas-de-la-herpetofauna-iberica/,2025-03-04 14:12:53
4033004,Liberaciones En Palestina: Asimetrías De Un Conflicto,"El llamado conflicto palestinoisraelí es uno de los más asimétricos que existen en el mundo. Un desbalance que se observa, también, en las liberaciones mutuas que llevan adelante ambas partes en estas semanas",https://meneame.net/story/liberaciones-palestina-asimetrias-conflicto,121,367,388,60,61,2,mnm,17,2025-03-01 04:10:03,Mark_Renton_1,youtube.com,https://www.youtube.com/watch?si=NkQoZo0E6CnmcmPC&v=XTwOqWZ416U,2025-03-04 14:12:53
4033052,China ejecuta a una de sus mayores traficantes de niños,"La primera víctima de Yu Huaying fue su propio hijo, al que vendió a una familia por 5.000 yuanes, que al cambio son alrededor de 660 euros. Aquello ocurrió en 1993 en la provincia de Guizhou, al suroeste de China. Durante los siguientes 10 años, Yu se dedicó a secuestrar niños.",https://meneame.net/story/china-ejecuta-mayores-traficantes-ninos,194,1736,398,80,114,1,actualidad,54,2025-03-01 03:25:03,turuleto,elmundo.es,https://www.elmundo.es/internacional/2025/02/28/67c1713f21efa0af5b8b4580.html,2025-03-04 14:12:53
4033108,La embajadora de Ucrania en Estados Unidos se lleva las manos a la cabeza durante la bronca de Trump a Zelenski,"Mientras los tres políticos cruzaban reproches, la embajadora de Ucrania en Estados Unidos, Oksana Markarova, ha sido enfocada por una de las cámaras presentes en el Despacho Oval llevándose las manos a la cabeza lamentándose por la tensa situación que se estaba viviendo en la Casa Blanca.",https://meneame.net/story/embajadora-ucrania-estados-unidos-lleva-manos-cabeza-durante,239,3174,406,97,142,1,actualidad,47,2025-03-01 02:40:02,karakol,cadenaser.com,https://cadenaser.com/nacional/2025/02/28/la-embajadora-de-ucrania-en-estados-unidos-se-lleva-las-manos-a-la-cabeza-durante-la-bronca-de-trump-a-zelenski-cadena-ser/,2025-03-04 14:12:53
4032954,Luis Medina se defiende recordando que el hermano de Ayuso también dio un pelotazo con la venta de mascarillas sin consecuencias,"""El tema ético o moral no tiene nada que ver con la estafa"", ha agregado el letrado, quien ha insistido en que la empresa malaya Leno podía pagar los comisiones que quisiera. Ayer, Alberto Luceño manifestó que fue el proveedor el que fijó la cantidad de dinero que iban a recibir por la operación.",https://meneame.net/story/luis-medina-defiende-recordando-hermano-ayuso-tambien-dio-venta,430,460,382,151,279,0,actualidad,40,2025-03-01 02:00:03,Ratoncolorao,lasexta.com,https://www.lasexta.com/noticias/nacional/luis-medina-defiende-recordando-que-hermano-ayuso-tambien-dio-pelotazo-venta-mascarillas-consecuencias_2025022767c06dbf829a0900018f777c.html,2025-03-04 14:12:53
4033049,Los usuarios de Firefox están furiosos por los preocupantes cambios de Mozilla en el uso compartido de datos [ING],"Los usuarios de Reddit que han instalado Firefox recibieron una notificación preocupante en sus teléfonos Android esta semana, en la que se destacaba que los hábitos de intercambio de datos de la aplicación, en particular los relacionados con la ubicación, habían cambiado. Esta notificación parece estar relacionada con un cambio en la declaración de intercambio de datos de Mozilla Firefox, tal como se detalla en una sección de preguntas frecuentes sobre la política de privacidad revisada publicada esta semana.",https://meneame.net/story/usuarios-firefox-estan-furiosos-preocupantes-cambios-mozilla-uso,167,770,408,72,95,1,tecnología,55,2025-03-01 01:10:03,gelatti,androidauthority.com,https://www.androidauthority.com/firefox-data-sharing-change-3530771/,2025-03-04 14:12:53
4033098,"Trump exigió a su personal en la Casa Blanca que echara a Zelenski y la delegación ucraniana tras su enfrentamiento, según la 'CNN'","Según ha explicado la 'CNN', el republicano y el ucraniano se han marchado a salas separadas después de su tenso encuentro frente a los periodistas. Mientras que Zelenski y la delegación ucraniana querían continuar las conversaciones, la administración Trump ha dejado claro que era hora de terminarlas. El medio americano ha señalado, además, que ha sido el propio presidente Trump quien ha pedido que enseñaran la puerta de salida a Zelenski, según ha contado un funcionario de la Casa Blanca.",https://meneame.net/story/trump-exigio-personal-casa-blanca-echara-zelenski-delegacion-cnn,360,1135,457,139,221,2,actualidad,98,2025-03-01 00:30:03,xeldom,cadenaser.com,https://cadenaser.com/nacional/2025/02/28/trump-exigio-a-su-personal-en-la-casa-blanca-que-echara-a-zelenski-y-la-delegacion-ucraniana-tras-su-enfrentamiento-segun-la-cnn-cadena-ser/,2025-03-04 14:12:53
4033060,"Zelenski agradece a Trump el encuentro en la Casa Blanca y dice que Ucrania seguirá buscando una ""paz justa""","El presidente ucraniano, Volodimir Zelenski, ha agradecido a su homólogo estadounidense, Donald Trump, el encuentro que han mantenido este viernes en la Casa Blanca, poco después de abandonarla en medio de una fuerte crispación y ha asegurado que Ucrania seguirá trabajando para lograr una ""paz justa y duradera"". ""Gracias, Estados Unidos, gracias por su apoyo, gracias por esta visita. Gracias presidente Trump, Congreso y pueblo estadounidense. Ucrania necesita una paz justa y duradera y estamos trabajando precisamente para conseguirlo"".",https://meneame.net/story/zelenski-agradece-trump-encuentro-casa-blanca-dice-ucrania-paz,201,448,459,87,114,0,actualidad,162,2025-03-01 00:15:02,Lord_Cromwell,europapress.es,https://www.europapress.es/internacional/noticia-zelenski-agradece-trump-encuentro-casa-blanca-dice-ucrania-seguira-buscando-paz-justa-20250228204636.html,2025-03-04 14:12:53
